,body
33,"one thing to consider is, brown is very undergrad focused. at brown, undergrads are little over 2x the size of grad population. at mit, grad population is little over 1.5x undergrad population. what this means is that professors at brown often have very small research groups (like 1~5 phd students per professor) so finding research groups is very easy and you get a lot of individual attention from professors. some of the professors i met at brown have become my strongest advocates and i will eternally be grateful to them. i'm now heading to stanford for phd where grad students are little over 1.4x undergrad population. i'm personally very satisfied with this trajectory because i get to go to undergrad focused school for undergrad and grad focused school for grad.

as for friends, i made some of my closest friends while tackling psets together! in brown's math program, you will also discover the joys of pset parties!! this was the case for me in my math and physics classes. also, brown's math department in particular, i would say, is pretty tight knit (check out friday math tea sessions if you end up choosing brown!). i made some really great friends through the math dept even though i'm physics.

regarding academics, i think that brown has quite strong pure math programs, although if you are looking to go more bio side, brown has a fantastic applied math program! you can also venture into biostatistics which is a separate program administered under the masters in public health (but undergrads can take the courses. i myself took a statistical data analysis class in biostat program).

on a final note, i'm sure mit students have great post-grad outcomes, but brown students also end up in fantastic places! i didn't know many premed very well personally, but the three that i know ended up in johns hopkins, columbia, and uchicago med schools. i know far more people who went to other grad schools, and the vast majority ended up in top 10 institutions (i can remember 1 harvard law, most common destinations from physics seemed like stanford/harvard/mit, chemistry ended up in caltech/harvard, princeton seemed to be a popular destination for cs phds, idk the rest), so i don't think you need to worry about how strong your research profile will become at brown as opposed to mit!"
34,"shoot. i'm going back to look this up and i think i had a little brain mix-up between harvard and mit. sorry bout that. you can definitely do it with harvard though: https://courses.harvard.edu/crossregistration.html

however, i did hear of someone from brown who was taking math classes at mit. i can't find any official program for this but i'm guessing they made this happen by talking to people"
35,"1. in my years at brown, i've never encountered any sort of large scale event. that might be a combination of various factors ranging from ""i don't care"" to ""different social groups"". i mean they must be kinda doing something since we have a sort of lgbt greek society, but even on that my knowledge is murky at best since i only have a single friend in greek life, and he's in sigma chi, which if i had to wager, is not lgbt-themed 
2. you'll run into some people who legit are classist as fuck. i have a friend who decided to stop talking to someone because the kid's parents weren't of 'good stock'. true story. of course the whole canada goose meme circulates like the flu on the meme page, but generally, most people don't seem to give a shit and outwardly, will treat you with little apparent bias. that has just been my experience as an upper middle class asian dude. your mileage may vary. but again, i reiterate that like 99% of people don't seem to *overtly* show any signs of classism or elitism. 
3. yeah i can't answer that. it's called like an 'independent concentration' or something like that and you'd very obviously need to work closely with the school to make sure you actually have a degree and not a piece of fancy toilet paper after your 4 years. from what i have surmised by talking to friends who have since graduated, this 'ic' is pretty rare. check it out [here](https://www.brown.edu/academics/college/advising/curricular-resource-center/independent-concentrations/current-independent-concentrators/current-independent-concentrators)
4. ~~i chose brown because i got rejected by harvard~~ i'm kidding i didn't apply to harvard. i chose brown because i hate the idea of general ed and english classes. i also came with the misguided notion that all the faculty here are amazing teachers and that i was ready for that small class experience, but man we've got some *shitty* professors here."
36,"harvard-yale, princeton-penn, cornell-dartmouth, leaving us with columbia? makes sense i guess given our polar opposite academic philosophies. "
37,"in theory dartmouth, but nobody cared when i was there. the real ""rival"" was harvard bc we wanted to be better than them."
38,brown-harvard football is usually the best tailgate and has the best attendance of the season
39,"i don't know about the first, but as far as the motivation of the school, i think its just to avoid the stigma of associated with having sexual assault on campus. also maybe the policy just a relic of a time when people didnt take this as seriously. whatever the motivation, brown is definitely not the only school on this boat
* at harvard--> http://www.theguardian.com/commentisfree/2014/apr/03/ivy-league-harvard-anonymous-sexual-assault-victim
* at dartmouth-->
http://www.bostonglobe.com/metro/2014/04/16/dartmouth-president-says-ivy-league-school-being-hijacked-drinking-assault-and-other-social-ills/jrzkfsqvsgqbelgk28yilm/story.html
* at columbia-->
http://www.thenation.com/blog/178287/sexual-assault-policies-under-fire-columbia
"
40,"there are people who are too full of themselves everywhere.  i would estimate that people (outwardly) like him are a minority at brown, harvard, and elsewhere.  i could definitely see this in the brown noser, though."
41,"i know you're not trying to suggest that you're seriously considering doing this, but i'm just trying to provide something on s/nc.  like others, i've heard vague stories, but that's about it. i'm definitely interested in hearing concrete stories. so, i upvoted. if whoever is reading this comment is not looking for advice, then ignore the paragraph below.

rumor has it that someone took all their courses s/nc and somehow got into harvard med... must've been killer rec's. even if so, this may be the anomaly. if you're in the math or sciences, you would need to do a lot of explaining, perhaps even provide proof that you didn't get all c's. this can be supported if there are course performance reports along with good recommendations and/or relevant extracurricular activities. they'll have to show proof of s with distinction, which doesn't even show in internal transcripts, but only in a temporary place in banner.  for industry, research, and grad school, it'll most likely be an uphill battle. i'm pretty sure i wouldn't have gotten into grad school if i took all s/nc in engineering, even if i explained the purpose of s/nc.  do i have proof? no, but for the above areas i mentioned -- which i can only speak for since i concentrated in a similar area -- one would have to think who else they are up against that didn't have the s/nc option in other schools such as mit (pass/d/f with a limit and major-related restrictions) and georgia tech (pass/fail with a limit and possible major-related restrictions).  if you're in engineering, keep in mind that brown isn't quite known for it, even though it's good (i've met many that responded with ""brown has engineering?""). brown is a great university with a great name, but that can only go so far, and your application would require additional support.  i'm going to guess that in other areas, if you take a lot of s/nc courses, you would likely need additional support as well. i'd say (and many would probably agree) that if it's not for a requirement, feel free to take s/nc. it would be easy to explain in that respect. whoever is in the math or sciences and takes all s/nc has some serious guts."
42,"i studied physics at brown, worked in defense scientific software for a year, now starting phd in physics this year.

if you study up to the level of phd in physics, your job prospects are fantastic! your thesis could have been in string theory and finance companies are still going to want you to do their stock market prediction models. professorship is harder to get than ever, but many industry research arms are often looking for a physics phd. if you are strategic, your thesis could be quite related to your job (basically if you do solid state research, semiconductor giants and quantum computing companies will welcome you with open arms). if you do computational research, transitioning into software is crazy easy (tbh this is true even if you don't do computational research). there are also national labs that are hungry for new phds--their trouble is attracting talent to live in the middle of nowhere, which can also be said for many defense giants.

even if you stop after your bachelors, if you know how to program, you will still have an easy time finding a job. i took only 3 coding classes at brown (none in cs), and did some computational physics research, and had tons of job offers for software/data science positions from big corporations. i don't know much about gtech, but brown physics students have top grad school placements and brown cs students have top industry placements. anecdotally (from people whose outcomes i know personally), the most popular phd destinations for physics students are harvard, mit, stanford, and most popular cs placements are google, microsoft, and fb.

i think ee/ce at brown is also pretty great, though i can't speak a ton on it because i don't know as many people in ee or ce. i know one ee who got grad offers from uchicago and columbia and chose to go to columbia. the one ce i know ended up at microsoft (they were kind of pivoting towards comp sci near graduation though). i heard that quite a few ees end up at boeing every year.

at the end of the day, individual field rankings at these schools don't matter for undergrad (they matter more on grad school level). just go for what your gut feeling is telling you, and you'll do great no matter what your choice may be!"
43,"i do believe that it is mostly the major/career choice that explains this difference. but regardless, the question for you is: what college will you attend if it's not brown and how much will it cost you? if your alternative is going to harvard, well, provided you do well there, you'll probably make more money in the future. if you alternative is going to wichita st or de vry (hehe), maybe not so much. if you don't have an offer to attend another ivy league, then the comparison in the article is pretty irrelevant for you.

for example, according to [this article](http://www.businessinsider.com/top-25-best-colleges-salaries-2016-9), when you consider all universities, brown is 20th overall in income 10 years after graduation. that sounds pretty good to me. do you have an offer of admission to any other universities in that list? again, the relevant question is what's the best university you are able to attend, the rest doesn't matter."
44,"and can you clarify why you think harvard would provide more money, given that brown is also an ivy? 

i think what i'm trying to ask is that in your personal experience, what do you honestly think brown hasn't given you career-outcomewise that your peers at other colleges might have?

and once again, all these colleges are great, but i do have the decision to choose between two great institutions, which is why i'm making these fine distinctions."
45,"i was a grad student at brown so i don't think i can give an accurate answer to your second question. the best i can say is that i have met people in cs, apma, and econ, and i think it's a great combination to study at brown.

back to your first question, sure, both harvard and brown are ivies but that does not mean they are identical. and as much as brown is a very prestigious university, harvard is a step above.

but, this really doesn't matter to you, you have to think about brown and duke. about that, i would encourage you to take a look at [this article](https://www.nytimes.com/interactive/2017/01/18/upshot/some-colleges-have-more-students-from-the-top-1-percent-than-the-bottom-60.html) (interestingly, coauthored by a brown professor): it shows how different colleges compare in terms of what socioeconomic background their students come from and how they do later in life. you can make the tables show you duke and brown and you'll see that they look fairly similar in that regard but brown seems to be a bit more successful in making its students who come from the bottom 40% of the income distribution make it to the top 40%.

so all in all, i would just try to figure out which one of the two feels like the best fit for you personally. if you are happy at the university you choose, you'll do better, and that's gonna have a big impact in how you fare afterwards.



"
46,"brown does not have secret societies in the sense of yale or harvard.

as far as traditional secret societies go, secrecy is valuable as a form of social currency. our greek-letter organizations (which gave up ownership of their clubhouses decades ago) are still secret in this way, with each of them having rituals that help the members bond and create a sense of organizational pride. however, secrecy is cumbersome, and it's extraordinarily difficult to keep a secret social society going if it does not have some form of permanent meeting space. brown's greek letter organizations are granted semi-permanent space in the dorms on wriston quad.

you should be skeptical of any supposedly old societies that do _not_ have clubhouses. it's far easier to convincingly fake a secret society than it is to run an actual organization, and /u/iamthewaffler severely underestimates how much fun it is to do so."
47,"brown is an undergraduate based school 100%, i’m an engineer and they had to build a multi multi million dollar engineering building just to finally attract mediocre graduate talent as compared to other schools like yale, harvard, princeton, mit. brown is not known for its grad for a reason, we attract some of the fiercest competition for undergrad for a reason. trust me brown is begging students to stay for grad but they just aren’t so of that doesn’t tell you idk what will."
48,"you can find the number of applicants from brown at [https://www.aamc.org/data/facts/applicantmatriculant/](https://www.aamc.org/data/facts/applicantmatriculant/).  at least for the last 3 years i have been monitoring the number, the number of applicants from brown remains pretty stable. this application cycle there are 235 applicants from brown. pre-health advising knows the qualifications needed to be admitted to med schools. only qualified applicants get a committee letter. the article you linked basically tells you for those who are not qualified, they won't get it. there is no structural flaw.  all the schools at this level have committee letter system. if brown has ""structural flaws"" in pre-health advising, all the schools at this level have the same structural flaws. this system benefits the applicants who have the committee letter, which shows institutional support. two third of applicants from ivies have at least one gap year. gap year is not needed if you are a very strong applicant. last year one person i know got into harvard medical school with no gap year. again, they will advise you if you are a strong applicant or not. in my opinion, plme program is good for us because plmes are not applying out. brown's life sciences programs are extremely strong. more than one fifth of students are in life and medical sciences. ([https://www.brown.edu/about/administration/institutional-research/factbook/degrees-and-completions](https://www.brown.edu/about/administration/institutional-research/factbook/degrees-and-completions))"
49,"i think that those two options are basically the same thing.

i heard that he ended up applying to both law and medical school at harvard, before ultimately doing neither and becoming a rhodes scholar instead. "
50,"first, i should note that your experience will vary widely based on your interests, your personality, your living situation, your freshman unit, and your extracurriculars.

 anyway, the culture is definitely more relaxed overall. the administration is generally extremely permissive, trusting students to make the best decisions for themselves. the students are intrinsically motivated, which creates an atmosphere of cooperative competition. (compare to harvard or similar, where competition is cutthroat.) as for free time, you could spend your entire life in the scili or you could hit up the frats/bars seven days a week. it's all about who you fall in with.

one of the biggest distinguishing factors is how little people care about the varsity sports teams. athletes have a somewhat separate culture, although due to our size the percent of student athletes is high. having worked in a big state school college town, i can say that the difference in enthusiasm levels for sports there vs sports at brown is truly astounding."
51,"the one other thing i'll say is this: brown isn't a ""party school"" as it's typically defined. people have their academic and extra-academic pursuits, and they're quite serious about them, but (unlike harvard and yale) they know where to draw the line between work and play, and they can play quite hard in their play time."
52,columbia’s aid is similar to brown’s in my experience. the only thing with columbia is that it’s in nyc which may end up making it more expensive. harvard/yale give better aid
53,"columbia is also need aware and has a smaller endowment than the larger ivys like yale and harvard. in terms of endowment for all the ivys, as of 2019, harvard had $39.2 billion, yale had $29.4 billion, princeton university had $25.9 billion, university of pennsylvania had $13.8 billion, columbia university had $10.9 billion, cornell university had $7.2 billion, dartmouth college had $5.5 billion, and brown university had $3.8 billion, [according to the columbia spectator](https://www.columbiaspectator.com/news/2019/05/02/cc-seas-tuition-to-be-most-expensive-in-the-nation-at-over-62000/) . good luck!"
54,"brown is better than harvard for humanities imo, but i'm a phd student, not undergrad"
55,"i heard from someone who transferred here that it's also a better place to be a humanities phd. harvard has certain expectations of everyone it accepts, and as you might imagine, there's some really weird attitudes among harvard's humanities phds"
56,"i find that brown's phds are generally quite a bit more politically naive than they harvard colleagues. this has made my time here much more enjoyable and straightforward than my time there, but i remain worried that they'll have a very rude awakening elsewhere."
57,"i don’t have access to the data so i don’t know for certain. what i do know is that your scores are very competitive already. but american colleges are now looking more at your ecs and essays than your scores since schools like harvard, brown, or mit could fill their entire classes 3 times over with perfect sat scorers and 4.0+ gpas. in essence, you’re more than a set of numbers, and admissions are paying attention to the human aspect more than ever."
