author,body,title,score,upvote ratio,id,url,comms_num,created,timestamp
you112233,"I summarized their summary with most of the bits that affect students but I would still encourage you to read the report:

**Health Monitoring**

-	Daily check in (maybe live at https://dailycheck.cornell.edu/) for COVID symptoms.
-	Possibly require flu vaccine
-	Face masks policy live: https://ehs.cornell.edu/campus-health-safety/occupational-health/covid-19/face-covering-and-mask-requirements
-	Contact tracing recommended via phone app

**Testing**

-	Low threshold for testing including those in contact with Covid-positive cases
-	“Surveillance Testing” regularly testing students and staff
-	Test students before they travel to Ithaca (remotely) and when they arrive
-	Testing students already in Ithaca and during move-in. Move-in may be 4 or 8 days to accommodate
-	Reactivation of key card and NetID requires completing a checklist

**Quarantine/Isolation/Contact Tracing**

-	Quarantine at permanent residence or Ithaca hotels, including possibly the Statler
-	“Students should be provided immunity from university disciplinary violations for activities they disclose during contact tracing”

**Modifications to Academic Activities**

-	Later start to the school year, no breaks
-	2 modes of instruction: all online, and in-person with remote access
-	Classroom capacity reduced to 13-24%
-	Wear masks in classroom, sit in assigned seats (bruh)
-	Virtual OH encouraged
-	Barton Hall or other large spaces repurposed as quiet study spaces to limit gatherings elsewhere
-	Regular grading reinstated
-	Attendance shouldn’t be counted for credit but should be taken to facilitate contact tracing
-	Recommend a stricter cap to 18 credit hours for mental health
-	Orientation should focus on behavioral expectations

**Modifications to student life**

-	Student Organizations encouraged to do virtual activities, among other considerations
-	Greek Life: “The university should develop an addendum
to the Risk Management and Social Events
Policy that requires compliance with NYS
and local public health guidelines; wearing
masks when there are visitors in the house;
registration of public health monitors for
events; coordination with SCL to ensure
vendors are healthy and safe; and
registering the addresses of chapter
annexes.”
    - “Some advocated for strict enforcement with
strong sanctions, while others caution against
risks of pushing activities “underground” where
they may be more difficult to enforce.
Greek leaders expressed desire to be involved in
enforcement of behavioral expectations and
maintain close partnership with university
leadership. “
-	“The university should suspend in-person
concerts and lectures that involve outside
guests and promote innovative approaches
to entirely new ways of socializing while
distancing.”

**Housing**

-	Eliminate quads and triples.
-	Rooms assigned to bathrooms to reduce # of people sharing
-	Lounges and kitchens remain open
-	Dining halls provide to-go service, tables properly spaced, cutlery disposable, reservations required for dine-in

**De-densification**

-	“Campus can be de-densified by inviting only
some or none of students back for
residential instruction. If this option is
pursued, the following student groups
should be given priority: new students,
including transfer students; residential
advisors; graduating seniors (especially in
the spring); athletes (if competition will take
place for their sport); and students who would not otherwise be able to maintain
academic progress without access to
campus such as students in programs that
require hands-on access to special facilities
and those who lack access to internet or
quiet learning spaces at home”
    - Comments on this suggest it is not ideal. That is to say, they are proposing this as an option but NOT saying it is what should be done. In fact, the committee recommends AGAINST doing this. 

**”Campaign for Public Health and Behavioral Influence Strategies”**

-	“Recommend a system of progressive
sanctions. Initial response would involve
just the student and be educational.
Subsequent violations would involve
parent/legal guardian, if the student has
signed a FERPA waiver. Students could lose
access to university facilities and ultimately
be referred to the Office of the Judicial
Administrator for repeated violations that
necessitate formal discipline or removal
from enrollment”",An actual summary of the 97 page report,878,0.99,hdvn9a,https://www.reddit.com/r/Cornell/comments/hdvn9a/an_actual_summary_of_the_97_page_report/,72,1592872470.0,2020-06-22 19:34:30
loool1143,"Forget about classes moving online, forget about the in-person semester being over for everyone, forget about the vital research this university conducts being put on hold, forget about students being forced to return to shitty home environments, even forget about at-risk people dying.  These are things we talk about all the time and if it’s somehow not enough to keep you out of a fucking annex, then please consider the people who rely on Cornell for employment.

Because the fact of the matter is, a few more events by “unnamed parties” gone wrong, and literally hundreds if not thousands of people here are unemployed OVERNIGHT.  Yes UNEMPLOYED.  Without jobs, without a stream of income, a.k.a. something necessary to feed, clothe, and house oneself when one’s parents do not do so.  The people who work in the dining halls to serve you the food you eat every day, the people who clean the classroom floors where you thoughtlessly dump your Canada goose jackets (yes I’ve seen kids just throw them on the ground), the people who clean the dorm bathrooms for you, the people who do maintenance around campus.  All those people will be without jobs, at least until February, perhaps much longer if Cornell has to permanently lay people off to cover for the money they are hemorrhaging.

And it’s not just Cornell employees, its the countless small business owners, many of whom are immigrants without a backup plan, who have been staying open by the skin of their teeth betting on this semester’s success.  It’s the uber and Lyft drivers who ferry you around town, and it’s the families of all these people.

I’m not sure if any of you have ever taken the opportunity to *really* look around during your time here, but Ithaca, New York is not a hotbed of economic opportunity by any stretch of the imagination.  There aren’t a lot of entry-level jobs floating around for these people to turn to if things go south, especially not this year.  If these people lose their income, because of you, yes YOU, there are a lot of fucking consequences.  Some of them might lose their homes, their cars, their savings.  Some might not have savings.  If they have kids, those kids might now *eat* less because of YOU.  Those kids might not get Christmas presents this year because of YOU.  Those kids might now helplessly watch their parents suffer from depression because of YOU.  Newsflash, unemployment takes a toll on the mental health Cornell students love to bitch about a hell of a lot more than prelims (see this helpful link [https://www.mayoclinic.org/diseases-conditions/coronavirus/in-depth/coping-with-unemployment/art-20485976](https://www.mayoclinic.org/diseases-conditions/coronavirus/in-depth/coping-with-unemployment/art-20485976)).

I’m not sure if you’ve noticed, but a lot of our dining hall employees are not young people, and if they lose these jobs, not only will their retirement saving stop, but they may need to dip into those savings to support themselves, delaying their retirement indefinitely because YOU couldn’t follow the rules.  These people are a part of our community just as much as any student is. I’ll fucking die on that hill.  Most of them will be here or have been here longer than any of us, and they will be working here after we’re gone.  They are definitely more so a part of Cornell than certain unnamed fucking frosh who have already busted in here like they own the place.

You interact with them on a daily basis, you recognize them, they make everything run, they work incredibly hard, they smile and give you words of encouragement and fucking feed you.  If the campus shuts down, they do not go back to Westchester or Long Island or Miami or Manhattan.  You are indebted to them, you owe it to them to do everything you can to keep this semester alive.

What is a bummer of a semester for you, has potentially ENORMOUS implications for the lives of our staff here, and the college town community as a whole.  How dare you. How dare any of you forget about what is at stake for them this Fall.

TL;DR: If the semester ends, Cornell employees and business owners around here are going to get put in a very rough place, and it’s hard to watch people disregard that.",PLEASE consider what a shut down would mean for the people who work here,697,0.96,im6ysn,https://www.reddit.com/r/Cornell/comments/im6ysn/please_consider_what_a_shut_down_would_mean_for/,70,1599212857.0,2020-09-04 04:47:37
AEP_god,"  The year is 2037. “America” is synonymous with “Cornell.”

During the 2020-2025 COVID-19 pandemic, Cornell was the only university to succeed in reopening, a Herculean effort that bankrupted every other university in the nation. With its multi-trillion dollar endowment it accumulated from the donations of billionaires from around the world, who lauded the success of the Big Red Vaccine, Cornell bought every other university in America. 

I’m a 2036 graduate living in New York City. Today is job enrollment day. Since my enrollment window isn’t until 4:00 PM, I decided to head down to the local Nasties to pick up some buffalo wings and signature Cornell ice cream. 

As I’m waiting in line, I overhear someone talking over the phone. It’s some software engineer from my class bragging about his brand new six figure salary. He got lucky with his enrollment window. I just hope there are more CS slots left, but with my time window, I’ll be lucky to land any engineering job. 

Suddenly, I hear the familiar chime of the nationwide intercom system. It’s time for the national anthem. I immediately turn toward the nearest smiling portrait of President Martha Pollack, place my right hand over my heart, and belt out my loudest “Far above Cayuga’s waters...” The man on the phone appears to pay no attention. He’s immediately grabbed by secret CCCT agents standing in line and disappeared. 

As I stand in line trembling, I can’t help but selfishly hope that his job slot becomes available by my 4:00 enrollment window.

By the time I finish singing with a “Hail, all hail, Cornell!” I’m next in line. I make my order. “That’ll be 25.00 BRBs,” the AEP bot-cashier beeps. Since the collapse of the dollar back in ‘21, Big Red Bucks have been the official currency of the United States of Cornell. I swipe my ID card, but it gets declined. Oh no! I forgot BRBs don’t roll over month-to-month. Embarrassed, I run back to my dorm room in Low Rise 21756. 

I check the time. It’s 3:55 PM. I hop on my computer and enter my Net-ID: ab345287 and my password into Citizen Center. Before I enroll, I have time to vote in the annual presidential election. I click on the election tab, fully expecting the usual two options: Martha Pollack and Martha Pollack. But, to my surprise, I’m instead offered the options of Martha Pollack and Walker White! He must’ve hacked the election! I eagerly click on his name and submit my ballot. 

Suddenly, my internet goes out. *This must’ve been a test, and I’ve failed*, I think to myself while bracing against the back wall of my dorm room as I wait for the CCCT to bust down my door. But nothing happens. My internet comes back on. The ballot now has the two usual options. Dejected, I cast my vote for Martha Pollack and head to the enrollment page. 

It’s now 3:59. I’m watching the second hand of the clock app on my phone. Just as it strikes 12, I click “enroll.” The page buffers. A minute passes. Then another. Finally, I’m greeted with my career options. The only slots left are in the fine arts. Without a CS slot available, not even 56 years of programming experience could grant me a software engineering job. Crying, I choose to be a painter. My projected annual salary is 10,000 BRBs. I have 400,000 BRBs in student debt. Can I even pay monthly interest? 

Before I can do the math, my door explodes and I’m placed in handcuffs. “Citizen,” an officer addresses me, “with your projected annual salary of 10,000 BRBs, you will be unable to pay the annual 100,000 BRB citizen tuition. As such, you have been found in violation of Amendment 35 of the Cornell Compact. Your diploma is hereby null and void and you are to be expelled from Cornell immediately.” 

I’m sent to Canada, where I decide to enroll in the newly founded community college known as Harvard, renowned for being a refuge for Cornell rejects.",A Cornell Dystopia,667,0.98,ieo7ct,https://www.reddit.com/r/Cornell/comments/ieo7ct/a_cornell_dystopia/,29,1598151493.0,2020-08-22 21:58:13
MemeFrom94,"Hello, 

sorry to interrupt your memes, trust me it's not something I enjoy doing, but in this chaotic moment I feel compelled to write this. 

I am a dining employee from Willard Straight Hall in my first year working for Cornell Dining. I wanted to take a moment away from all of the craziness that is happening this semester to show my appreciation for the students of Cornell.   


When I first accepted my position at Cornell, I was terrified at the thought of working around so many people. I have had social anxiety issues for over a decade now, and having a constant reminder of the bad in the world through media has never made things easier for me. Making the step to work for Cornell Dining was a huge hurdle for me mentally that I still struggle with from time to time, but I can tell you, that those days are becoming less and less the longer I work at Cornell. A large part of why these days are becoming less frequent is due to the outstanding character of the students of Cornell.

&#x200B;

There are so many of you that I get to make pizzas for on a daily basis. I see many of you multiple times a week, and even the few of you that I only get to interact with every once in a while constantly remind me how great the Cornell community is! I've worked in food service since I was 16 years old and in every other job I've worked, I've always felt like I'm ""just the guy making this persons food"", however; that changed significantly when I started working at Cornell. At Cornell, there hasn't been one time where I have felt disrespected, or just felt like the guy making your food. I constantly feel as though many of you genuinely care about us dining employees, and you truly appreciate the effort we make!  


I probably wouldn't have ever made this post until this last week. With all the chaos, and madness surrounding the Coronavirus and what it means for everyone on campus one thing became shockingly clear to me, there is no where else in the world I'd rather be working right now than Cornell. In a time where many of you are scared, and worried about what comes next for you, a lot of you still took a moment to ask a lot us dining employees what all of this meant for us and our jobs. 

&#x200B;

I have never felt more cared for by strangers in my life than I have felt this week. A student even took the time to write our bosses an email saying how much they appreciated the work we have done for them, and the seamless transition we made to make our dining halls as safe as we possibly can during this time. If you happen to read this, I want to make sure you know that your letter made so many people feel good about what we do, there were tears in the eyes of multiple people in the room as the email was read aloud to all of us. This moment is incredibly scary for us as we aren't sure exactly whats going to happen to dining over the next couple of weeks since it seems like everything could change an hour from now but knowing that there is an entire campus of students who genuinely care about our well being honestly means the world to us all.

&#x200B;

Lastly, due to all of this craziness, I hate the fact that I didn't get a chance to say goodbye to many of the seniors who have already left campus that I was able to make food for regularly and at many points get to have conversations with. If any of you happen to be reading this, I wish you all nothing but the absolute best and I'm so sorry you're not able to spend your last semester as I'm sure you envisioned it, but there is no doubt in my mind that many of you are going to change the world for the better since many of you have already done that for my life.

&#x200B;

Thanks for allowing me to share my thoughts and serve you all. I look forward to seeing you all when everyone can come back to campus, I know things are crazy right now but I have nothing but faith in you all to absolutely crush it for the remainder of this semester...now back to the memes.",Appreciation Letter to Students from Dining Employee,647,1.0,fie8la,https://www.reddit.com/r/Cornell/comments/fie8la/appreciation_letter_to_students_from_dining/,5,1584196277.0,2020-03-14 09:31:17
AlternateShapes,,The latest email from Cornell 👀,627,0.96,im1kdl,https://i.redd.it/uxj1gpbdtzk51.png,34,1599193917.0,2020-09-03 23:31:57
ShoddyProgrammer550,,A parade of Freshmen returning after Cornell cancelled classes a day too late,612,1.0,f0c3rh,https://i.redd.it/nznmcq5buif41.jpg,38,1581118632.0,2020-02-07 17:37:12
FarthaPollack,"I was in dorm eating dorito when phone ring 

“Cornell is kil”

“no”",Where were u wen Cornell close?,594,0.98,fgmz4x,https://www.reddit.com/r/Cornell/comments/fgmz4x/where_were_u_wen_cornell_close/,16,1583910184.0,2020-03-11 02:03:04
joewee123,,upvote for good luck this semester,566,0.98,cx2mtd,https://i.redd.it/02ffdfsrrej31.jpg,12,1567122214.0,2019-08-29 18:43:34
izzied123,"In order to try to encourage people to stay safe and stay in quarantine, a couple of my friends and I are offering to go grocery shopping and run other essential errands for the people who are stuck inside right now. Here are the details:

-We will deliver the stuff you need to you within a few hours. 
-There is no cost besides the cost of the things you need us to buy for you, but we are asking for donations if you would like to make a donation. Even just a dollar or two can help us pay for gas. 
-We can get anything you need from wegmans, target, greenstar, the Cornell store, and Walmart, and we are also able to pick up food from restaurants. 

Please share this with anybody who you think might appreciate this service! Our #1 goal is to keep our community safe and help people who are in quarantine right now, but you do not have to be in quarantine to use this service. 

Please contact me at (203) 675-8549 if you are interested in this service. 

We will continue taking new orders as long as we have time, but we may become too busy and we may have to refuse new orders eventually. Right now, though, we can take a lot of new orders!","If you are currently quarantining and you need groceries or anything else from a store, I will run your errands for you for free. Details in the post.",565,0.99,if4xm7,https://www.reddit.com/r/Cornell/comments/if4xm7/if_you_are_currently_quarantining_and_you_need/,23,1598224660.0,2020-08-23 18:17:40
nickvader7,,Cornell alum and Supreme Court justice Ruth Bader Ginsburg has died,566,0.98,ivhea9,https://twitter.com/cnn/status/1307102317804744704?s=21,44,1600501444.0,2020-09-19 02:44:04
lovehateorlogic,"My baby goes to daycare here. My mom lives here and is fighting breast cancer. My partner works in an essential job and has had to report to work in person throughout the pandemic.

This sucks and it was handled poorly and I feel so hard for everyone trying to make astronomically expensive plans at the last minute. I wouldn't be able to handle the financial or the logistical challenge. I've already opted for an online semester, because I anticipate having to be both a stay-at-home mom and full time student all over again when things go south.

If you come, please be chill, be careful, quarantine, wear a mask, and don't party?

Also if I can help you out in any way with information or advice about Cornell or Ithaca, please don't hesitate to message me.",A Plea from a Cornell Student/Local/Mom to try and guilt you into social distancing,557,0.97,i1t8g9,https://www.reddit.com/r/Cornell/comments/i1t8g9/a_plea_from_a_cornell_studentlocalmom_to_try_and/,13,1596321596.0,2020-08-01 17:39:56
Nnnnnnnn4,"U know that the professor can read the comments right??? Imagine if someone actually yelled that out in an in person lecture. Holy crap.

We get it. U know what this very basic introductory concept is. Calm down genius. There are plenty of ppl in this class who have taken this class in high school, this is also review for them, it might be tedious but this is the beginning of the semester and it’s SUPPOSED TO BE introductory concepts. I’m sure you will have time to challenge ur extremely huge brain later in the semester. 

And also to the other guy who dramatically sighed (like literally so dramatic it caught my eye from his tiny 1x1 in profile) LITERALLY 5 times in a row and did his extreme best to seem bored out of his fucking mind, can you not?? It’s a boring couple minutes you have to sit through. You won’t die. 

The professor is excited for this class and is also doing their best to teach in these weird times. They clearly felt bad about running out of time and also getting stuck on a few tech things. BE KIND.","To the guy who typed “MOVE ON!!!” in the comments during the zoom when the professor was trying to teach, that was extremely rude.",534,0.98,imlxzh,https://www.reddit.com/r/Cornell/comments/imlxzh/to_the_guy_who_typed_move_on_in_the_comments/,58,1599274526.0,2020-09-04 21:55:26
yeathathappened1,"Y'all peeps I've dug myself into a pretty big hole here. My depression spiraled after coming home and well, I have barely looked at school in the past 2 weeks. At least at school, I had my friends to motivate me, but here, well, there's no one. I can't even go to therapy anymore because I know my parents will overhear and LOL I don't even want to know what will happen. As shitty as Cornell Health was at least it was something. 

I'm probably like 10 lectures behind in everything and I'm not sure if I'm gonna pass all my classes. For the past three days I've tried to tell myself to do work, but I didn't want to confront everything I had to do. It was scary, really fucking scary. I don't like remembering that this time I've failed, and now I have to fight back and solve it. 

But guys, I've done it. I at least wrote down everything I needed to get done. All 243 items. For the first time in a month, I have made a calendar. For the first time in a month, I've watched a lecture and I even took notes. 

For a girl who used to get straight As in high school and was used to always doing well, I can't believe I'm proud of myself for this, but guys I'm really fucking proud of myself. This is one of the hardest things I've ever done and I'm fucking amazing.","Guys, I did it.",534,0.97,g3zrim,https://www.reddit.com/r/Cornell/comments/g3zrim/guys_i_did_it/,42,1587291260.0,2020-04-19 05:14:20
throwaway123452165,"My favorite cousin, who is 21 years old and healthy on all scales, has recently passed from complications due to a blood clot formed in her brain from the coronavirus. It was all very quick- her family did not even know she was positive when suddenly she said she couldn't move anything on her left side of her body and was rushed immediately to the ER where she died not long after. I'm still in shock and am afraid for my life everytime I leave my home.

The most unfair part about this is that she observed all the rules. She wore a mask, she tried her best to keep 6 ft from everyone and only went out to work at her job since she is an essential worker and my cousins family needs her income to live paycheck to paycheck. I just saw a post on this subreddit about someone who doesn't observe these simple rules and it PISSED me off. Idealistically, if most people observed the rules, we might have been able to flatten this curve earlier and maybe one of my favorite people on this planet wouldn't have died. I'm so angry with this world right now because it seems like people like me who are low income who HAVE to work to afford basic necessities are most at risk due to assholes like u/ascape2 who ignore precautions and asymptomatically spread the virus to us.

I also realize most people on reddit do follow the rules and wear masks and such, and so this post probably won't make much of a difference, but I hope it inspires at least one person to start following the rules. We as young healthy college students may not be the highest at-risk demographic, but we aren't immune to the virus and never know what could happen.

&#x200B;

**edit: title should say ANYONE can die from covid-19**",everyone can die from covid-19,529,0.96,hvzyjh,https://www.reddit.com/r/Cornell/comments/hvzyjh/everyone_can_die_from_covid19/,72,1595473842.0,2020-07-22 22:10:42
bigboifeelingz,,36 Students at Purdue University Expelled for Partying During Pandemic Last Night,505,0.97,idcqss,https://i.redd.it/weuc5ivrh6i51.jpg,50,1597967206.0,2020-08-20 18:46:46
pollrn,,When add/drop email goes wrong,503,1.0,invbe8,https://i.redd.it/dsucb3z0sll51.jpg,19,1599459802.0,2020-09-07 01:23:22
i_shud_b_studying,,Why I'm safe from all these chegg accusations,500,1.0,gx85g5,https://i.redd.it/rzzlv5j5f4351.png,13,1591404441.0,2020-06-05 19:47:21
