author,body,title,score,upvote ratio,id,url,comms_num,created,timestamp
ama216,AHHHHHHHHHHHHHHHHHHHHHHHHHHHHHHHHHHHHHHHHHHHHHHHHHHHHHHHHHHHHHHHHHHHHHHHHHHHHHHHHHHHHHHHHHHHHHHHHHHHHHHHHHHHHHHHHHHHHHHHHHHHHHHHHHHHHHHHHHHHHHHHHHHHHHHHHHHHHHHHHHHHHHHHHHHHHHHHHHHHHHHHHHHHHHHHHHHHHHHHHHHHHHHHHHHHHHHHHHHHHHHHHHHHHHHHHHHHHHHHHHHHHHHHHHHHHHHHHHHHHHHHHHHHHHHHHHHHHHHHHHHHHHHHHHHHHHHHHHHHHHHHHHHHHHHHHHHHHHHHHHHHHHHHHHHHHHHHHHHHHHHHHHHHHHHHHHHHHHHHHHHHHHHHHHHHHHHHHHHHHHHHHHHHHHHHHHHHHHHHHHHHHHHHHHHHHHHHHHHHHHHHHHHHHHHHHHHHHHHHHHHHHHHHHHHHHHHHHHHHHHHHHHHHHHHHHHHHHHHHHHHHHHHHHHHHHHHHHHHHHHHHHHHHHHHHHHHHHHHHHHHHHHHHHHHHHHHHHHHHHHHHHHHHHHHHHHHHHHHHHHHHHHHHHHHHHHHHHHHHHHHHHHHHHHHHHHHHHHHHHHHHHHHHHHHHHHHHHHHHHHHHHHHHHHHHHHHHHHHHHHHHHHHHHHHHHHHHHHHHHHHHHHHHHHHHHHHHHHHHHHHHHHHHHHHHHHHHHHHHHHHHHHHHHHHHHHHHHHHHHHHHHHHHHHHHHHHHHHHHHHHHHHHHHHHHHHHHHHHHHHHHHHHHHHHHHHHHHHHHHHHHHHHHHHHH!!!!!!!!!!!!!!!!!!!!!!!!,Anyone else feel like this?,279,0.98,hvuz62,https://www.reddit.com/r/Cornell/comments/hvuz62/anyone_else_feel_like_this/,10,1595457708.0,2020-07-22 17:41:48
greens_giga_chad,,My Internship got cancelled 😳,276,0.98,g52twc,https://i.redd.it/jmvsky85u1u41.jpg,22,1587450479.0,2020-04-21 01:27:59
al-zaytun,,sorry denice,278,0.99,gr1dy3,https://i.redd.it/mg0478el85151.jpg,3,1590542726.0,2020-05-26 20:25:26
cornellisaborenell,,Reddit rly out here wildin’ — I clearly chose the wrong college....,275,0.99,gaxhrc,https://i.redd.it/n8tcvt0p1zv41.jpg,29,1588288399.0,2020-04-30 18:13:19
PrincedeSnare,,yeet,277,0.99,e9ozx7,https://i.redd.it/anwso6iq08441.jpg,3,1576193288.0,2019-12-12 17:28:08
acrylic_ariadne,,@cornell's PE classes this semester,275,1.0,iukmgt,https://v.redd.it/blwhpkmo7on51,7,1600381953.0,2020-09-17 17:32:33
BoardsAndCards,,That email was not very specific,279,0.98,hivll5,https://i.redd.it/jo1wqxgvx3851.jpg,2,1593577820.0,2020-06-30 23:30:20
guckmalmensch,,Even geese on campus are social distancing,276,0.99,ghb4o9,https://i.redd.it/4achv027l0y41.jpg,5,1589178755.0,2020-05-11 01:32:35
GLasco37,,Don't do me like that,276,0.99,e62yin,https://i.redd.it/2bxd8t7lnn241.png,2,1575510917.0,2019-12-04 19:55:17
pete716,,View of Cornell campus from Fall Creek neighborhood on Sunday,274,1.0,dhqqpa,https://i.redd.it/81030725gis31.jpg,12,1571089373.0,2019-10-14 16:42:53
MaxwellJuniorr,"Hi, this is Martha Pollack speaking. It has recently come to my attention that some of you are worried about booking flights back to Ithaca. It appears that you cannot book a flight until you know the date that you need to arrive at your destination, and unfortunately, we have withheld that information from you, as we haven’t quite decided what font we should use for the corresponding announcement email. In this regard, I sincerely apologize; I was under the impression that every student has a private plane and that they can arrive whenever they please. Apparently though, y’all poor af (but also my b cuz I’m taking like $70,000 a year from each of you mofos). Anyways, long story short, I’m flying to the Bahamas tomorrow for a Bridge tournament, so it’s kinda too late to fix this, but you may still want to consider investing in a jet, as this will make future travel easier (sell off your car collections if you need money to fund this; trust me it’s worth it).

To help students deal with the mental stress this may be causing, I will be giving a $1 tuition refund to all students who do not own a private jet. Our mental health experts recently ran a mathematical model which showed that such a refund will drastically reduce stress for students*. Details about this refund will be released sometime in the next 1 to 254 weeks. Unfortunately, running the previously mentioned mathematical model was very expensive, so we will also have to increase tuition by 50 cents per student. But hey, that’s just 1,999,999.50 more dollars that you need till you can get that plane!!

Warmest regards,

Martha Pollack 

*model assumes 100% of students have zero dollars to begin with, such that the $1 refund leads to an infinite increase in student wealth. Model has an uncertainty range of - infinity to + infinity.",Greetings from Martha Pollack,278,0.96,hz9lna,https://www.reddit.com/r/Cornell/comments/hz9lna/greetings_from_martha_pollack/,11,1595946722.0,2020-07-28 09:32:02
SpennyBeats,,Ezra Can’t Breathe,270,0.86,gul0jk,https://i.redd.it/6ywyv2zg0b251.jpg,43,1591048364.0,2020-06-01 16:52:44
JakobLoganStokes,,"Photo of Cornell’s 1953 football team, broken down by “field of study”",276,1.0,ep6vir,https://i.redd.it/mwywf43vsza41.jpg,20,1579144725.0,2020-01-15 21:18:45
cornellthrowawayay,"Just got my first covid test at Fischell Band center, and holy shit that was unbelievable. Most intense orgasm of my life. The way the nurse’s soft, gloved hand gently cradled my chin as she pressed the long, hard swab up and up my nasal cavity was almost too much to bear. By the time she counted to 5 my toes were curling and by 10, I was moaning in sweet ecstasy. Can’t wait to do this shit twice a week.",DAE get turned on by the COVID test?,272,0.92,i92orw,https://www.reddit.com/r/Cornell/comments/i92orw/dae_get_turned_on_by_the_covid_test/,24,1597363669.0,2020-08-13 19:07:49
academictrash26,"A Winter Storm will impact the Northeast Sunday and Monday. Heading back to Cornell University? We’ve got you covered. Read on for a detailed forecast of the winter weather.

OVERVIEW - Snow will develop tomorrow morning around 9-10 AM in Ithaca (earlier SW, later NE) becoming moderate/heavy at times before mixing with sleet/freezing rain midday tomorrow. A lull is expected mid/late tomorrow afternoon before heavy snow returns tomorrow night. Moderate/heavy snow will continue through the day on Monday before tapering off Monday evening. The graph in the first image gives a good general idea of what to expect hour-by-hour in Ithaca in terms of precipitation intensity (top precip bar), and type (the next four bars).

TODAY 11/30/19 there is *no* snow expected. If you are travelling today from anywhere on the East Coast, or can rearrange your plans to travel this afternoon, you will not experience any interruptions as high clouds slowly spill into the northeast.

TOMORROW MORNING (6-10 AM 12/1/19) snow will be moving into the area from the southwest. If you have an early flight from Detroit, it may be delayed but SW Michigan is expecting mostly rain, so you should be able to get out. This also applies to early flights from DC. (See Image 2)

TOMORROW MORNING (6-10 AM) if you're driving through Pennsylvania, be extremely careful as roads will be covered in ice due to freezing rain. Interstates should be ok as road crews apply salt to keep surfaces wet, but back roads may be very slippery. Allow extra time to get here! (See Image 3)

TOMORROW MORNING (6-10 AM) if you're driving in from the west (Buffalo, Ohio, etc.) expect rain until you get to the PA/NY border, then precipitation will change over to a mix of ice/sleet/snow. Allow plenty of extra time to get here as you'll need to take it slow

TOMORROW MORNING (6-10 AM) if you're driving in from the east (NYC, Boston, etc.) expect dry conditions until 8-10 AM when a mix of snow and sleet will begin falling. If you can get to Ithaca by 10 AM, you should avoid substantial delays. (See Image 4)

MIDDAY TOMORROW (10 AM-2 PM), we'll see a burst of heavy snow and sleet here in Ithaca likely between 10 AM and 2 PM. If you're planning on arriving during this time, expect significant delays as traffic will be moving very slowly across the entire Central NY region. (See Image 5)

MIDDAY TOMORROW (10 AM-2 PM) if you're heading through SW NY (Buffalo, Jamestown, etc.) OR north through PA, you'll be moving quite slowly through heavy freezing rain/sleet. If you're heading south from ROC/SYR OR east from ALB, you'll be moving slowly through moderate/heavy snow.

MIDDAY TOMORROW (10 AM-2 PM) if you're flying into ITH/ROC/SYR, delays are likely and cancellations are possible given the onset of moderate/heavy snow and sleet.

TOMORROW AFTERNOON (2 PM-6 PM) snow/mixed precip will be tapering off to the west of Ithaca as drier air moves in aloft. If you're heading in from Buffalo or Ohio, you won't encounter much precipitation until you're into the Finger Lakes, but roads may still be slick. (See Image 6)

TOMORROW AFTERNOON (2 PM-6PM) heavy snow will be pivoting northeast of Ithaca, making travel very difficult if you're coming from NYC/CT/ALB/SYR. We strongly advise leaving as early as possible if you're travelling from these areas!

TOMORROW AFTERNOON (2 PM-6 PM) if you're flying into ITH/ROC/SYR, expect significant delays and/or cancellations as airport operations become heavily impacted by heavy snow. If you can make arrangements to get on an earlier flight, it would definitely be worth it!

TOMORROW EVENING (6 PM-10 PM) We'll see a bit of a lull in precipitation during this time as the storm hops over the Appalachian mountains and redevelops in New Jersey. Expect light freezing rain/sleet to switch over to light snow here in Ithaca while heavy snow falls ALB-BOS (See Image 7).

TOMORROW EVENING (6 PM-10 PM) If you're driving in from the west or south (Buffalo/OH/PA/NYC/etc.) you'll encounter only light precipitation, much of which will be rain or freezing rain until you get close to Ithaca. Roads may still be slick, but overall you should be OK.

TOMORROW EVENING (6 PM-10 PM) If you're driving in from the north (ROC/SYR) you'll encounter light to moderate snow which will make roads slick but not impassible. If you're willing to go slow, you should be fine driving during this time.

TOMORROW EVENING (6 PM-10 PM) If you're driving in from the east (ALB/BOS), you'll encounter very heavy snow and treacherous road conditions on I-90 and I-88. If it's at all possible, don't drive through here during this time! Snowfall rates will be >2"" per hour

TOMORROW EVENING (6 PM-10 PM) If you have a flight into ITH/ROC/SYR during this time, you'll likely encounter some delays, but planes should be able to land after they clear off the snow from earlier in the afternoon.

TOMORROW NIGHT (10 PM-4 AM) Bands of heavy snow will develop again over the Ithaca area as the storm strengthens near NYC. If you're not here by midnight, it's probably best to wait until later in the day on Monday. Snow could fall at rates of 1-2"" per hour. (See Image Eight)

MONDAY MORNING (4 AM-10 AM) bands of moderate to heavy snow will remain over the Ithaca area as the storm remains more or less stationary near Long Island. Travel from the east or southeast (ALB/BOS/NYC/CT) will be extremely difficult while conditions will improve to the west. (See Image 9)

MONDAY MORNING (4 AM-10 AM) if you're flying into ITH/ROC/SYR, expect significant delays and/or cancellations as heavy snow will be a challenge for airport crews to keep up with. If you can get on a flight tomorrow AM, that would be ideal but otherwise, your best bet is Tuesday

MONDAY MIDDAY/AFTERNOON (10 AM-6 PM) moderate snow will continue through the day on Monday from Ithaca east into New England. Travel from the west will improve, but roads east of Ithaca will remain treacherous as heavy snow continues to fall in eastern NY/New England. (See Image 10)

MONDAY EVENING (6 PM-10 PM) snow will taper off as NW winds bring drier air into the region and the storm moves into the Gulf of Maine. Roads will remain hazardous to the east of Ithaca, but you should be ok if you're heading in from Buffalo or points SW.
(See Image 11)

FINAL THOUGHTS - The earlier you can get here today/tomorrow morning, the better. Be ready to take it slow and expect delays no matter where you're coming from. Make sure to give us a follow for the latest info over the next 48 hours. Be safe! -Jack Sillin and Aidan Mahoney",Big shoutout to weather peeps for this (stay safe y’all),274,0.99,e40ya8,https://www.reddit.com/r/Cornell/comments/e40ya8/big_shoutout_to_weather_peeps_for_this_stay_safe/,12,1575167039.0,2019-11-30 20:23:59
emzow,,One Final Summer Slope Sunset,273,0.99,i317ay,https://i.redd.it/w5m11ih6nte51.jpg,0,1596504101.0,2020-08-03 20:21:41
Emma_di3,,Cornell tonight,275,0.99,e4swyc,https://i.redd.it/1f55yia435241.jpg,11,1575286073.0,2019-12-02 05:27:53
alwayssunyinithaca,,Cornell students petition to have freshman TikTok star expelled for flouting coronavirus rules,271,0.95,ihajm4,https://www.washingtonpost.com/education/2020/08/26/cornell-jessica-zhang-coronavirus-tiktok/,74,1598515319.0,2020-08-27 03:01:59
AEP_god,,My 3 meals from Cornell,273,0.97,icmr6v,https://www.reddit.com/gallery/icmr6v,64,1597869196.0,2020-08-19 15:33:16
Rea_7186,"August 8, 2020 

Concerns on Cornell Re-Opening Plans Fall 2020 

President Pollack and Provost Kotlikoff, 

We write, as a department, to express our concern about the recent decision to not provide quarantine housing, meals, and support to those students from the list of states identified on the NYS travel advisory list. We also have concerns with other aspects of the re-opening plan, which we outline below and for which we offer potential solutions. 

1. Providing quarantine housing, meals, and support was part of the original re-opening plan. The number of cases in the on-campus versus online model (the Frazier model) assumed that the arriving students from high-risk states would be quarantined and monitored to assure adherence. By no longer providing students with quarantine options and support, we can expect that some proportion of students will not quarantine effectively, resulting in an increase in the number of cases on campus and in the Ithaca community. Students will feel licensed to break the rules because they feel Cornell has violated its commitment to them to cover costs of quarantine. Thus, walking back the commitment of financial support during quarantine will contribute to lack of effective adherence due to both financial and psychological considerations. 

Some possible solutions: i) Ithaca College has asked all students from these states to remain at home until their states are removed from the list. This is a tough policy, but at least reduces the number of incoming cases based on known risk rates from high case states. ii) Another possible solution would be to provide quarantine support but bring students into campus in a staggered manner (thus allowing for quarantine capacity and waves of gateway testing). This would also mean that students could be taking online courses while in quarantine. This will provide students with an opportunity to be productive while in quarantine and greatly increase the chance of a successful start to the semester. It will also allow time for Cornell to make sure everyone is familiar with the testing system and social compact protocols. 

2. Provost Kotlikoff and VP Lombardi stated that the lack of guaranteed quarantine would affect only 1,300 students, because it impacts only students who would be living in dorms, and mostly freshmen. This assumes that students from the high-infection states who are living off campus will be able to come to Ithaca and quarantine in their apartments. We are concerned that this is not a reasonable assumption. Many students live with roommates, and some live with roommates that are from states both on/off the travel advisory list. Most of these students share bathrooms and living spaces, thus violating NYS quarantine rules. 

Some possible solutions: i) Cornell needs to provide more guidance for off- campus students as to how to effectively quarantine, and potentially provide 2 options for that student community as well. ii) These students will need help with meals, groceries, and transportation to testing. 

3. Very importantly, not providing quarantine housing, meals, and support will place an unfair economic burden on some students forcing them to make risky choices or face hardships. Students of lower socio-economic status, many of which are underrepresented or first- generation, will be disproportionately adversely affected by this policy. This policy is therefore blatantly anti-equity. Application for “hardship exemption” does not make this equitable because those students will need to justify themselves and jump through extra hoops. Many will feel that the odds are stacked against them, contributing to a sense of discrimination and/or hopelessness that harms both their relationship with the University and the collective interest in full and effective quarantining. 

Some possible solutions: i) Provide, by default, all students on financial aid with the hardship exemption, or prioritize those students without the need for application. This will reduce the stress associated with this hardship and speed up the process. ii) Provide support for students on financial aid that decide to stay in their home states, to assure they have the resources to complete online learning (including access to a personal computer and internet). 

4. As we come back together as a learning community it is important that we not only provide an academic experience but also look after our students’ mental health. Our students will be experiencing unprecedented stress and anxiety due to the effects of quarantine; the social pressures that may come from watching fellow students ignore the Behavioral Compact and social-distancing requirements; as well as possibly dealing with disease outbreaks, and deaths, on campus. Counseling services at Cornell have historically been barely adequate, at best. 

Some possible solutions: i) enhance online health services with a focus on mental health, ii) call on students to volunteer to get training in mental health counseling to serve as mental health ambassadors, be able to spread information about good mental health practices, and also importantly be able to detect signs of a student in distress, iii) create a campaign for mental health awareness at all levels of the Cornell community, provide signage, free online events, and classes. iv) Preemptively prepare counseling response teams to move into on-campus AND off- campus housing to offer both crisis counseling and guidance on appropriate responses when a student tests positive for COVID. We know there will be infections, hospitalizations, and likely deaths, thus the risk of eroding student confidence in their collective safety will be high if health counselors are absent when cases begin to emerge. 

5. The “Frazier Model” is based upon student surveys from months ago when the number of cases in the U.S. was decreasing and our confidence was increasing that we could contain the virus. This has changed, and will continue to change daily. Current national models predict that 11,000 people will die each week in the month of August in the U.S. The Cornell and Ithaca communities are very concerned with the influx of new cases, the transparency of data on new cases, and the lack of thresholds or specific criteria that would trigger actions such as a university lockdown or closure. 

Some possible solutions: i) the administration must be transparent about the number of cases and the results of testing, preferably with a frequently updated dashboard. Related to this is the degree and notification of contact tracing in the case of positive cases on campus. ii) conduct a follow up survey of the students that could include peer assessment questions to determine the extent to which students are worried about the conduct of other students. This would allow us to parameterize contact rates. Non-adherence to the behavioral compact is one of the variables that is most likely to alter the course of community disease and we believe that potential problems with student behavior could be corrected in part by providing them with real-time data connecting COVID patterns on campus with polls of student behavior and attitudes. Cornell should be prepared rather than reactive. iii) Our community needs clear criteria and parameters guiding decision-making for our response as cases increase in Ithaca. These criteria should be public. 

Thank you for considering the concerns outlined above, and our proposed actions that we believe will increase safety and equity for all in this difficult time.",Department of Ecology and Evolutionary Biology letter of concern regarding Cornell's reopening,269,0.98,ia6kom,https://www.reddit.com/r/Cornell/comments/ia6kom/department_of_ecology_and_evolutionary_biology/,13,1597523708.0,2020-08-15 15:35:08
thosser69,Thanks. You saved my wife’s life. ❤️,Whoever called CPD on 7/10 at the gorge,272,0.97,iakpkg,https://www.reddit.com/r/Cornell/comments/iakpkg/whoever_called_cpd_on_710_at_the_gorge/,18,1597574181.0,2020-08-16 05:36:21
-Dryden,,Sage Hall in Minecraft,272,0.99,gb1wq3,https://imgur.com/a/8DbOLA7,16,1588302063.0,2020-04-30 22:01:03
andysam250,,First Look at New Resident Halls on North,267,1.0,h96an2,https://i.redd.it/ngqmrj1z8z451.jpg,25,1592213484.0,2020-06-15 04:31:24
Dieneforpi,,I really needed this,271,0.98,fb3b6z,https://i.redd.it/ypprbfstxqj41.jpg,3,1582960062.0,2020-02-29 01:07:42
dasCabinetdes,,✨💦folks💦✨!❕❗️the 🌡️temps😳have dropped🔽⬇️below 😊❄️⛄️50😳🤧so😜its time⏰⏱️🕰️for👅😘ur🔥warm🔥😊winter🌨💨jacket👕👚🧥pair👫👫👬it with ur 💨airpods🎧and 🐝gucci💚❤️shoes👠👡👞👟and💪💼👜fjallrjavebebekaneken❤️✨🤪sry I don't 🗣speak💦broke😤💪🤪💱,272,0.95,dsma5f,https://i.redd.it/9dlxzaoqo4x31.png,12,1573101999.0,2019-11-06 22:46:39
,Thanks for listening to my TED Talk,"PSA: If some random stranger sits next to you in lecture hall, perhaps they are lonely, so be nice to them. Cornell could use more of that.",272,0.99,d9o3ao,https://www.reddit.com/r/Cornell/comments/d9o3ao/psa_if_some_random_stranger_sits_next_to_you_in/,8,1569553005.0,2019-09-26 21:56:45
anon5084,,YoU geT twO fuLl PagEs oF nOteS youLl bE fiNe,266,1.0,ebishy,https://i.redd.it/cm3ka5owd1541.png,8,1576548848.0,2019-12-16 20:14:08
metzengerstein1,,True,268,0.99,igb1m4,https://i.redd.it/0u5pav3e55j51.jpg,5,1598386783.0,2020-08-25 15:19:43
kkkbbb11523,,Looking for this energy rn,265,0.99,hnitww,https://i.redd.it/47e68uwtgn951.jpg,3,1594250074.0,2020-07-08 18:14:34
rickyrichboy,,"The eclipse of 2017, 3 years ago today",267,1.0,ieblcb,https://i.imgur.com/8SQXozL.jpg,10,1598096684.0,2020-08-22 06:44:44
Henriquecz0,"I have a friend who is already on Cornell, and they've told me there is *already* a party happening in collegetown. And while I process my anger about this, I'm writing here just to give a reminder for anyone who reads this.

Yes, the administration is doing serious mistakes with the move-in process, and the reactivation plan is still quite uncertain, even as we edge the beginning of the semester.

Yes, the country is dealing with this pandemic quite badly.

Yes, the impacts of this pandemic can often seem distant for demographies at low-risk like ours.

And yes, quaratine, social distancing, and precautionary measures can often imply difficult choices, tensions, and loneliness. Fear of missing out, and a fear of time lost.

However, that does ***not*** exempt you from personal responsibility in the actions you take. No matter how many precautions you take, and no matter how you justify it, organizing and attending parties puts people at risk. Puts your community at risk. So **please** keep that in mind, and please avoid parties and similar gatherings, no matter how tempting they might seem to you.",Collegetown Party,267,0.91,icd2pb,https://www.reddit.com/r/Cornell/comments/icd2pb/collegetown_party/,62,1597824872.0,2020-08-19 03:14:32
Appropriate-Bid4322,,just got this email ...,268,0.96,i1fasn,https://i.redd.it/x6o5vhah99e51.png,6,1596257388.0,2020-07-31 23:49:48
Imthinkingbeans,,NEOWISE Far Above Cayuga's Waters,268,0.99,hu4ulu,https://i.redd.it/yip7zz4fqub51.jpg,12,1595210498.0,2020-07-19 21:01:38
HotelItOnTheMountain,,“Physical” Education,266,0.99,bbpmyl,https://i.redd.it/4rm1ggnjehr21.jpg,16,1554950340.0,2019-04-10 21:39:00
AEP_god,,Not sure,266,0.99,ippfnw,https://i.redd.it/fogwa2ecv6m51.jpg,6,1599715162.0,2020-09-10 00:19:22
BubblyConsideration_,"do you ever feel like you’re just so lucky to be surrounded by people who are so incredibly passionate, intelligent, and diverse? during my time here, I have gotten to know and had conversations with peers who are interesting and talented in exceptional ways. whether it’s the opera-singing engineer or the concert-level violinist who does nano-scale physics, they’ve come from all walks of life, and have opened my mind to so many new ideas, possibilities, experiences and cultures

they’re also just people who are genuinely good, supportive and kind 

you’d just look at these people and know that they will end up wherever they want to be.",do you ever,260,0.97,inj4v9,https://www.reddit.com/r/Cornell/comments/inj4v9/do_you_ever/,15,1599413070.0,2020-09-06 12:24:30
toothpastePull,,I always wondered what that major was about...,264,1.0,egk4he,https://i.redd.it/vsl4pxb11a741.png,6,1577525201.0,2019-12-28 03:26:41
Davy_Gries,,Professor g2 = new Gries();,264,0.99,dpp7p6,https://i.redd.it/hur548fjbwv31.png,19,1572564855.0,2019-10-31 18:34:15
