author,body,title,score,upvote ratio,id,url,comms_num,created,timestamp
cornsmell,,Seriously guys it’s been like 10 hours since a nice Okenshits meme was posted,163,0.96,dejz0m,https://i.redd.it/bfhr4myym4r31.jpg,19,1570486313.0,2019-10-07 17:11:53
asterbotroll,,"New psychological disorder discovered in a study of Cornell students: Derailment. Correlated with depression, it is ""an uncomfortable disconnect between who we feel we are today, and the person that we believe we used to be.""",164,0.98,bwatll,https://digest.bps.org.uk/2019/06/03/researchers-have-investigated-derailment-feeling-disconnected-from-your-past-self-as-a-cause-and-consequence-of-depression/,21,1559598311.0,2019-06-03 16:45:11
basicbrownboy12,"Like i don't know how to explain it but like asynchronous lectures, then actual lectures, the whole note taking process from books, then discussion/lab work paired with weekly assignment milestones and now we also have exams and weekly quizzes? Isn't this all a way too much? Idk with the online format I feel like I can never catch up :(",I feel like online classes are more stressful.,163,0.99,iz8y0d,https://www.reddit.com/r/Cornell/comments/iz8y0d/i_feel_like_online_classes_are_more_stressful/,13,1601021080.0,2020-09-25 03:04:40
billybob09,,Making sure Reddit’s represented,164,0.99,iozyfe,https://i.redd.it/svgu81rg3zl51.jpg,6,1599621039.0,2020-09-08 22:10:39
luminous_moonlight,"If you received your housing assignment and you're not particularly pleased with what you got, please do your research before trying to trade with someone else! Ask people on here what it's like to live in that dorm. Learn the general personalities of each building. Consider whether the new dorm you're trying to get into is actually better than what you were assigned. Is there a bus stop near it? A dining hall? How close is it to Central Campus/the Beebe Lake footbridge? What are the people who live there generally like? 



And please, for the love of Touchdown, never swap out of Mews/CKB!


I can talk about HILC/the low rises if you need any help. I've also had good friends in Balch, Mews, and Donlon.


Edit: Eco House is the worst North Campus dorm imo. If you get it, my condolences. Switch out ASAP.",Advice to all freshmen: NEVER trade rooms unless you know exactly what you're getting.,167,0.97,hxom3t,https://www.reddit.com/r/Cornell/comments/hxom3t/advice_to_all_freshmen_never_trade_rooms_unless/,80,1595719974.0,2020-07-25 18:32:54
bookface4,,Some things you can always count on,162,1.0,fl1vrz,https://i.redd.it/j1tnbj66ejn41.jpg,1,1584612095.0,2020-03-19 05:01:35
Snover56,,Found this drawing in a Mews lounge (another one in comments),164,0.99,dc1004,https://i.redd.it/cjp8acts90q31.jpg,8,1569997610.0,2019-10-02 01:26:50
waffleyweddedwife,,Every time on Libe Slope 😰,168,0.98,bm5zk5,https://i.redd.it/ygg5d52n0zw21.jpg,3,1557354788.0,2019-05-08 17:33:08
thewallstands,,Summer @ Ithaca : Treman,164,0.99,hs8t70,https://i.redd.it/zft0s08ir7b51.jpg,2,1594931656.0,2020-07-16 15:34:16
allaboutthat01,,I want there to be more rant posts so that I can aggressively empathize with them.,162,0.96,g61dm4,https://www.reddit.com/r/Cornell/comments/g61dm4/i_want_there_to_be_more_rant_posts_so_that_i_can/,7,1587591953.0,2020-04-22 16:45:53
calvinthechemist,,Calvin Working Hard!,165,1.0,fygnrz,https://i.redd.it/nzd8rpx020s41.jpg,1,1586557223.0,2020-04-10 17:20:23
,"How do I, a cornelian, be an interesting person? I’ve met up with a lot of non ivY leaGuE people back home and they’re interesting people to talk to, and they don’t even mention classes, grades, or internships. I can’t breath without mentioning I interned for google, and by the way did I mention I worked at google? Somehow they don’t have to complain about how hard they’re working to hold a conversation. This kind of baffles me. 

So students of cornell, anyone have any tips for being interesting? I read Marx for my FWS but tbh I don’t recall much.",Being an actually interesting person,164,0.96,emrztp,https://www.reddit.com/r/Cornell/comments/emrztp/being_an_actually_interesting_person/,26,1578696891.0,2020-01-10 16:54:51
sasha07974,,if you're on the engineering quad... he's watching...,162,0.99,dowsdr,https://i.redd.it/qyjjkt2dvjv31.jpg,8,1572414146.0,2019-10-30 00:42:26
metzengerstein1,,TCAT Pokedex a while back...,165,0.99,dfahqi,https://i.redd.it/5fsbeghtcfr31.jpg,8,1570616116.0,2019-10-09 05:15:16
sasha07974,,how walking around behind the architecture school feels,164,0.99,c9kgfp,https://i.redd.it/gvty8haqij831.png,2,1562385591.0,2019-07-05 22:59:51
Aznlord023,,Bill nye knows where all the parties at,165,0.97,a1717g,https://v.redd.it/q9fnzlrmq1121,4,1543446681.0,2018-11-28 17:11:21
CUlater69,,What an amazing meal. Burnttttt French toast and chicken that looks like a goose took a 💩 on it. Gotta love the new Cornell dining experience,161,0.95,iwiz5f,https://i.redd.it/kicaw5s9gco51.jpg,42,1600654431.0,2020-09-20 21:13:51
Slugmeat_,"With the health department announcing 25 more cases today, of which I’m sure more than half will be Cornell students, we will likely be online within a week.  Surveillance testing has not even begun yet.  Now that we are here, what is Cornell doing to do to disincentivize the behavior that has led to this? Suspensions should be given out liberally, and those who continue to remain in the Ithaca area after suspension and are caught partying should be expelled. Period. While the identities of those punished cannot be identified by the administration for privacy reasons, word will spread, and the university can share general statistics on punishments and noncompliance. We are all adults, and have gathered here with a full understanding of the public health consequences associated with noncompliance. Those who refuse to appreciate the consequences on the basis of public health must be served consequences at the university level. We must demand accountability from our peers.","The University has been soft on punishing violations, and now the rest of us are about to pay the price.",163,0.91,ilks44,https://www.reddit.com/r/Cornell/comments/ilks44/the_university_has_been_soft_on_punishing/,13,1599128044.0,2020-09-03 05:14:04
TheSinkAtYourDoor,"I've been calling the bursar every day for the past 2-3 weeks, and can't get any update on when my financial aid will be available. I've sent countless emails, and can't get a reply. I'm a max aid student, there's no question about it. I am not borderline, I am *poor*. And I live of campus, and rent is due today. And I guess I'm just gonna hope I don't get forcefully evicted before Cornell is ready to give me my promised money (promised in their statement about meeting 100% of need). I'm writing my landlord now to explain the situation, explain why I don't have the money, but why would they care. 

So thank you Cornell, for adding extreme stress and shame to my life, for no reason, during a time with so much stress already.",The financial aid situation is unacceptable,165,0.99,ik1cas,https://www.reddit.com/r/Cornell/comments/ik1cas/the_financial_aid_situation_is_unacceptable/,13,1598920511.0,2020-08-31 19:35:11
annatwd,"as some schools have began to reopen, ive already seen many snapchat stories of packed college parties. is it reasonable for me to be disappointed and disturbed? as someone who’s going to follow the rules, i’m extremely upset that others might ruin things. i feel kinda powerless because there’s nothing that will stop some kids from getting drunk in large crowds.",Parties.,164,0.92,iafzs0,https://www.reddit.com/r/Cornell/comments/iafzs0/parties/,28,1597556264.0,2020-08-16 00:37:44
n0n0thing0,"As the title says, I am on the SA. I have been reading some of the recent posts/comments and wanted to further shed light on what goes on internally. These are things that you do not see and will likely never hear of. I have some level of respect for my colleagues and will not use any names or title positons. I cannot go into much detail but will try my best to portray how the show runs. As far as a solution goes, I do not have all the answers but make a recommendation based on my perspective.

From my perspective, the problem with the SA is mostly cultural. This stems from the members, particularly the leadership. If you pay close attention, you will see that there is an inner-circle. The inner-circle includes most of the leadership and a few outspoken individuals. They are all friends and control the assembly in almost every aspect. They dictate what resolutions are heard, which resolutions pass, and who gets elected into leadership roles. The only thing they do not have control over is the external elections (where the students get to vote).

The way you get power or leadership roles on the SA is through internal elections. These elections determine the executive committee (except for the President and Executive Vice President) and committee seats. Members of the inner-circle all vote for their friends, which is how they maintain power. These people are very organized and will assign positions for their friends to run for. On the day of the election, they already know their favored candidates' speech and who will get what. During deliberation, where members get to discuss candidates, members of the inner-circle will uplift one another while speaking negatively about other candidates. You will not believe the stuff I have heard come out of some of my colleagues' mouths when talking about other members. In reality, if you run against one of them in these elections, you do not stand a chance.

Due to the power they have, they can effectively pass any resolution they want as they have nearly guaranteed themselves approval. If you are not part of this inner-circle and you even as much as question a proposal, you will be ostracized. If you dare to bring up any point of reasonable criticism, be prepared to be labeled a bigot of sorts. You thought the comments under The Sun article were bad? If only you could all see what is said behind closed doors. Now, remember those internal-elections I talked about earlier? Yes, they do not forget either. They will use your dissent against you and do their best to make sure you do not come anywhere close to any leadership positions.

If you bring up any of this to them, they will, of course, deny it. The culture on the SA is toxic, to say the least, and there is a good number of SA members who agree. However, they cannot say anything publicly due to fear of retaliation. We are forced to vote in support of resolutions we do not agree with. The next time you are at a SA meeting, look at the faces of your representatives as they vote for a resolution they do not agree with (I can assure you it is not pretty).

For the SA to change, **you will have to vote the current leadership out.** The inner-circle takes advantage of the fact that about less than 40% of the undergraduate population votes. Lower voter turnout makes it is easier for them to rely on their same electoral base and campaign tactics. By the way, pay attention to the candidates. Often, the inner-circle helps one another similarly to how they do during internal-elections. This, of course, is prohibited. But, they do whatever they can and try to find ways around. There is an election coming up this Fall 2020. It is a pivotal election because several of the SA members who were part of the ""machine"" are either graduating or gone. Use this opportunity to elect the right leaders. Reach out to your SA representatives and let them know they have your support and encourage them to stand up for the truth and open dialogue. Additionally, continue to call them out on their crap and hold them accountable. Show up to the meetings and ask questions. **Continue posting online, messaging representatives, and demanding change**. **They can get away with most of what they do, due to your perceived apathy.**

Lastly, as I said before, the inner-circle essentially has control over which resolutions pass. This is probably their biggest fault. If you do a simple search of the resolutions that have been passed over the last year or so, look at each of the sponsors. Notice which names keep making an appearance and which ones keep showing up together. **That is your inner-circle.**

I am passionate about shared-governance, which is why I am on the assembly. I know several people who were or are in the same boat as I am (even more passionate). These are smart, driven, genuine student leaders who, because of the SA culture, were smothered or forced to quit. It a really sad situation. Sometimes, I contemplate why I am still a part of this organization. No other organization I have ever been a part of, on or off-campus, behaves like this. I cannot begin to illustrate to you how infuriated my peers and I are by our experiences in this organization, and then for us to have to keep quiet. I am just glad people are finally seeing what is truly going on. Keep up the pressure.","What is wrong with the SA and how to fix it, from the perspective of a member.",159,0.93,hk80fr,https://www.reddit.com/r/Cornell/comments/hk80fr/what_is_wrong_with_the_sa_and_how_to_fix_it_from/,23,1593761213.0,2020-07-03 02:26:53
,"prof assigned an essay that’s due after the heat death of the universe... is this  allowed? if not, how do i go about fixing the situation? thanks!",Essay due after existence... allowed?,161,0.97,ght144,https://www.reddit.com/r/Cornell/comments/ght144/essay_due_after_existence_allowed/,7,1589249680.0,2020-05-11 21:14:40
IexpectedCheese,,Your daily Cornell views #3,163,0.99,ftmx1s,https://v.redd.it/zxr5aa25weq41,14,1585865163.0,2020-04-02 17:06:03
IexpectedCheese,,Your daily Cornell Views #2,162,0.99,fszk5q,https://v.redd.it/xizuqcb0i7q41,6,1585775669.0,2020-04-01 16:14:29
SYR2ITHthrowaway,,Impressed they are!,163,0.99,f3buxe,https://i.redd.it/n7w16bm9ppg41.png,15,1581637603.0,2020-02-13 17:46:43
alienfucker,,"Someone was arrest for having sex on the football field yesterday, and Cornell streamed it.",162,0.97,bs5xno,https://imgur.com/DG2ScyZ,19,1558662168.0,2019-05-23 20:42:48
_Tahm_Kench_,,Andy really did go to Cornell...,164,0.97,9jeeia,https://i.redd.it/y8ywnnkn6to11.jpg,3,1538094903.0,2018-09-27 19:35:03
Kyu_Sugardust,"-Congratulations, you made a scene while also knocking my tablet out of my hands and shattering it on the floor.

-Thanks for not apologizing.

-I lost my HADM 1740 work because of you.

-You fell asleep in lecture regardless of whether or not you attended.

-What was the point of panicking when Ganem doesn’t care if you show up late?",To the girl that came into Organic Chemistry lecture late and decided to frantically push past me through the aisle as I took notes on my tablet.,166,0.96,9eplnj,https://www.reddit.com/r/Cornell/comments/9eplnj/to_the_girl_that_came_into_organic_chemistry/,27,1536632048.0,2018-09-10 21:14:08
CornellBigRed,,"With their 3-1 win tonight against Dartmouth, your Cornell Men's Hockey team is this year's IVY LEAGUE CHAMPS!",164,0.99,7thrz5,http://cornellbigred.com/news/2018/1/27/mens-ice-hockey-2-4-mens-hockey-gamer-at-dartmouth.aspx?path=mhockey,3,1517138258.0,2018-01-28 05:17:38
tripsledge,,Behold the incredible Cornell Career Fair,160,0.99,ipiuit,https://i.redd.it/xj82mhpmb5m51.png,16,1599696433.0,2020-09-09 19:07:13
MEGAYEL,"* Student Center will not let you enroll in a class where any scheduled component of that class conflicts with any scheduled component of another class in which you are already registered. 
   * Your department registrars cannot do anything to allow you to enroll in classes with scheduled overlaps.
   * You will need to contact your college registrar regarding any possible petition process in place.
   * Class times cannot be changed at this stage.
* You will get an error if you try to simultaneously enroll in classes with time conflicts.
   * This may prevent you from enrolling in any of the classes in your shopping cart.
   *  Prioritize your courses and remove the conflicting course of lower priority from your shopping cart before attempting to enroll. 
* Have a backup plan
   * If you receive an error because a class/section you want is full, predetermining alternate classes/sections gives you a greater chance to succeed in enrolling in the classes your need.
   * If you continue to get errors in the system, log out and then log back in. This fixes most issues.
   * The department registrars are unable to assist with technical issues or any holds on your account.
* In-person (PT) class size is non-negotiable.
   * You cannot show up for an in-person class for which you aren't enrolled in hopes of getting a spot in the class.
   * Classrooms were assigned based on enrollment plus one instructor. Attendance of any additional students breaks COVID-19 capacity restrictions.",Enrollment Notes - please share far and wide,161,0.99,ifpp83,https://www.reddit.com/r/Cornell/comments/ifpp83/enrollment_notes_please_share_far_and_wide/,69,1598307022.0,2020-08-24 17:10:22
thewallstands,,Thanks to Cornell Reddit - got this :),164,0.98,hf0xeh,https://i.redd.it/ezs01o340v651.jpg,23,1593033764.0,2020-06-24 16:22:44
zikachu11,,How my Valentine's Day will look this year,162,0.99,f2zy0u,https://i.redd.it/uhh63czgqkg41.jpg,4,1581577446.0,2020-02-13 01:04:06
GLasco37,,If I hadn’t clutched Sheldon I woulda been in Risley ffs,163,0.95,c7se25,https://i.redd.it/wrflz0otyo731.jpg,20,1562015477.0,2019-07-01 16:11:17
cornholer69,,Cornell faculty choosing the Spring exam schedule (2019 Colorized),166,0.97,bb748p,https://i.redd.it/dfbq2f3xa8r21.jpg,4,1554840340.0,2019-04-09 15:05:40
bigred623,,cornell football beats harvard 28-24,162,0.99,9m1fy5,https://cornellsun.com/2018/10/06/4th-quarter-comeback-fuels-cornell-football-to-2nd-consecutive-win-over-harvard/,9,1538904724.0,2018-10-07 04:32:04
thewallstands,,Summer @ Ithaca : Stewart Park,159,1.0,i7341q,https://i.redd.it/pqg6hbc1v5g51.jpg,2,1597087867.0,2020-08-10 14:31:07
cornellzoomman,"That seems to describe this sub. When Cornell actually does something about students' mental health (regardless of their intentions) and limits credits to 18, people complain. There's usually so many to complain that it feels like a rat race for internships/academics and there exists the suffering Olympics. You cannot deny that it will help students' mental health, regardless of if it limits your future course selection. Do I think it was the right move? Probably not, but yea, the complaining is disheartenting.","My high school teacher once said: even if he gave out free steak on Tuesday, there'd be people who complain it's not chicken and people who complain it's not on Wednesday",159,0.75,ho87a5,https://www.reddit.com/r/Cornell/comments/ho87a5/my_high_school_teacher_once_said_even_if_he_gave/,47,1594347475.0,2020-07-09 21:17:55
,"I don't even know which neighbour it is except that it is someone in Collegetown Court. BUT WHY DO THESE PPL KEEP HAVING SEX ALL THE TIME. This is not even a shitpost, I am legit annoyed. I just shifted last week and they've disturbed me every fucking day. I literally live an entire street away but I CAN STILL CLEARLY HEAR THEM MOAN. There is also nothing more painful than hearing a girl fake an orgasm just to please a man. It's also reasonable when it's the weekend BUT SOME PEOPLE NEED TO GO TO BED EARLY ON A SUNDAY NIGHT. But nights are fine too tbh, BUT THEN THEY HAVE SEX AGAIN AT 6 AM and wake the entire neighbourhood up. That's fine too, I like waking up early. BUT PLS DON'T MOAN ON A MONDAY AFTERNOON. I can clearly tell that these are rich parents' jobless babies but I have stuff to get done. I was in a zoom call and looking at the people smirk as my neighbours moan, and a colleague has to privately message me to ask them to keep it down has been the most embarrassing moment I have gone through. The past week I tried screaming ""stop moaning!"" into the street but they got louder after that???? Does it turn them on -.- Their moans are not even hot tbh, at first I thought someone was crying because they broke their foot or something. BUT WHAT CAN I DO I WANT TO FUCKING SLAP THEIR FACES SSKSKKSKSSK",extremely loud neighbours in collegetown,158,0.97,h9l9fp,https://www.reddit.com/r/Cornell/comments/h9l9fp/extremely_loud_neighbours_in_collegetown/,29,1592272561.0,2020-06-15 20:56:01
psychomugs,,Ouch (overseen on Hacker News),159,0.96,g8ldns,https://i.redd.it/lihyg3p9y7v41.jpg,15,1587960355.0,2020-04-26 23:05:55
,,"Free from prelim anxieties, Friday night planning, and popcorn, a pianist plays within the deserted Willard Straight Hall.",163,0.98,fm3tyf,https://v.redd.it/davmjbufiwn41,16,1584771044.0,2020-03-21 01:10:44
ragingfury555,,Seriously guys don't litter lol don't be a hypocrite,163,0.91,f448qn,https://i.redd.it/lgid70yni0h41.png,2,1581768549.0,2020-02-15 06:09:09
mawful_mistake,"Why did you do this? What manner of negativity possessed you to perform such a cruel and selfish act? That snowman was the product of many hours of arduous labor in the cold, and my singular beacon of hope in the dark, stormy seas of finals—and he did not even survive the span of a full day.

I understand that this time of the semester can be difficult for most, and I hope the act of destroying our snowman was cathartic for you in some way, if only to know that he did not die in vain. But surely, there are better ways to deal with stress? 

This tragedy has deeply saddened me, but I shall persevere. My regrets are but twofold—that I may never again gaze upon the face of my creation, in all it’s glory, and that I know not the identity of his assailants, that I could express the level of disappointment I have towards you to your face

If this was you, I urge you to take a good, long look at your actions and how they affect others, and consider whether this is the kind of person you strive to be.

Best of luck with finals!",To the individuals who took it upon themselves to destroy the snowman that we had built between Becker and Rose today:,158,0.98,ec6bjg,https://www.reddit.com/r/Cornell/comments/ec6bjg/to_the_individuals_who_took_it_upon_themselves_to/,21,1576665093.0,2019-12-18 04:31:33
kkkbbb11523,,This is the drink company Cornell is missing. Bring these to nasties and beyond,158,0.96,gsvyaj,https://i.redd.it/wwa7j3mrbq151.jpg,20,1590797911.0,2020-05-29 19:18:31
Crazy-Opening,,"""ILR IS THE HARDEST MAJOR EVER""",157,0.96,g9ne4o,https://i.redd.it/j9l7uzxgbkv41.jpg,4,1588110096.0,2020-04-28 16:41:36
Anekeykia,,Career Fair was a Success,158,1.0,eznj2o,https://i.redd.it/804ke4mzo8f41.jpg,12,1580995782.0,2020-02-06 07:29:42
Santorno,Wooooo,Happy new years,159,0.95,eie9cp,https://www.reddit.com/r/Cornell/comments/eie9cp/happy_new_years/,11,1577883738.0,2020-01-01 07:02:18
Snover56,,PSA now that cold/flu season is here,161,0.99,d67drr,https://i.redd.it/g596mkdnkgn31.jpg,6,1568887423.0,2019-09-19 05:03:43
altruyzm,"I left my MacBook charger plugged in at a lounge in Duffield Hall, just remembered it this morning and ran there fully expecting it to have been stolen. It was still in the exact place, left untouched for almost two days. Really impressed by the integrity of the Engineering students.",Shout-out to Cornell Engineering students,160,0.99,bp05re,https://www.reddit.com/r/Cornell/comments/bp05re/shoutout_to_cornell_engineering_students/,21,1557966936.0,2019-05-15 19:35:36
DubitablyIndubitable,,Real mature Cornell.,163,0.97,beb8ov,https://i.redd.it/7gojpobyavs21.jpg,8,1555554476.0,2019-04-17 21:27:56
trevordavis4sa,"Dear Cornell University,

From the outset of this campaign, my goal was simple: to add something impressive-sounding to my resume. Today, I am proud to say that with my election to the position of Undesignated At-Large Student Assembly Representative, that dream has been achieved. This was a tremendous victory for the 1,852 supporters who voted to entrust me with the top elected position on Student Assembly, and for my future career prospects.

Because of each and every one of you, I can confidently tell recruiters at Deutsche Bank, Morgan Stanley, or even JP Morgan that I was elected to serve as a full voting member on the Cornell Student Assembly. I will be able to explain to them how Undesignated At-Large Representatives get to talk about stuff at meetings, vote on big important resolutions, and even serve on committees with fancy-sounding names.

I would also like to congratulate Joe Anderson on his victory in the presidential election. It speaks to how effectively the SA communicates and engages with the student body that the campus decided, by no matter how slim a margin, that the presidency deserves to go to someone professing an actual desire to serve. I hope Joe uses his very powerful mandate, cemented by the voters’ marginal preference, to continue the work students so clearly understand and value.

Cornell, my one promise this campaign was to put an SA position on my resume. Which is why, now that the promise has been fulfilled, I am proud to announce that I will be stepping down from my position on Student Assembly, effective immediately. I hope I have served my supporters well by being the first SA electee to complete all of my campaign promises, and by doing it after just one day as Undesignated At-Large Student Assembly Representative-Elect.

This campaign was a joy to run, and I’d like to thank all of the wonderful people who took us all the way to the top of the mountain, or at least to an adjacent plateau. From the bottom of my heart and the new top section on my resume, thank you, Cornell.",Trevor Davis Campaign Statement on Election Results,161,0.95,b6jzlv,https://www.reddit.com/r/Cornell/comments/b6jzlv/trevor_davis_campaign_statement_on_election/,15,1553814779.0,2019-03-28 18:12:59
Kyu_Sugardust,,When you fail all your prelims,159,0.97,b30wr7,https://i.redd.it/s3p0celpb4n21.jpg,8,1553048604.0,2019-03-19 21:23:24
