author,body,title,score,upvote ratio,id,url,comms_num,created,timestamp
whippicream,"On posts that are even semi-political, I find that there is usually a conservative comment that has been downvoted to hell at the bottom. This makes me think, is there actually a decent chunk of conservatives that are too scared to say anything? Although I might not subscribe to their beliefs, I feel as if Cornell's political culture is extremely toxic and only allows for one school of thought to reign supreme on campus.",I Feel as if There is Secretly a Large Amount of Conservatives on this Sub,208,0.86,hysv28,https://www.reddit.com/r/Cornell/comments/hysv28/i_feel_as_if_there_is_secretly_a_large_amount_of/,441,1595887508.0,2020-07-27 17:05:08
thewallstands,,Summer @ Ithaca : Stewart Park,208,1.0,hpslp2,https://i.redd.it/x8v9ir4dqea51.jpg,1,1594580167.0,2020-07-12 13:56:07
SYR2ITHthrowaway,,🔥🔥😩🔥 2020 GQ SEXIEST MAN ALIVE 🔥😩🔥🔥,209,0.97,eti2ms,https://i.redd.it/ivmh7y763tc41.png,5,1579935200.0,2020-01-25 00:53:20
goluboisuka,"Guy in frat here. Did you guys know that people in frats aren’t allowed to have guests, even though on campus students can freely go between dorms? We have to wear masks whenever not in our rooms, we can’t eat together, and now we’re being told we’re breaking the behavioral compact by having more than 10 people living in our chapters. Remember this applies to private property as well. You don’t hear anything about people in private apartments or houses needing to wear masks, do you? 

Cornell already has a very effective prevention process against partying by pretty much kicking off any deviant house without an appeal process. I get being safe and all but it’s reached a point where they’ve gone too far. The university is placing all of these restrictions on us while freshman gather by the dozens and freely walk around campus without masks. I don’t care if i get fucking downvoted, I need to vent because this is completely ridiculous.",Probably a very unpopular opinion: frats are being treated unfairly,208,0.76,in1bp6,https://www.reddit.com/r/Cornell/comments/in1bp6/probably_a_very_unpopular_opinion_frats_are_being/,48,1599342205.0,2020-09-05 16:43:25
thewallstands,,Summer @ Ithaca,207,1.0,hj86t6,https://i.redd.it/nujb6kvoa8851.jpg,6,1593630559.0,2020-07-01 14:09:19
Pinapley,,AAAAAAAAAAAAAAAAAAAAAAAAAAAAAAA,207,0.99,fcefzn,https://i.redd.it/cp01dxmrbak41.jpg,12,1583194781.0,2020-03-02 18:19:41
Pjcrafty,"Steve Aoki was amazing. I’ve never heard EDM music like that before and he had me jumping around, screaming, and having a blast the whole time. This was honestly one of the highlights of my time at Cornell. He’s just an absolutely amazing performer and I was so happy to spend today dancing to his sick music with my friends.

Mad props to the Slope Day Programming Board for making a good decision, and thank you so much to all the people giving water bottles to my dehydrated screaming ass and all the people who had to pick them up at the end of the day. Today was amazing. Cornell is amazing.",Slope Day was Fucking Lit,207,0.93,bmc2r7,https://www.reddit.com/r/Cornell/comments/bmc2r7/slope_day_was_fucking_lit/,15,1557384689.0,2019-05-09 01:51:29
DubitablyIndubitable,,When everyone has 4 prelims the week after spring break,205,1.0,bavtlh,https://i.redd.it/er7idyolg2r21.jpg,3,1554769427.0,2019-04-08 19:23:47
rickyrichboy,,Sad boi reaccs only (found in uris stacks),207,0.96,b2rg32,https://i.imgur.com/zJdsykQ.jpg,25,1552989751.0,2019-03-19 05:02:31
theHungarian33,,Cornell ranked #9 on WSJ,208,0.98,iuvymj,https://www.wsj.com/articles/best-colleges-2021-explore-the-full-wsj-the-college-ranking-list-11600383830,44,1600418149.0,2020-09-18 03:35:49
Kramyehcski,"I am a senior. For a background I switched majors and I still have a lot of requirements for my concentration  and college ones including humanities in CALS. This is my last fall so gotta keep catching up.

First round I got waitlisted for classes (2 different ones that count for the same thing, both online only) I need for my concentration. Okay I’ll pick my other in-person classes and get on the waitlist for my concentration classes. Good sorta, but still nervous for the rest of my shopping cart and looking at backup plans.

Today I have my shopping cart with the rest of my schedule needed. I couldn’t get into a backup backup concentration class (online only), I couldn’t get into the humanity I was planning on taking (also online only). I scrambled to find a plan D set of courses and I just broke down crying. This is insane. I’m a senior and all these classes left I need are completely online and full! And they are online!!!

This 6-credit cap first round completely screwed me over! If the justification of the rounds was to allow underclassmen into in-person courses why didn’t they let the first round only be for in-person classes?!? I’ve already emailed my advisor, I’ve emailed the professors and basically I was told they might have space for me to get off the waitlist but they don’t know until sept 4. I guess I’ll keep looking to fill my empty schedule spots as the waitlist isn’t a guarantee. This is absolutely absurd, this is the stuff I had to deal with as a freshman why am I doing it again as a senior?! I don’t have another fall semester for some fall only classes! I can’t just choose some credits I need most of my classes!

On top of that, hearing that freshmen got to enroll in 9 credits due to the error with FWS angers me more as they got more of their schedule filled-in and confirmed more than me as a senior (I understand I won’t need an FWS and there are no conflicts there, it’s the credit count that upsets me more).

I need to graduate on time!!! University Admins please think of us too I feel like you screwed me over on purpose!",Rant: Senior who couldn’t get into required classes. 6 credit cap should’ve been for in-persons only!,207,0.98,ii5tb9,https://www.reddit.com/r/Cornell/comments/ii5tb9/rant_senior_who_couldnt_get_into_required_classes/,40,1598645066.0,2020-08-28 15:04:26
josefrafswastebin,,took some pictures of familiar places today :p,207,0.99,i2en20,https://www.reddit.com/gallery/i2en20,12,1596413692.0,2020-08-02 19:14:52
tripsledge,"He is the model of what a professor should be doing during this time. He's very available for his students and often replies to questions in a timely manner; he reassures his students constantly that grades shouldn't be too much of a concern for us right now; he canceled a whole assignment; he decreased the scope of the project; and most importantly, he promised to take a compassionate approach to grade the prelim, since it was on the same day that we got the announcement.

Thanks, Professor Foster!",About Nate Foster,206,0.97,g5t0mp,https://www.reddit.com/r/Cornell/comments/g5t0mp/about_nate_foster/,27,1587551492.0,2020-04-22 05:31:32
HungryLikeTheMe,"This quote is from his speech at Cornell's commencement ceremony on May 31, 1987.

""I hope that zest for living, and for giving yourself to others, will accompany you on the continuing journey. For if you mortgage all your todays for some vague and gossamer tomorrow, you may find, in the end, that life's greatest joys and satisfactions have eluded you. As you continue life's journey, I encourage you to ride more merry-go-rounds and eat more ice cream. That does not mean a life of hedonism, but it does mean a life lived in the present, which is the only time we have.""

\-Frank H. T. Rhodes (October 29, 1926 - February 3, 2020)",Wonderful quote from the late Cornell President Emeritus Frank H. T. Rhodes,207,0.99,ez30ub,https://www.reddit.com/r/Cornell/comments/ez30ub/wonderful_quote_from_the_late_cornell_president/,6,1580902547.0,2020-02-05 05:35:47
Pinapley,"I signed up for pornhub premium with my Cornell email and they didn't give me a student discount. Do you think this is a problem with the website or does Cornell not offer this discount? I hope they do because I don't wanna have to refund it and use my fake MIT email, I know at least they have a good discount.

On a side note, if I post a video of the Rockefeller orgy can Cornell claim the rights to the video? Thanks!",Cornell Pornhub Premium,210,0.95,evbfcc,https://www.reddit.com/r/Cornell/comments/evbfcc/cornell_pornhub_premium/,17,1580273619.0,2020-01-28 22:53:39
Introspective_Muse,,@ everyone smh,209,0.99,bystwl,https://i.redd.it/iaw9j1ao9e331.jpg,4,1560165492.0,2019-06-10 06:18:12
,Smash that like button 😤👌 (I’m in quantum wines. I need this please),1 like = 1 extra percentage point on everyone’s finals,210,0.89,8drwet,https://www.reddit.com/r/Cornell/comments/8drwet/1_like_1_extra_percentage_point_on_everyones/,7,1524295104.0,2018-04-21 02:18:24
wafflemustard,"It was already plated when we got to the classroom, each desk beautifully adorned by a tantalizing fillet mignon. To the left of each delicious paper plate, an elegantly folded paper napkin supported a plastic fork and a real steak knife. While I was a little disappointed by the disposable place settings, I was surprised he had even managed to afford this much. To this day, I remain unsure how much of the event was paid for by his department budget versus his own salary, but the look on Mr. P’s face told me that it wasn’t important. With bated breath, he waited for us to react. All he wanted was to do something for us that we would enjoy and appreciate. The man really cared.

For a moment there was only stunned silence. It felt like the calm before the storm. Someone was going to make a noise, and then the cheering would start.

Any second now.

“Really Mr. P? Steak?”

It was that girl that sat two seats behind me.

“You’re gonna make us all take time out of class to eat and you can’t even be bothered to provide some goddamn chicken?”

“Yeah!” another classmate chimed in. “And what the hell is this timing? I brought lunch today, but if you cared about me you would have known that I buy lunch on Wednesdays! You’re making me waste money!”

They did have a point. The whole class joined in complaining. How dare he.

The look on Mr. P’s face was painful. I don’t know if there is an age at which watching a man’s soul exit his body is appropriate, but at 16, I was certainly not prepared. For the rest of the year, he was a mere shell of his former self, pushing through the monotony of teaching only because his broken mind couldn’t think of anything else to do. I never spoke to anyone about what I saw, and even now food related surprises give me terrible flashbacks. I’m not sure I’ll ever be able to bring myself to eat steak on a Tuesday again.",My high school teacher gave out free steak on Tuesday,206,0.96,hpjkrg,https://www.reddit.com/r/Cornell/comments/hpjkrg/my_high_school_teacher_gave_out_free_steak_on/,10,1594536894.0,2020-07-12 01:54:54
roblered,,the swim test on a virtual campus,206,0.99,fhzqzk,https://i.redd.it/7y478lsn0gm41.jpg,5,1584135393.0,2020-03-13 16:36:33
tripsledge,,Martha really changed her look over the quarantine?,205,0.99,i4evg4,https://i.redd.it/gik721ura9f51.jpg,14,1596693628.0,2020-08-06 01:00:28
prettylittleliongirl,"Cornell is telling on campus students “hey, BTW you need to pay for a hotel, which will probably cost around $150/night, that you’ll stay in alone for 14 days with absolutely nothing to do as you watch your pockets drain. Do this and feel good about yourself! If you don’t do it... there are literally no personal consequences so have fun making the choice!”

I’m not coming back on campus this semester, and I’m fortunate I had the ability to make this choice. For my on campus friends: stay safe, Cornell is really being sucky",You realize that Cornell is penalizing students for choosing to quarantine? This is why their plan won’t work,203,0.97,i1hn6t,https://www.reddit.com/r/Cornell/comments/i1hn6t/you_realize_that_cornell_is_penalizing_students/,64,1596265632.0,2020-08-01 02:07:12
cornellcovidthrow,"Hi, incoming freshman here. I just received my housing assignment and reached out to my roommate.

To my horror, he believes that coronavirus is a ""Democratic hoax"" to take over ""Trump's presidency."" He apparently hasn't been social distancing or wearing a mask anywhere he goes and has been partying this whole time, and he's from a very case-heavy state. I voiced my concerns and he basically called me a pussy and even if corona isn't a conspiracy theory that I'll be fine since I'm a college student. He also said he's gonna be holding parties in our dorm room which I'm very apprehensive about.

Well I don't know about y'all but I'm concerned about having long term lung damage from coronavirus, not just the mortality rate ([https://www.bbc.com/news/uk-northern-ireland-53356593](https://www.bbc.com/news/uk-northern-ireland-53356593)).

Is there some way to switch roommates at this point? I really want to attend my first semester in person but with this risk of a roommate I'm not sure if it's worth it.

Update: for those asking to see our text exchange, here it is. I only included the portions where our names aren't mentioned: http://imgur.com/a/gnh4Bg0 (edited to remove phone number)",Found out roommate believes coronavirus is a hoax - plans to hold parties in dorm room,205,0.97,i07af2,https://www.reddit.com/r/Cornell/comments/i07af2/found_out_roommate_believes_coronavirus_is_a_hoax/,64,1596080843.0,2020-07-29 22:47:23
,,That is pretty epic. Denice’s emails are that good shit,208,0.98,gp60qx,https://i.imgur.com/y6MgkfO_d.jpg?maxwidth=640&shape=thumb&fidelity=medium,0,1590273642.0,2020-05-23 17:40:42
SYR2ITHthrowaway,,"When in the Course of human events, it becomes necessary for one people to dissolve the political bands...",202,0.99,eb4mq6,https://i.redd.it/6o5ecn8j2v441.png,5,1576472498.0,2019-12-15 23:01:38
tripsledge,,FUCK that guy,202,0.95,i4ffrv,https://i.redd.it/9s7eknnfg9f51.png,11,1596695536.0,2020-08-06 01:32:16
keiwein1,,Clock tower,205,1.0,h12jp8,https://i.redd.it/m1x6zh2y4b451.jpg,11,1591921555.0,2020-06-11 19:25:55
pete716,,Birds eye view from today,201,1.0,g81vvc,https://i.redd.it/zxr8eu7p91v41.jpg,8,1587879470.0,2020-04-26 00:37:50
sweatystartup,"Nick Huber here - 2012 alum and Storage Squad founder. My heart goes out to all of you. I met my wife in April of senior year. It brings a tear to my eye when I think about how much this has changed your world.

Cornell made a deal with us at about 7pm today to offer free storage for on campus students. We'll be **delivering free boxes tomorrow out of RPCC and William Keeton Office starting at about 11am**. We'll be at those two locations all week so students can come get supplies. There is a 4 box limit for collection tomorrow until a big shipment of boxes gets in on Monday night. This is not a storage limit but a packing supply limit because there is a shortage. 

**Students will pack up, label their stuff, and leave it in the dorms.** We'll come back in April to pick everything up.

I'm honored to serve you all during this incredibly difficult time. If you'd like to get involved we pay $15 per hour + tips. We have been working 20 hours a day to assemble a team and we still need help servicing the off campus housing folks.

This opportunity will likely save my company and my home as we lost all of our business at most of our other markets.

Cornell has amazing leadership and other schools are not offering this. They are really stepping up to the plate when it matters. 

We'll all come out of this stronger than ever. GO BIG RED.

PS. I know promotion isn't allowed. Feel free to delete. But this week has been so messed up and I haven't slept in 40 hours.",Cornell to provide free storage for on campus students,203,0.99,fiahky,https://www.reddit.com/r/Cornell/comments/fiahky/cornell_to_provide_free_storage_for_on_campus/,75,1584177016.0,2020-03-14 04:10:16
jRawr13,,Only a 5 day difference!,205,0.99,bhaw5h,https://i.redd.it/uxk4w46fwfu21.jpg,10,1556239681.0,2019-04-25 19:48:01
spikeleemyspiritanim,"Someone just posted here about feeling depressed and seemed to be suicidal. By the time I finished typing my response it seemed they had deleted their post and their account. In case they are still browsing here, I figured I'd post the response so they can still get the message (and I guess it could be helpful to others as well).

If this type of post isn't allowed, sorry! Also, if you think I missed anything or said anything wrong feel free to correct it.



Hey, I'm sorry you're feeling the way you do. Cornell can definitely provide an environment that for many people amplifies or in some cases creates sources of stress that leads to depression and anxiety and more. I'm not a mental health professional so I may not be able to offer the most help, and I'd say most people agree that just telling people ""it gets better!"" is demeaning and futile, so I'll refrain. That being said, I'd say you aren't alone in how you feel, even when you think you are. I know that sounds paradoxical and probably isn't helpful, but I think it's important to be reminded.

It would seem from your description that your friends and family don't know about your situation, which is okay for now. Some people don't like to tell the people around them how they're feeling inside and need the time to come around to even begin considering opening up to someone. If you have a friend or family member that you think would understand, you might find it useful to open up to them and tell them how you feel. It's easier said than done and can be daunting, but remember that you do get to control how much you tell them all at once. It seems from what you say that these people probably care about you, and I'm sure they'd want to know if that is the case. But again, at your own pace.

Your final statement suggests you're feeling suicidal. There's no shame in that, it can happen to anyone. It would, however, benefit you to seek some sort of help. Perhaps not at first as it can be a very long curve to starting to feel more like yourself. Like I said, suicidal thoughts aren't shameful but it is definitely the sort of thing you'd want to take very seriously and try to get some aid. I'm not going to assume you have any one sort of path to seek out, such as the ability to pay for a doctor / CAPS, or the strength to go yet (it can be difficult for some). That said, I will leave some resources here for you. Even if you don't want to seek professional help just yet, there are things you can try. My inbox is open whenever you want to speak with someone anonymously is also open.

607-255-5155 You can use this number to contact Cornell health at any time, and for urgent concerns.

[General information regarding CAPS](https://health.cornell.edu/services/counseling-psychiatry)

In the event that you can't pay for or don't want to wait for a CAPS appointment, you can attend [Let's Talk Drop-In Counseling hours](https://health.cornell.edu/services/counseling-psychiatry/lets-talk) staffed by various mental health professionals in an informal setting. No appointment necessary, just walk in and talk Monday to Friday.

[Mental Health Association in Tompkins County](http://mhaedu.org/) I don't know all that much about the organization, but I've heard they really care and I've met Jacob who works there and is incredible. They have some of their own resources.

National Suicide Prevention Hotline 24/7 1-800-273-8255 
[NSPH Website](https://suicidepreventionlifeline.org/) On the website, they've also got a chat ability.

Of course, as above, my inbox on here is always open as well. I'm not the most knowledgeable so perhaps someone else can suggest some more resources/thoughts. I would also say that, if you do start counseling, you may need to try a few doctors before you find the one you feel comfortable with. That is completely okay! Don't feel like it's useless because you couldn't work with the first counselor you get.

You may not feel like it, but you've made some progress by posting here. In a way, it is your (I assume) first attempt to reach out and open up. That can be a difficult process and you've started overcoming that first obstacle!

I wish you the best, and want to reiterate you aren't alone or hopeless. My inbox is open.","Re: ""Depressed"" post",206,0.96,8bw98y,https://www.reddit.com/r/Cornell/comments/8bw98y/re_depressed_post/,8,1523619515.0,2018-04-13 06:38:35
Substantial_Ad8238,"&#x200B;

https://preview.redd.it/zun1zcghjzi51.jpg?width=2048&format=pjpg&auto=webp&s=b706189aebb59dead1fbbff4ed6eb3cd50b3db7c

https://preview.redd.it/eb70haghjzi51.jpg?width=2048&format=pjpg&auto=webp&s=8842d242cf833b0e187208c7e59792dc2488ecc9

https://preview.redd.it/611ffifhjzi51.jpg?width=1392&format=pjpg&auto=webp&s=fd566fb43607c87dde294e358afa7ffaf09d6353

https://preview.redd.it/ert2zgfhjzi51.jpg?width=2048&format=pjpg&auto=webp&s=8e8c4613374dccc0031d62018d4ddd61c908a59e

https://preview.redd.it/57bhueghjzi51.jpg?width=2048&format=pjpg&auto=webp&s=6dc0b7e68ffc7dd5bfb24a9db9855bf62d3a93bc

https://preview.redd.it/0hp2b3fhjzi51.jpg?width=2048&format=pjpg&auto=webp&s=1c095b1385e3cdef066ddb63955bfe847c4a5b8c

https://preview.redd.it/jfvwg5fhjzi51.jpg?width=2048&format=pjpg&auto=webp&s=ed5bde26642f589e31a247d445334c7213d7cce5

https://preview.redd.it/skojd6fhjzi51.jpg?width=2048&format=pjpg&auto=webp&s=c16bd5b02430ceae06aaf5717ca81c7ab6383e63

https://preview.redd.it/acjkv1fhjzi51.jpg?width=1600&format=pjpg&auto=webp&s=a5964969c03c4dc8216632947dfce4f130c30f55

https://preview.redd.it/2572q5fhjzi51.jpg?width=2048&format=pjpg&auto=webp&s=b20ad6d8a0c41f28ab2a1ba19fd5e9ebc3870a8d

https://preview.redd.it/g35mc3fhjzi51.jpg?width=1599&format=pjpg&auto=webp&s=56703fca5e245b07f435c0caad66087ad1896ca9

https://preview.redd.it/1ihvc0fhjzi51.jpg?width=2048&format=pjpg&auto=webp&s=13787d5eec422423c400540a226ca41715183a2d

https://preview.redd.it/903tdbfhjzi51.jpg?width=2048&format=pjpg&auto=webp&s=7a8d99adf4a51669d1d49c9f2cb78ff670e87065

https://preview.redd.it/q7o97jfhjzi51.jpg?width=1527&format=pjpg&auto=webp&s=6a010840bab8d55f388131133f3820c823bfb14e

https://preview.redd.it/oawlv8fhjzi51.jpg?width=1395&format=pjpg&auto=webp&s=4eaaf44bfd6b624d33a8246efdd04f3f7f3141ef

https://preview.redd.it/g1l3rxehjzi51.jpg?width=1600&format=pjpg&auto=webp&s=8fa1558e33f70f3ed7d49c595d70bb20713bf6c1

https://preview.redd.it/2ba6m1fhjzi51.jpg?width=1914&format=pjpg&auto=webp&s=b8f11a3bb4a55c8841f6bc1c95f265bb91486e1a",For Everyone In Quarantine / Unable to be on Campus. A Moment of Silence For Our Beautiful Campus AD 2019-2020,202,0.99,iftjij,https://www.reddit.com/r/Cornell/comments/iftjij/for_everyone_in_quarantine_unable_to_be_on_campus/,3,1598319066.0,2020-08-24 20:31:06
itsuredobelikethat,,"""This is a closed note exam. You are not allowed to use any external resources.""",204,0.99,ga14aq,https://i.redd.it/b8mnkvkl4ov41.png,14,1588156198.0,2020-04-29 05:29:58
SYR2ITHthrowaway,,These YouTube lecture collabs are getting weird,205,0.98,fn31yf,https://i.redd.it/b4r0t8dwa9o41.png,2,1584925846.0,2020-03-22 20:10:46
HjoBanahogg,"If there are any Olympic recruiters on this subreddit, please consider my neighbors that live one floor above me.

• Every morning, they leap out of bed, and stomp so hard on their way to the restroom that they must be either sprinting or doing burpees after every goddamn step. 

• The grind never stops: at any given moment in the 24 hour day, they are clearly jumping, running, or hustling in an amazing feat of endurance and super-human levels of activity.

• Despite being asked to tone it down multiple times, they refuse to stop, which shows that they won’t be discouraged by the h8rs.

So if you need an Olympian, come on down to Collegetown Plaza and please take these fucking A1 athletes somewhere with better athletic facilities to prepare for the 2020 Olympics.",Calling all Olympic recruiters,202,0.98,dxwxuf,https://www.reddit.com/r/Cornell/comments/dxwxuf/calling_all_olympic_recruiters/,16,1574073463.0,2019-11-18 04:37:43
altruyzm,"This isn't really a problem for anyone outside my suite, but there's this one guy who keeps pooping in the shower in the morning. I get peeing in the shower since it just runs down, but most of the poop still stays on the ground and it just stinks up the whole place. I wear flip-flops when I shower but it still grosses me out when I see streaks of brown on the walls and visible lumps of poop on the floor.

We've tried confronting the guy and he says that everyone in his family does it and we're all a bunch of ""pussies for not being able to deal with a little poop."" I don't think this is a normal thing, and everyone else in the suite agrees. What steps can we take to get him to stop?

Edit: This is actually getting ridiculous. I accidentally left my shampoo in the shower last night and he shat all over it this morning. Not sure what I'm gonna do now.

UPDATE (1/25/2019): So the guy in question didn't turn up after break ... Turns out he applied to transfer dorms for the spring semester and he was moved to Donlon (or Dickson, can't remember which). Thank GOD I don't have to deal with that devil's spawn anymore.",Pooping in the shower,204,0.96,a50fil,https://www.reddit.com/r/Cornell/comments/a50fil/pooping_in_the_shower/,40,1544508857.0,2018-12-11 00:14:17
micabobo,,Nothing but RESPECT for my 👉😎👈 local CollegeBagel Town.,202,0.99,iu1h1z,https://i.redd.it/j1y50ecuzjn51.jpg,10,1600309913.0,2020-09-16 21:31:53
tripsledge,,Oh this is going to end up going so well (/s),204,0.99,hou83r,https://i.redd.it/evajv8kqo2a51.jpg,17,1594434339.0,2020-07-10 21:25:39
BoBigBed,,Eat the SAFC,205,0.93,hhftm3,https://i.redd.it/m031jyry0o751.jpg,8,1593385209.0,2020-06-28 18:00:09
