author,body,title,score,upvote ratio,id,url,comms_num,created,timestamp
Kimba_the_White_Lion,"Congratulations!  You are halfway to making the greatest decision of your life :P.  Well, maybe not (marriage and stuff), but you'll definitely have the greatest 4 years of your life if you decide to enroll.

If you have any questions, please ask!  We'd love to answer them for you.  If you'd like to Skype with anyone, please PM on reddit:

* [guinness_blaine](http://www.reddit.com/u/guinnes_blaine)
* [redditthemusical](http://www.reddit.com/u/redditthemusical)
* [Choiboy525](http://www.reddit.com/u/Choiboy525)
* [Kimba_the_White_Lion](http://www.reddit.com/u/Kimba_the_White_Lion)
* [perpetual_motion](http://www.reddit.com/u/perpetual_motion)
* [Overunderrated](http://www.reddit.com/u/Overunderrated) (Sketchy grad student volunteer)

Just message one of us and we'd love to have a 1on1 with you.

For those on the waitlist, don't get your hopes down!  Half of my friends and I were on the waitlist, ended up here, and love it!

For those who didn't make it, I'm sorry to hear that, but I'm sure you still got into an amazing school!  

Congratulations again to the Class of 2016!

 [](/c02 ""Let's Party!"") 

---------------------------

**Princeton preview:**  
    Thursday, April 19 to Saturday, April 21  
    Thursday, April 26 to Saturday, April 28","Congratulations to the Class of 2016!  If you have any questions or would like to Skype with a current student/alumni, please ask in this thread!",12,0.88,rk4pt,https://www.reddit.com/r/princeton/comments/rk4pt/congratulations_to_the_class_of_2016_if_you_have/,44,1333095959.0,2012-03-30 03:25:59
SimplyJif,,Tigers spoil Penn's title hopes,11,0.92,ql6yt,http://www.dailyprincetonian.com/2012/03/07/30230/,0,1331120252.0,2012-03-07 05:37:32
Kimba_the_White_Lion,WHO'S PROCRASTINATING RIGHT NOW?!?!!?!,DEANS DATE!!!!!,9,0.77,okjy3,https://www.reddit.com/r/princeton/comments/okjy3/deans_date/,6,1326811890.0,2012-01-17 08:51:30
princeton,,Occupy Princeton at JPMorgan Chase TSS Info Session,11,0.76,n781n,http://www.youtube.com/watch?v=NJ0J_HUsRaI,1,1323529344.0,2011-12-10 09:02:24
spiritualized4,"Basically, I was overambitious and chose some advanced courses over their easier counterparts (i.e. PHY 105 vs 103, MAT 203 vs 201, etc). Now that my (abysmal) midterm grades are trickling back in, I'm realizing that was a really stupid decision I made. I'm pretty sure it's too late to drop now but can anybody give me any advice/insight over what I should/can do?",Give advice to a silly freshman who chose courses too hard for him,11,0.92,lrvvq,https://www.reddit.com/r/princeton/comments/lrvvq/give_advice_to_a_silly_freshman_who_chose_courses/,9,1319806885.0,2011-10-28 08:01:25
Kimba_the_White_Lion,"I just came back from my Leader Training Trip (where I learn to lead you guys in the fall) and it was awesome.  I'm pumped up to lead and want all freshman to do this.  When I did OA in the fall, I met my best friends and had an awesome time.  If you have any questions regarding OA, we'll be glad to answer.

P.S. Community Action isn't too shabby either.","Attention all incoming freshman, do Outdoor Action!",11,0.92,hszqt,https://www.reddit.com/r/princeton/comments/hszqt/attention_all_incoming_freshman_do_outdoor_action/,15,1307410280.0,2011-06-06 20:31:20
princeton,,The Smart Man's 'Jersey Shore',13,0.89,hdxy3,http://www.gq.com/entertainment/humor/201006/princeton-university-reunion-weekend-party?printable=true,3,1305720550.0,2011-05-18 07:09:10
UniversityClassChats,,"Here's a spreadsheet to all of the Princeton Fall Chats, including Class, Majors, and Interests Chats and the '24 chat!",10,0.85,ioyti1,https://docs.google.com/spreadsheets/d/1WPSjxqJcsJec5wIyG0caOS31YJrcCR_dozw2rlFtDT8/edit?usp=sharing,0,1599617596.0,2020-09-08 21:13:16
nfc0131,"Hey all! I've been thinking about colleges to apply to and Princeton is definitely an appealing option. Its status as arguably the #1 university in the U.S. is a big draw, and the academics are world class. So world class, in fact, that they to be the predominant talking point on Princeton's website, among other places. After completing virtual tours and info sessions for many other schools, Princeton seems like the most ""Work. Sleep. Repeat."" of all the ivies. I know my perspective is limited from these sources, so that's where you come in: How much of a workaholic school is Princeton? Do most people have time for recreation/reflection while maintaining normal sleep schedules?",Campus Culture Question,9,0.77,hhrz4u,https://www.reddit.com/r/princeton/comments/hhrz4u/campus_culture_question/,2,1593428057.0,2020-06-29 05:54:17
yagulito,,Dear dear family dear,10,0.73,go47p4,https://v.redd.it/rxtc3mqcd6051,0,1590120531.0,2020-05-21 23:08:51
binaryleaf,"Hello! Am an incoming graduate student this fall, and just got housing assignment - I couldn't really find a lot of information on NGC housing but wanted to ask if anyone here had opinions/could provide more info about NGC, and whether I should accept the contract or consider something else? I saw an old post talk about avoiding it but it was a long time ago, so I'm not sure if it's still accurate.

&#x200B;

Thanks! :)",New Graduate College?,9,0.86,gj60a0,https://www.reddit.com/r/princeton/comments/gj60a0/new_graduate_college/,7,1589427396.0,2020-05-13 22:36:36
different_cryogenic,"Pretty much the title. I visited this summer and absolutely loved the campus and Princeton has always been a huge dream of mine. But I’ve always wanted to know something that google doesn’t really help with, and that’s personal experiences. What’s the culture like in the student body? Is it academically focused and competitive? Or social and friendly and inviting? Thanks for the help!","Hey, a hopeful high schooler here. General question for those who attend or had attended, what’s the general Culture at Princeton like?",10,0.86,d4gkqn,https://www.reddit.com/r/princeton/comments/d4gkqn/hey_a_hopeful_high_schooler_here_general_question/,16,1568555086.0,2019-09-15 08:44:46
honey-bubble-tea,"Hi there! Princeton prefrosh here,

First of all, I played flute for my school since 6th grade, but our program was rather lax. Nevertheless, it became something I truly appreciated being involved in and followed through until my senior year, playing around level 3 music. Getting into the university, I was very excited but couldn’t help but feel intimidated with the amount talent out there. Especially after looking at others’ auditions to college music programs online, I feel severely underprepared. (Honestly, I don’t even have all my scales memorized! Bb major and that’s it.) My fear would be embarrassing myself during an audition. It was always a plan of mine to continue music in college, but will that be possible for me in Princeton when my music skills are lacking? I honestly do want to get better and join an ensemble but is it better to pursue this as a personal hobby instead?",Pursuing music as an extracurricular at Princeton University,10,0.92,c42hbr,https://www.reddit.com/r/princeton/comments/c42hbr/pursuing_music_as_an_extracurricular_at_princeton/,6,1561315016.0,2019-06-23 13:36:56
princeton,,Google AI lab formally opens in downtown Princeton,10,0.92,bttfjs,https://www.princeton.edu/news/2019/05/03/google-ai-lab-formally-opens-downtown-princeton-bolstering-innovation-and-invention,0,1559031825.0,2019-05-28 03:23:45
dwhitewood,,Best vegan/vegetarian spots downtown?,10,0.86,bghpfq,https://www.reddit.com/r/princeton/comments/bghpfq/best_veganvegetarian_spots_downtown/,4,1556062100.0,2019-04-23 18:28:20
broadcity1219,"Hi! 28 F here. I moved to the area about a year ago for work and, now that I’m working from home, really need to get out and do things during the week. And make friends. I love meeting new people and am always down for an adventure so message me and let’s chat :) ",New friends!,9,0.77,aelsoc,https://www.reddit.com/r/princeton/comments/aelsoc/new_friends/,7,1547173337.0,2019-01-10 20:22:17
Philosophic_Fox,"For example, is there a different rate for, let's say, Engineer Majors than English, etc?","Does anyone know the acceptance rates of different departments, or is it only the one estimate?",10,0.92,9q1mi8,https://www.reddit.com/r/princeton/comments/9q1mi8/does_anyone_know_the_acceptance_rates_of/,1,1540134038.0,2018-10-21 10:00:38
keian123,"Can those of you that are currently attending or have attended Princeton in the past share with me how your experience was? I’ll probably try to enter into the economics program or Woodrow Wilson school. 

Let me know what your favorite and least favorite thing about Princeton is.

How liberal or conservative would you say it is?

How are the eating clubs?

How is the workload, and do you have time to pursue your own interests on the side?

How are the clubs and sports?

How is the housing?

Lastly, how are the professors?",I’m thinking about applying EA to Princeton,10,0.86,8tqgc7,https://www.reddit.com/r/princeton/comments/8tqgc7/im_thinking_about_applying_ea_to_princeton/,6,1529961615.0,2018-06-25 16:20:15
KeepEatingBeets,"Hi all,

After careful research, I have concluded that this subreddit's banner color is not consistent with Princeton's color identity. In fact, it occupies some muddled ground in the color space between yellow, orange, gold, honey, tangerine, and carrot (see: [color shade names](https://digitalsynopsis.com/design/color-thesaurus-correct-names-of-shades/)).

According to the [Guide to Princeton University's Graphic Identity](http://trademrk.princeton.edu/secure/uisg/UniversitySG.pdf), ""Princeton Orange"" is defined as PMS 158, a spot color in the [Pantone](https://en.wikipedia.org/wiki/Pantone) Matching System color space. The Guide indicates that the hex equivalent to this color is [#ee7f2d](https://www.colorhexa.com/ee7f2d).

However, the [Office of Communications](https://communications.princeton.edu/guides-tools/logo-brand-assets) notes that PMS 158 is meant for use in print--paper, apparel, and sundries. On the web, Princeton uses [#e77500](https://www.colorhexa.com/e77500) on white backgrounds and [#f58025](https://www.colorhexa.com/f58025) on black backgrounds. Given the current formatting of this subreddit, the former seems to be the most appropriate choice.

Other considerations: The [2007 Princeton Athletics Identity Style Guide](http://trademrk.princeton.edu/secure/protected/AthleticsStyleGuide.pdf) defines ""Athletics Orange"" as PMS 165. However, like PMS 158, this is also meant for use in print. Additionally, ColorHexa refers to [#ff8f00](https://www.colorhexa.com/ff8f00) as Princeton Orange but this is inconsistent with the guidance provided in Princeton's own Guide to Graphic Identity.

Thank you for your time.",The color in the banner is NOT orange,10,0.83,8c30h0,https://www.reddit.com/r/princeton/comments/8c30h0/the_color_in_the_banner_is_not_orange/,0,1523685698.0,2018-04-14 01:01:38
Diablobuster,"I'm currently looking into Princeton and all of its programs.  I have always been interested in politics and public policy, and I was wondering what you all thought of the Woodrow Wilson School.  If you have attended or know anything about it, I'd appreciate any input on it.  My main questions are: is it worth it? Was it a good experience? Also, what type of jobs will that degree land you in the future? 

edit: I would be going for the undergrad program.
",Thoughts on Woodrow Wilson School,9,0.85,7mcsx4,https://www.reddit.com/r/princeton/comments/7mcsx4/thoughts_on_woodrow_wilson_school/,5,1514377726.0,2017-12-27 06:28:46
btomlins,,The Princeton and Slavery Project is featured in the Nov. 8 issue of the Princeton Alumni Weekly,9,0.85,7be38i,https://paw.princeton.edu/tags/slavery,0,1510099237.0,2017-11-07 18:00:37
PaipsJimmy,"How flexible is the math major at Princeton? Is it possible to take lots of physics courses while majoring in math (would they count towards my major?)?

I have a strong interest in both math and physics (I want to pursue a career in mathematical/theoretical physics), and I do not know if I should major in math or physics.",The math major at Princeton,10,1.0,6577md,https://www.reddit.com/r/princeton/comments/6577md/the_math_major_at_princeton/,5,1492135842.0,2017-04-13 21:10:42
btdubs,,"Trustees adopt report, recommendations of committee on Woodrow Wilson's legacy at Princeton",10,0.92,4dbn22,http://www.princeton.edu/main/news/archive/S45/97/32G05/index.xml,0,1459813621.0,2016-04-04 18:47:01
SikhSoldiers,,"The acceptance rate for regular decision candidates, including those who were deferred, is 3.8 percent.",11,0.93,4ctjm3,http://dailyprincetonian.com/news/2016/03/u-admits-6-46-percent-of-applicants-for-class-of-2020/,10,1459507933.0,2016-04-01 05:52:13
yungmoni,What's it like to be a grad student at Princeton? I got admitted but I wanted to know how life is for a typical grad student in terms of social life and how you balance courseload with TAship.,Graduate life at Princeton?,9,0.92,4b3h3i,https://www.reddit.com/r/princeton/comments/4b3h3i/graduate_life_at_princeton/,8,1458430013.0,2016-03-19 18:26:53
princeton,,Princeton University During World War II,11,1.0,43kj5e,https://blogs.princeton.edu/mudd/2016/01/princeton-university-during-world-war-ii/,0,1454298083.0,2016-01-31 21:41:23
lindseychris,,Greenpeace alleges U. professor accepted monetary compensation for writing research papers,10,0.81,3we8d2,http://dailyprincetonian.com/news/2015/12/greenpeace-alleges-u-professor-accepted-monetary-compensation-for-writing-research-papers/,0,1449881008.0,2015-12-11 18:43:28
princeton,,"At Princeton, Woodrow Wilson, a Heralded Alum, Is Recast as an Intolerant One",10,0.86,3ty0af,http://www.nytimes.com/2015/11/23/nyregion/at-princeton-addressing-a-racist-legacy-and-seeking-to-remove-woodrow-wilsons-name.html?hp&action=click&pgtype=Homepage&clickSource=story-heading&module=second-column-region&region=top-news&WT.nav=top-news&_r=0,3,1448317365.0,2015-11-23 16:22:45
TurnTheTVOff,,Circumcision protest group to demonstrate in Princeton,10,1.0,3m0p2v,http://www.nj.com/healthfit/index.ssf/2015/09/anti-circumcision_group_to_protest_in_princeton_to.html#incart_river,0,1443005068.0,2015-09-23 05:44:28
princeton,,"After 85-year search, massless particle with promise for next-generation electronics discovered",10,0.92,3do48h,https://www.princeton.edu/main/news/archive/S43/64/59M11/index.xml?section=topstories,0,1437196884.0,2015-07-18 00:21:24
,,"University Store employee swiped $26k from register, police say",10,0.87,3cuzjv,http://www.nj.com/mercer/index.ssf/2015/07/princeton_university_store_employee_swiped_26k_fro.html,1,1436602358.0,2015-07-11 03:12:38
braaak,,Yik Yak considers disabling posts from Princeton U.'s region,10,1.0,32x5un,http://dailyprincetonian.com/news/2015/04/yik-yak-considers-disabling-posts-from-u-s-region/,2,1429306291.0,2015-04-17 16:31:31
princeton,,Davidson '92 dies after being shot in Boston hospital,9,0.92,2t8wok,http://dailyprincetonian.com/news/2015/01/breaking-davidson-92-dies-after-being-shot-in-boston-hospital/,0,1421924015.0,2015-01-22 04:53:35
princeton,,New York Times Breaks Local Campus News Before Local Campus Newspaper,11,0.92,2o0hhe,http://www.tigermag.com/2014/12/breaking-new-york-times-breaks-local-campus-news-before-local-campus-newspaper/,0,1417521903.0,2014-12-02 06:05:03
princeton,,U. offers alumni free access to library electronic resources,10,0.92,2lqdd3,http://dailyprincetonian.com/news/2014/11/u-offers-alumni-free-access-to-library-electronic-resources/,3,1415532155.0,2014-11-09 05:22:35
RUScrewd3456,,Costco closes deal to purchase 17 acres in Lawrence for new store near Quaker Bridge Mall,10,0.92,2lnc6x,http://s.nj.com/Ag0QCsI,1,1415449689.0,2014-11-08 06:28:09
WorldTravelBucket,,Princeton University professor will fight theft charges in lawn sign caper,11,0.87,2bbful,http://www.nj.com/mercer/index.ssf/2014/07/princeton_university_professor_will_fight_theft_charges_in_lawn_sign_caper.html#incart_m-rpt-1,0,1405996157.0,2014-07-21 21:29:17
Kimba_the_White_Lion,Welcome back alumni.  Stay safe and have fun!,Did someone say REUNIONS!!!!!!!!!!!!,10,0.78,26sp4e,https://www.reddit.com/r/princeton/comments/26sp4e/did_someone_say_reunions/,9,1401409288.0,2014-05-29 19:21:28
princeton,,$10 of Free Bitcoin For College Students,12,0.8,25mzz3,http://blog.coinbase.com/post/85758038492/10-of-free-bitcoin-for-college-students,0,1400201949.0,2014-05-15 19:59:09
nosire,"[Here's a Flyer](http://i.imgur.com/2Qsas5d.jpg)

Free show, doors at 11pm. Open to Princeton students and their guests. I'm just incredibly excited because Daedelus is my inspiration and I saw him play at Terrace 5 years ago and it changed my entire life.

Hope to see you there!",I'm playing a show with Daedelus at Terrace F Club April 17th,11,0.84,22b4l8,https://www.reddit.com/r/princeton/comments/22b4l8/im_playing_a_show_with_daedelus_at_terrace_f_club/,1,1396771734.0,2014-04-06 03:08:54
rb552,"Hey everyone, I am a newly admitted student to Princeton as of today. I am for sure going to Princeton and was just wondering if somebody could explain how the residential college and eating club situation works. Also, how each of the dorms are! Are they all doubles? Any singles? Do you get a single as you get older? I think I just need some clarification. Also, do you get to pick you residential college?

Thanks for the help!",Question about residential life at Princeton.,10,0.87,21kkmu,https://www.reddit.com/r/princeton/comments/21kkmu/question_about_residential_life_at_princeton/,4,1396011919.0,2014-03-28 08:05:19
princeton,,Princeton receives 3rd highest number of applications with Class of 2018,11,0.92,1w7l92,http://dailyprincetonian.com/news/2014/01/princeton-receives-3rd-highest-number-of-applications-with-class-of-2018/,0,1390791401.0,2014-01-26 20:56:41
Choiboy525,,Tiger Cubs! New members of the Class of 2018 were admitted today.,11,0.92,1t0m8m,http://www.princeton.edu/main/news/archive/S38/72/07C48/index.xml,9,1387241966.0,2013-12-16 18:59:26
putiger,,Really?,10,0.92,1mjrm6,http://ttrade.tigerapps.org/item/10618,1,1379416126.0,2013-09-17 06:08:46
Kimba_the_White_Lion,"Source: that email Dean Dunn sent us. 

If this is wrong, please tell me and I'll edit it.","For those voting tomorrow, I believe that the voting booths are in Icahn on Poe Field.  For those who live in eating clubs, you vote in the CS building.",10,0.92,12oar3,https://www.reddit.com/r/princeton/comments/12oar3/for_those_voting_tomorrow_i_believe_that_the/,1,1352163815.0,2012-11-05 19:03:35
princeton,,Football: Princeton Tops the Ivy League After 2 Dismal Seasons,10,0.86,126t9x,http://www.nytimes.com/2012/10/27/sports/ncaafootball/princeton-tigers-are-unexpected-success-in-ivy-football.html,0,1351400688.0,2012-10-28 00:04:48
that_shits_cray,,Here it is! The Princeton Meet-Up! ,10,0.79,yago8,http://redditgifts.com/meetups/princeton-reddit-meet-up/,0,1345103097.0,2012-08-16 02:44:57
Kimba_the_White_Lion,"Welcome newcomers and thanks to the old timers who still stick around

**Around the Ivy League**

* Brown:           377
* Columbia:      425
* Cornell:          712
* Dartmouth:     115
* Harvard:         338
* UPenn:           341
* Yale (SUCKS): 271","Oh snap, 300 Tigers!",9,0.8,s3kxa,https://www.reddit.com/r/princeton/comments/s3kxa/oh_snap_300_tigers/,0,1334136784.0,2012-04-11 04:33:04
MrMoogle,"I've been following PFML for about a year and I've always wondered about this. Also, if anybody can provide the original Tony Hayward post, that would be absolutely amazing. ",Can anybody explain to me the origins of Tony Hayward on PFML? ,10,0.92,p7dqu,https://www.reddit.com/r/princeton/comments/p7dqu/can_anybody_explain_to_me_the_origins_of_tony/,6,1328192688.0,2012-02-02 08:24:48
Kimba_the_White_Lion,"Just wanted to say Happy Holidays and Happy New Years to all the predditors out there, you guys make the school so awesome and are the reason I fucking love this place so much.  

 [](/rdsalute ""I can always use the pony picture if nopony cares"") That said, I think we should have a banner update (or not depending on how much people like each new logo).  If anyone comes up with an idea for a banner, post it.  If you can photoshop a banner, post it!  The more options we have the merrier.

I'm going to be procrastinating during reading week by learning CSS so tell me what layouts you think might be cool.  If you want a clean reddit with nothing changed, please say so. 

Right now we're losing to /r/upenn, /r/columbia, and /r/cornell in subscribers and activity  [](/c20 ""I hate losing"") and I say we correct that... somehow.  If you guys play any games that other redditors play as well (starcraft, minecraft, tf2) post about it and maybe we could form a clan or something.  

Happy Holidays everybody!",Holiday greetings before I go on vacation.,10,0.78,np8wi,https://www.reddit.com/r/princeton/comments/np8wi/holiday_greetings_before_i_go_on_vacation/,4,1324775022.0,2011-12-24 19:03:42
Kimba_the_White_Lion,"http://blog.reddit.com/2011/08/grow-college-subreddit-competition.html

Hey Princeton redditors! (Predditors?  I think that sounds cool enough)  

If you saw the front page today, there's a competition for the most overall growth of a subreddit.  We are a pretty inactive subreddit (I blame princetonfml) but that can change easily.  How you would guys like to see this subreddit used?  To discuss classes, class reviews, parties, upcoming events, get togethers, etc...

I'll put up posters or signs to try to catch the eye of redditors that haven't joined this subreddit yet when classes start in the fall.   If you guys spread the word to your friends who use reddit but not the sub, that'll be great too.

So while the winning the competition would be awesome, making this a cool subreddit is the number one goal.  I'll make a post at the end of August to remind you guys that the competition started.

In the meantime, how would you guys like to see this subreddit be used, and do you like the name Predditors?

[](/c22 ""Where my bronies at?"")",College subreddit challenge [cross-post from the blog),10,0.86,j81b5,https://www.reddit.com/r/princeton/comments/j81b5/college_subreddit_challenge_crosspost_from_the/,11,1312428939.0,2011-08-03 22:35:39
thiqqnquicc,"I have quite the quantity of plastic bottles and paper box’s that need to be recycled, and I mean a lot a lot. 

Figured I’ll load them up in my car and make a dozen or so trips but no idea where I should go.

And advice? Thanks!","Strange question, but does anyone know I can deposit recyclables in/near Princeton?",9,1.0,i93t5h,https://www.reddit.com/r/princeton/comments/i93t5h/strange_question_but_does_anyone_know_i_can/,0,1597367208.0,2020-08-13 20:06:48
GoodBaseball,"CNN on Saturday will air a two-hour, primetime special honoring the class of 2020, as millions of students across the nation have had their graduating ceremonies canceled because of the coronavirus pandemic. ""Class of 2020: In This Together"" will air Saturday, May 16 at 7 p.m. ET on CNN, CNN International and CNN en Español. It will be hosted by CNN's Erin Burnett, Don Lemon and Jake Tapper. The first hour will be produced by CNN and will feature former President Bill Clinton, Amy Schumer, Jason Alexander, Gal Gadot, Jack Gilinsky, Henry Winkler, Alex Rodriguez, Keegan-Michael Key and Anthony Anderson with performances by Yo-Yo Ma, Bazzi and Foster the People. 
In the second hour, CNN will broadcast ""Graduate Together: America Honors the High School Class of 2020,"" which is hosted by The LeBron James Family Foundation, The Entertainment Industry Foundation, and XQ Institute. The event will feature former President Barack Obama, LeBron James, the Jonas Brothers, Zendaya, Olivia Wilde, Ben Platt, Megan Rapinoe, Yara Shahidi, Lena Waithe, Pharrell Williams, Malala Yousafzai, and more. The one-hour, commercial-free event will be carried by more than 20 broadcast and cable networks and streaming channels throughout the US. www.cnn.com/2020/05/14/us/2020-graduation-cnn/index.html",CNN special honoring the class of 2020 on Sat. May 16 at 7 p.m. ET,7,0.67,gkmbfe,https://www.reddit.com/r/princeton/comments/gkmbfe/cnn_special_honoring_the_class_of_2020_on_sat_may/,2,1589622639.0,2020-05-16 04:50:39
Throwaway1373451,"Hi everyone,

I am a graduate student from the University of Kansas. I came across this thesis ([https://dataspace.princeton.edu/jspui/handle/88435/dsp019g54xm391](https://dataspace.princeton.edu/jspui/handle/88435/dsp019g54xm391)), which can help me get some references for a study I'm working on. However, as a non-Princeton student, requesting a digital copy of this work can take up to 30 business day. Can someone please help me get a copy of this? I'd really appreciate it!

Thanks a lot!",Retrieving a PhD thesis from Princeton's digital archive (non-Princeton student),8,0.91,gjwa3z,https://www.reddit.com/r/princeton/comments/gjwa3z/retrieving_a_phd_thesis_from_princetons_digital/,4,1589522991.0,2020-05-15 01:09:51
