author,body,title,score,upvote ratio,id,url,comms_num,created,timestamp
Correlation_One,"Partnered with Citadel LLC and Citadel Securities, Correlation One is hosting the world's most prestigious university level data science competition series, **The Data Open.**

The Data Open challenges students from the world's best universities to tackle real-world social challenges in topics such as urban traffic, renewable energy, and education. **On July 27th, the Data Open is coming to San Francisco for Summer Invitational.** 

The Summer Invitational Datathon is a **national event**, even bigger and more exciting than our university competitions! The event is for current students, and also open to students actively interning in the United States this summer. **Travel and overnight accommodation will be provided for any invited students traveling from outside the SF Bay Area.**

About Datathons

Datathons are a new type of live-action competition for data-driven, analytically minded students. They are analogous to ""Hackathons"" for software engineers, but instead of building apps, contestants use real-world data to develop and substantiate solutions to a socially impactful problem. If you are curious to see what a Datathon looks like, we encourage you to check out these videos from our past events:

**Dublin Datathon:** [https://www.youtube.com/watch?v=F0nQJcB8rhI&](https://www.youtube.com/watch?v=F0nQJcB8rhI&)

**2017 Datathon series finale held at the New York Stock Exchange:** [https://www.youtube.com/watch?v=LPZ-bbAdwJE&](https://www.youtube.com/watch?v=LPZ-bbAdwJE&)

The Summer Invitational Data Open is hosted by Citadel LLC & Citadel Securities in partnership with Correlation One. **The event will take place on Saturday, July 27th from 8:00am - 6:00pm at The Park Central San Francisco.**

**Highlights include:**

* **$25,000 in cash prizes!**
* **The chance to showcase your skills tackling a meaningful, real-world problem!**
* **The opportunity to represent your university against other top-tier schools in the Data Open Championship at the New York Stock Exchange and win $100,000 in cash prizes!**
* **Potential interviews with Citadel & Citadel Securities!**

Registration is expected to fill up quickly, so get your application in as soon as possible!

Visit [https://www.citadel.com/careers/the-data-open/apply/](https://www.citadel.com/careers/the-data-open/apply/?apply_to=summer-invitational-datathon-19) and choose the Summer Invitational Datathon 19 to complete the Questionnaire, Assessment, and Registration.

If you have any further questions, please direct them to mert@correlation-one.com. We look forward to receiving your application and hope to have as many Princeton students with us on Saturday, July 27th!","$25,000 Cash Prize Data Science Competition in SF Bay Area - Princeton Students Invited!",7,0.73,c2nb3y,https://www.reddit.com/r/princeton/comments/c2nb3y/25000_cash_prize_data_science_competition_in_sf/,0,1561010149.0,2019-06-20 00:55:49
mmm__pi,,White supremacist group set to march in Princeton on Saturday,6,0.63,aezihw,https://planetprinceton.com/2019/01/08/white-supremacist-group-set-to-march-in-princeton-on-saturday/,16,1547267269.0,2019-01-11 22:27:49
EdgarAlanPoet,Hey all! My fiancee was offered a job in Princeton and I wanted some information about living here. Is there a music scene? What is night life like? Any information that you can give would be very helpful. Thank you!!!,Moving,6,1.0,a46eho,https://www.reddit.com/r/princeton/comments/a46eho/moving/,6,1544261802.0,2018-12-08 03:36:42
,I have two uncles who graduated from princeton (not siblings) in similar fields. Will that give me an edge? Is that legacy?,Quick question about legacy,4,0.71,9st6oq,https://www.reddit.com/r/princeton/comments/9st6oq/quick_question_about_legacy/,1,1540970101.0,2018-10-31 02:15:01
firelordsavan,Why did you guys choose Princeton as your school? I’m geniunely interested in transferring to Princeton as a mathematics major in hopes of getting into law school one day. Just curious. Thank you.  I know the chances are slim but the opportunity cost is low here. I’m a freshman at my state school and I’m looking for better networking opportunities and a more inclusive/challenging experience that is close to home. ,Transferring into Princeton,5,0.78,9m6y2i,https://www.reddit.com/r/princeton/comments/9m6y2i/transferring_into_princeton/,9,1538962829.0,2018-10-07 20:40:29
AnalysisHero,"For context, i'm a student who did poorly in highschool and in his first couple of semesters in college. If I were to somehow receive a perfect SAT/ACT/Accuplacer score, become a phenomenal writer, get a 4.0 through the rest of my associates, switch to a university and maintain a 4.0 through my bachelors-- is there even a *slight* chance an ivy league school would accept me for my masters? If not, what if I were to maintain a 4.0 through my masters and attempt to go to an ivy-league school for my PHD?",Is it possible for someone who had bad initial grades to end up in an ivy league school after a full 180?,6,0.8,9eqomp,https://www.reddit.com/r/princeton/comments/9eqomp/is_it_possible_for_someone_who_had_bad_initial/,1,1536639470.0,2018-09-10 23:17:50
siddis76,"Hey everyone, I’m an incoming freshman at Princeton and I’ve noticed a lot of my peers have group chats for their respective universities? Just wanted to confirm (or not) that there isn’t one for Princeton undergrads cause I’m prolly out of the loop. ",Classwide chat/GroupMe of 2022?,6,0.88,8yyt1t,https://www.reddit.com/r/princeton/comments/8yyt1t/classwide_chatgroupme_of_2022/,3,1531653350.0,2018-07-15 06:15:50
shawarma_man,"I am in Princeton temporarily and I am not very familiar with the area, I was wondering if there are any events around or if there is any fireworks shows happening today around here. Thanks",Firework shows around here?,6,1.0,8w3n3t,https://www.reddit.com/r/princeton/comments/8w3n3t/firework_shows_around_here/,1,1530755957.0,2018-07-04 20:59:17
strangerthingstome,What did most Princeton CS majors study in high school? What helped their application? ,Computer Science at Princeton,6,0.88,8fxphd,https://www.reddit.com/r/princeton/comments/8fxphd/computer_science_at_princeton/,4,1525101572.0,2018-04-30 10:19:32
JanetYellensFuckboy," Long story short, I went to [r/redditrequest](https://www.reddit.com/r/redditrequest) and took over [r/TheIvyLeague](https://www.reddit.com/r/TheIvyLeague) because it was literally abandoned.

With the skyrocketing popularity of Facebook's[ Elitist Memes for Every Ivy League Teen ](https://www.facebook.com/groups/516889128701490/?ref=group_header)\(*You enjoy that page, admit it*\),  I think it has a lot of potential. Our schools have a lot in common:  Q&A, the New England semester struggle bus, historical stereotypes,  sports trash talk, memes, Canada Goose, etc.

I made the sub look pretty \([https://new.reddit.com/r/theivyleague/](https://new.reddit.com/r/theivyleague/)\), now all we need are subscribers & mods \(aiming for one from each university\).

So, here's my plug & **tl;dr:**

* Subscribe to [r/TheIvyLeague](https://www.reddit.com/r/TheIvyLeague)
* Consider [applying to be a mod](https://reddit.com/message/compose?to=/r/theivyleague)! \(Tell us how you'd make it grow, your school/source of interest, w/e\)","Hey r/Princeton, I recently got control of r/TheIvyLeague and am looking to build it into a fun, larger, more active hub community (since individual school subs are smaller & less active). Currently looking for mods to help build this! [Details inside]",7,0.82,89ipg2,https://www.reddit.com/r/princeton/comments/89ipg2/hey_rprinceton_i_recently_got_control_of/,0,1522818887.0,2018-04-04 00:14:47
siddis76,"I'm a prospective student and was wondering on workload per class because I really want to explore a bunch of areas. Basically the title. If not, what about 6? Or is 4 really difficult by itself? ",Is it hard taking 5 classes a Semester?,6,1.0,89h8xl,https://www.reddit.com/r/princeton/comments/89h8xl/is_it_hard_taking_5_classes_a_semester/,7,1522810939.0,2018-04-03 22:02:19
Goose1357,Hey guys! I was recently (somehow) accepted to Princeton and am pretty likely to attend. It's been my dream school for a while and I've gone on a few visits (relatives near the school) but I would like to hear about a non tour guide view on the Princeton experience. Thanks!,What should a clueless (kinda) senior know before coming into Princeton?,6,1.0,88a81y,https://www.reddit.com/r/princeton/comments/88a81y/what_should_a_clueless_kinda_senior_know_before/,4,1522444340.0,2018-03-30 16:12:20
MasonBo_90,"Hello, all

I'm interested in learning more about graduate life at Princeton University for those who chose to pursue a Ph.D. in Operations Research. 

Regarding pre-requisites, what is the required background you must have? I know this varies from university to university, but some schools, like Columbia, require Real Analysis, a class Engineers usually don't take. If a student lacks knowledge on a particular area, does Princeton give the student some time to catch up? For someone whose undergraduate education was in Engineering, how much ""catching up"" in advanced mathematics is there to be done? 

How many classes are you obligated to take in your first year? What would you say about the workload? 

Research-wise, is there an area that attracts the interest of more professors and students, or a specific area the school is known for? (I'm really interested in the research carried out by the PENSA group). 

Finally, I know some schools will only accept students into their Ph.D. programs if they can fully fund the students. Is that the case for  Princeton? 

Thank you so much for your input. =) ",Ph.D. in Operations Research at ORFE,6,1.0,7x2edw,https://www.reddit.com/r/princeton/comments/7x2edw/phd_in_operations_research_at_orfe/,0,1518485616.0,2018-02-12 19:33:36
RaidenTheDemonCyborg,"Specifically, for Machine Learning, Natural Language Processing, Big Data work, etc.",How strong is Princeton's CS for Grad School?,5,0.78,7dqpso,https://www.reddit.com/r/princeton/comments/7dqpso/how_strong_is_princetons_cs_for_grad_school/,3,1511009114.0,2017-11-18 06:45:14
FB3Hunna,,What's the most difficult major at Princeton?,5,0.73,753xfq,https://www.reddit.com/r/princeton/comments/753xfq/whats_the_most_difficult_major_at_princeton/,7,1507520899.0,2017-10-08 22:48:19
SporeCloud1417,"Hello everyone, so this is my first post on reddit.  Im trying to get some book for my thesis but i've tried everything and with no luck.  I've googled and theres a few libraries around the world that have this book, Princeton university is one of them. I'm just curious about if is possible to get help from any student of princeton, so anyway the book name is :  Linear Operator in Krein Space, by Tsuyoshi Ando (1979). 

I really need your help guys, im from Colombia btw and there's no chance i can get to any library that have this book.",Princeton book request,7,0.89,729yxw,https://www.reddit.com/r/princeton/comments/729yxw/princeton_book_request/,2,1506339683.0,2017-09-25 06:41:23
plushcoots,...for a potential collaboration for a campus-wide video project. DM for more info. Thanks!  ,Looking for female filmmakers/videographers who are currently Princeton students...,5,0.86,6t1dnm,https://www.reddit.com/r/princeton/comments/6t1dnm/looking_for_female_filmmakersvideographers_who/,1,1502489361.0,2017-08-11 17:09:21
cartesiancategory,"Hey y'all,

I'm going to be a grad student at Pton in the fall, but I kind of wanted to gauge the culture before going so I knew what to expect. The place I did my undergrad in was located in a college-town where the 70s culture never really left. There are a lot of hippie-dippie leanings and the town is small, inclusive, and definitely focused on the arts/entertainment at large (outside of the university).

I know that Princeton is also a college-town, but I've heard that it's definitely more ""old money"" and Gatsby-esque in some ways. I've never really seen income disparity at my undergrad school, but I've heard that the spectrum is a little more visible at Princeton. Can anyone speak to this?

Also, I'm sure that there is definitely some aspect of fiscal conservatism at Princeton (I grew up a few towns over, I know what it's like), but is Princeton socially-liberal? I'm not expecting the same kind of hippie-freedom that my undergrad school's town had, but it would be comforting to know that Princeton culture isn't too judgmental. I know that art and entertainment play a big role in the culture there, too, but it feels more ""prestige-driven"", as it were, as opposed to art for arts sake? Idk how to explain it. Maybe if y'all came to where I go to undergrad you'd see what I meant, haha.

Anyway, please forgive me if I'm misinformed! I've just heard often that Princeton is in general quite a bit more conservative when compared to other schools in the Ivies (along the lines of Cornell, Brown, etc.), and I was hoping that that wasn't the case.","In your opinion, how conservative is Princeton?",4,0.71,69gm84,https://www.reddit.com/r/princeton/comments/69gm84/in_your_opinion_how_conservative_is_princeton/,19,1494039732.0,2017-05-05 22:02:12
seankingstonlover,"I believe move in day is sept 2nd, but we don't start classes until the 15th. What do we do in the meantime and are there anything incoming freshman should look forward to in general?",Excited pre-frosh with a few questions,5,0.78,694c10,https://www.reddit.com/r/princeton/comments/694c10/excited_prefrosh_with_a_few_questions/,4,1493886614.0,2017-05-04 03:30:14
cartesiancategory,"Hi,

So I'm going to be a graduate student over at Pton next year, and I was wondering if I could ask a couple of questions about piano lessons on/near campus.

I've been playing continuously since 2005, but I never really cared much to practice until I started college and became more serious about what I did in my free time. Basically, I had formal lessons from 2005 until I left for college a few years ago, but I've been mostly just playing stuff by myself without any guidance for the last couple of years, since I go to school in a pretty remote location in upstate NY and it's hard to find people to teach piano here.

When I come back to civilization next year, I am hoping to actually have someone guide me so I don't develop bad posture/fingerings. Does anybody have recommendations for either teachers or places that I should look for around the Princeton area for a student like me with some experience already? Are teachers around the area usually only kid-focused?

Thank you!",Piano lessons?,6,1.0,66zn73,https://www.reddit.com/r/princeton/comments/66zn73/piano_lessons/,8,1492939329.0,2017-04-23 04:22:09
premedbruh,"I'm wondering how good Princeton is for premed versus other universities, namely Stanford. Do current premed students feel like the Princeton's HPA is helpful through the process? Are research opportunities plentiful at Princeton? Are professors hard to approach with a request for a mentorship(in research)? 

Also off topic question, how's the air quality at Princeton? 

EDIT: I'm also very interested in an MD-PHD program, are any current students on this subreddit considering that route? ",How good is Princeton for premed?,6,0.88,630k8t,https://www.reddit.com/r/princeton/comments/630k8t/how_good_is_princeton_for_premed/,2,1491179247.0,2017-04-02 19:27:27
Clightfield,"I believe I will enter engineering, and the website says:
> We look closely at the math and science background of students interested in the B.S.E. program, and we consider every applicant’s abilities across the academic subjects. Princeton engineering students choose a field of concentration (major) after one year and liberal-arts students after two years. More than 70 percent of our undergraduates are majoring in fields different from those they indicated when they applied.

So should I leave it as undecided if I don't have a ton of background in math and science? If I had competitions or teams in my school, I truly would have been a part of them, but my rural South Dakota school just didn't have much for STEM activities or clubs besides one math contest each year (which I did every year). If I leave it undecided, they will examine ME as a whole rather than ME with some focus on my MATH AND SCIENCE, correct?","On the application, should I indicate A.B. or B.S.E. or leave it as undecided?",7,1.0,5kuj21,https://www.reddit.com/r/princeton/comments/5kuj21/on_the_application_should_i_indicate_ab_or_bse_or/,6,1483009923.0,2016-12-29 05:12:03
,"Hi guys,

Thank you for your help and considering, I'm a rising senior with a few questions. If there are any BSE people here, what is unique about Princeton's engineering and what makes it awesome? So far I like the strength of Princeton's other majors and interdisciplinary stuff. 

Does Princeton help you work in a business or even run your own? What career resources do they have?

Thank you so much",Quick question about engineering,6,1.0,5d6t9r,https://www.reddit.com/r/princeton/comments/5d6t9r/quick_question_about_engineering/,3,1479292739.0,2016-11-16 04:38:59
BugleBoy6922,,"A perfect ACT score couldn't get this student into Yale, Princeton, or Stanford, and he says it's because he's Asian-American",5,0.63,4yekqt,http://www.businessinsider.com/michael-wang-says-ivy-league-discriminates-against-asians-2015-5,6,1471580882.0,2016-08-18 23:28:02
rja716,"Hey all - might be moving down to the area after the New Year and had a question about NJ Transit buses: we're looking at places just outside the town center in Kingston and I was curious as if NJ Transit buses still ran up and down 27/Nassau or not.

I used to spend a decent amount of time in the area in the early 2010s and I remember seeing them but when I try to do a trip from Kingston to say, Palmer Square on Google transit nothing comes up.  Anyone know the deal there?",Non-University Q: NJ Transit Buses,7,0.9,4w4dsv,https://www.reddit.com/r/princeton/comments/4w4dsv/nonuniversity_q_nj_transit_buses/,3,1470344435.0,2016-08-04 16:00:35
,"I just received a packet from Princeton and was looking at the financial aid. In it, it said that the gross family income of $65,000-85,000 (I fall within that) received an average grant of $53,400, which covered full tuition and 70% of room and board, and 100% of those who applied qualified. Does this mean everyone who was accepted to Princeton and applied for aid received this amount (around this amount since it's an average)? Am I missing something because it seems almost too good to be true. Do I have to have a certain ACT/SAT score or GPA? I'm currently looking into colleges and dismissed Princeton since it seemed too expensive. Now I'm seriously thinking about applying!",Question about grants/financial aid,4,0.76,4s3w8e,https://www.reddit.com/r/princeton/comments/4s3w8e/question_about_grantsfinancial_aid/,5,1468151944.0,2016-07-10 06:59:04
giveitback1131414,"Hey,

I will be attending a summer camp at Princeton in about a week. At their site FAQ, they only mentioned a guest network that wouldn't last the entire duration of the camp. Is there some way to either circumvent that restriction or a password to a different network that I could use?

Thanks.",Question about wifi at Princeton University,6,1.0,4p1ztr,https://www.reddit.com/r/princeton/comments/4p1ztr/question_about_wifi_at_princeton_university/,1,1466499215.0,2016-06-21 03:53:35
scrnbtwn,"[Change Party Affiliation](http://www.state.nj.us/state/elections/voting-information-party-declaration-forms.html) by **April 13**.

Unaffiliated voters may declare their affiliation with a party up to and on election day (Tuesday, June 7th).

New voters: Deadline to [register](http://www.state.nj.us/state/elections/voting-information.html) is **Tuesday, May 17th**.

Check registration status [here](https://voter.njsvrs.com/PublicAccess/servlet/com.saber.publicaccess.control.PublicAccessNavigationServlet?USERPROCESS=PublicSearch).","NJ Voters- If you are affiliated with a political party, the Deadline to change parties is Wednesday, April 13th. For new voters, registration deadline is May 17th.",5,0.86,4d0h50,https://www.reddit.com/r/princeton/comments/4d0h50/nj_voters_if_you_are_affiliated_with_a_political/,0,1459607791.0,2016-04-02 09:36:31
smurfjoe,,New Brewpub to Open in Palmer Square,6,1.0,4bnr7x,http://www.nj.com/mercer/index.ssf/2016/03/brewpub_moving_into_historic_palmer_square_buildin.html,1,1458786430.0,2016-03-23 21:27:10
btomlins,,Wilson Revisited: What the presidential portrait left out,5,0.86,43uk6h,http://paw.princeton.edu/issues/2016/02/03/pages/1521/index.xml,1,1454454184.0,2016-02-02 17:03:04
goodoneforyou,"Some references state that William Stork, who became in 1761 the first to perform cataract surgery in the United States, originally came from Germany, but they don't prove it.  He was definitely working in England in 1752.  He advertised in a German language newspaper in Pennsylvnia--it seems likely that if he had been from Germany he would have mentioned it in an advertisement addressing German speakers.  The newspaper is in the Princeton library.
Pennsylvanische Berichte (Germantown, Pennsylvania), November 20, 1762.  “Adv. Dr. Storck. surgeon & oculist to P. of Wales.”
Can anyone look at this reference from 1762 and see if he mentioned where he was originally from?  Humanity thanks you.",Princeton has a German newspaper reference--can anyone look at this in the Princeton library?,6,1.0,40jc6g,https://www.reddit.com/r/princeton/comments/40jc6g/princeton_has_a_german_newspaper_referencecan/,4,1452580732.0,2016-01-12 00:38:52
princeton,,Acclaimed writer and Princeton professor Lahiri awarded National Humanities Medal,7,0.89,3jnbfn,https://www.princeton.edu/main/news/archive/S44/13/01O59/index.xml?section=topstories,0,1441418408.0,2015-09-04 21:00:08
guinness_blaine,,Princeton featured on /r/cfb,7,1.0,3gzjq5,https://www.reddit.com/r/CFB/comments/3gzee1/rcfb_interview_series_penn_state_feat_san_diego/,1,1439595535.0,2015-08-14 18:38:55
gregsactly,"I moved to Princeton about a month ago, and I have a serious question: why are there so many Asian tourists?  

I must reluctantly admit that my mind immediately jumps to the stereotypical Asian father who values education over all else, but flying halfway across the world to visit a college (especially when many of these tourists are like ten years old) seems a bit excessive.  

I'm not trying to be racist here . . . just trying to understand.  Can someone explain to me the mindset that makes this such a popular tourist destination?",Asian Tourists,6,0.69,3fazkv,https://www.reddit.com/r/princeton/comments/3fazkv/asian_tourists/,11,1438387845.0,2015-07-31 19:10:45
Monsinior,"I will be leaving Chicago Saturday morning around 11:00 am, I need to arrive in Princeton Sunday before 1:00 pm. I would appreciate suggestions: where to stop to spend the night in a hotel, the location should be 3 to 5 hours drive to my final destination, any particular itinerary? thanks
",where to stop on my way driving to Princeton from chicago?,5,0.78,3csk90,https://www.reddit.com/r/princeton/comments/3csk90/where_to_stop_on_my_way_driving_to_princeton_from/,2,1436561467.0,2015-07-10 15:51:07
princeton,,July 4 is milestone in America's--and Princeton's--history,6,1.0,3c2dx2,https://www.princeton.edu/main/news/archive/S43/49/95C59/index.xml?section=featured,0,1436008015.0,2015-07-04 06:06:55
ptown2016,,"They can make fun of us, but I love the bubble",6,0.66,3birud,http://www.notmycollegets.com/products/country-club-prep,1,1435621918.0,2015-06-29 18:51:58
Hipcoolster,Just moved to NJ (haven't even got a place). Is there anywhere to play indoor/outdoor pickup basketball near the Princeton area? ,Pick-up basketball in the Princeton-area?,7,0.89,3bh1s3,https://www.reddit.com/r/princeton/comments/3bh1s3/pickup_basketball_in_the_princetonarea/,4,1435578874.0,2015-06-29 06:54:34
princeton,,Can Nathaniel FitzRandolph’s Descendants Attend Princeton University for Free? [No.],6,0.88,39gefk,https://blogs.princeton.edu/mudd/2015/06/can-nathaniel-fitzrandolphs-descendants-attend-princeton-university-for-free/,1,1434065224.0,2015-06-11 18:27:04
princeton,,"Princeton Hackathon was a success, participants say",6,1.0,399iqk,http://www.nj.com/mercer/index.ssf/2015/06/princeton_hackathon_was_a_success.html,0,1433944371.0,2015-06-10 08:52:51
kimchikick,"Code for Princeton is organizing the first Code for Princeton Civic Hackathon at the Princeton Public Library. We'll be working with government data on projects such as mapping area storm damage, tracking neighborhood energy usage, and recording bicycle trips. We'll also have programming classes for kids, workshops, and a mini-maker faire for hardware aficionados.

Anyone can participate; you don’t have to be a developer or tech expert, you just have to care about your neighborhood and community. 

Stop by anytime from noon to midnight on Saturday June 6, and 8-noon on Sunday, June 7. There will be free meals and swag for attendees!

Registration is open through our website: www.codeforprinceton.org.

If you're not in Central Jersey this summer, check out National Day of Civic Hacking events run by our partners Code for Newark (codefornewark.org) and Code for Jersey City (codeforjc.org).","Code for Princeton Civic Hackathon, June 6-7 (x-post r/NewJersey)",7,1.0,36sud4,https://www.reddit.com/r/princeton/comments/36sud4/code_for_princeton_civic_hackathon_june_67_xpost/,0,1432271147.0,2015-05-22 00:05:47
princeton,,Feamster and Rexford win NSDI Test of Time Award,7,1.0,35eik8,https://www.cs.princeton.edu/news/article/feamster-and-rexford-win-nsdi-test-time-award,0,1431215582.0,2015-05-09 18:53:02
princeton,,Martonosi Named Jefferson Science Fellow,6,0.88,35eihk,https://www.cs.princeton.edu/news/article/martonosi-named-jefferson-science-fellow,0,1431215546.0,2015-05-09 18:52:26
