author,body,title,score,upvote ratio,id,url,comms_num,created,timestamp
pickle269,,Fox just vibing in princeton,131,1.0,gcxr3m,https://i.redd.it/5gbxyc282mw41.jpg,7,1588567085.0,2020-05-03 23:38:05
epictortoise,,First time I've made it back to campus since the lock down - beautiful day.,113,1.0,hdlo6t,https://i.redd.it/k9gho4ej8e651.jpg,1,1592830830.0,2020-06-22 08:00:30
affectgood,,don’t forget how special campus is!,113,1.0,ffojma,https://i.redd.it/qxh2qdxfvgl41.jpg,0,1583753551.0,2020-03-09 06:32:31
fink720,,Princeton names its first black valedictorian in the university's history,103,0.97,ghhdqg,https://www.cnn.com/2020/05/10/us/princeton-first-black-valedictorian-trnd/index.html,0,1589202919.0,2020-05-11 08:15:19
Ms284,,Princeton 😍,87,0.99,gqnuac,https://i.redd.it/f6h39z1lk0151.jpg,2,1590486101.0,2020-05-26 04:41:41
Ms284,,Princeton Strolls,88,0.99,gpw29l,https://i.redd.it/9ogzwq0nor051.jpg,3,1590378497.0,2020-05-24 22:48:17
Jenergy83,,Picture I took on campus in December 2019,87,0.98,em0c2t,https://i.redd.it/kx7kau9svm941.jpg,2,1578552467.0,2020-01-09 00:47:47
Ms284,,80° and skies are blue,86,0.99,h8c8za,https://i.redd.it/cdme0wexup451.jpg,11,1592099825.0,2020-06-13 20:57:05
lonelylilac,,U. renames Woodrow Wilson School and Wilson College,74,0.88,hgxt5k,https://www.dailyprincetonian.com/article/2020/06/woodrow-wilson-racism-school-and-college-renamed-black-justice-league,54,1593308359.0,2020-06-27 20:39:19
SikhSoldiers,,Princeton University 2018 Football Bonfire,74,0.96,9ycuam,https://i.imgur.com/NiyfurN.jpg,5,1542626146.0,2018-11-19 05:15:46
lonelylilac,,Math TA posted false solution online to catch students in violation of academic integrity,68,0.98,grjk0v,https://www.dailyprincetonian.com/article/2020/05/princeton-teaching-assistant-math-department-slader-mat202-academic-integrity-cheating-covid,47,1590614285.0,2020-05-27 16:18:05
Ford_________Prefect,"Several students have been charged with honor code violations in MAT 202 in the 2020 Spring semester at Princeton University. These charges come at a crucial time during which students are completing Dean’s date assignments and studying for final exams. Under normal circumstances, this would be a very stressful situation, but considering the current state of affairs in the nation, it can be overwhelming for every student in the course.

An anonymous post was made on Tiger Confessions in which a person claiming to be a math PHD student and a TA for MAT 202 stated that the students had been baited by a professor. A quick look into Slader.com led to a contributor account with the user name “Arthur Dent.” This particular account had posted only four solutions. All of the four solutions were for problems from the fifth edition of Linear Algebra with Applications by Otto Bretscher, the exact book used by MAT 202. Of those four solutions, one was in the assigned problems for problem set 9, and two were in the assigned problems from problem set 10. Specifically, 8.1 #23, 8.2 #37, and 8.2 #70. The time at which the solutions were posted was provided in a correspondence email with a content director at Slader after a request was made. The solutions were posted April of 2020. Problem set 9 was due April 27th. Problem set 10 was due the following week. Further inquiry to this account led to the Slader representative indicating that the email associated to the contributor account seemed to be fake. A separate correspondence with Slader stated “Our moderators have confirmed that the answers given by that user were nonsense but written to look like they were reasonable.” The solutions have since been removed, however screenshots were taken and have been linked to this post.

I am a student at Princeton, and I made the poll in the MAT 202 GroupMe chat. Though I knew most students would be hesitant to participate, even a small amount of information would help shed light on what is going on. Currently, the poll stands at 9 students who claim their charges relate to problem #23 from section 8.1, one student claims their charge relates to problem #37 from section 8.2, and zero students have selected “none of the above.” I am not writing this message to accuse any professor of entrapping their students, what I intend to do is bring to light some peculiar information about a situation which has already raised many red flags. Cheating is not right, it reflects poorly on one’s character and negatively impacts peers who put forth an honest effort. But as detrimental as cheating may be, entrapment is just as harmful and just as dishonorable.

&#x200B;

&#x200B;

&#x200B;

[https://imgur.com/rcQetA2](https://imgur.com/rcQetA2)

[https://imgur.com/JYfrbYj](https://imgur.com/JYfrbYj)

[https://imgur.com/ho3b3o2](https://imgur.com/ho3b3o2)

[https://imgur.com/JuiB8D6](https://imgur.com/JuiB8D6)

[https://imgur.com/O41VNNH](https://imgur.com/O41VNNH)

[https://imgur.com/bdFgUFg](https://imgur.com/ny37NwE)",MAT 202,70,0.94,gi32f2,https://www.reddit.com/r/princeton/comments/gi32f2/mat_202/,19,1589282541.0,2020-05-12 06:22:21
MightyMangoMan,,"First years and juniors to return in the fall, sophomores and seniors to come in the spring.",67,0.96,hmeyek,https://i.redd.it/gr0lidz4ja951.jpg,3,1594093460.0,2020-07-06 22:44:20
Ms284,,Summer is over. 67° and darkness at 8:45pm.,66,1.0,idnje6,https://i.redd.it/zbqtj15hf9i51.jpg,4,1598002757.0,2020-08-21 04:39:17
Goodman9473,"In the most polite way possible, if this isn’t too much to ask and if it doesn’t offend you in any way, I’d like to kindly request on behalf of all students that you please shut the fuck up in libraries. 

If you have any objections please write it on a piece of paper and drop it off in the grey bin outside my room. 

Thanks for your cooperation.",Dear fellow students:,62,0.93,dvnl5l,https://www.reddit.com/r/princeton/comments/dvnl5l/dear_fellow_students/,8,1573655006.0,2019-11-13 08:23:26
purplemeadows,"Princeton President:  ""Racism and the damage it does to people of color...persist at Princeton""

If the DOE investigation results in a finding of malfeasance, Princeton will likely be in the contradictory position of arguing that it should *not* lose federal funding based on having engaged in racial discrimination.

[https://www.washingtonexaminer.com/opinion/exclusive-education-department-opens-investigation-into-princeton-university-after-president-deems-racism-embedded-in-the-school](https://www.washingtonexaminer.com/opinion/exclusive-education-department-opens-investigation-into-princeton-university-after-president-deems-racism-embedded-in-the-school)

Edit: DOE",Princeton: We are racist. / DOJ: You agreed not to be in order to get $75M in taxpayer money. Pay it back then.,55,0.88,iuvses,https://www.reddit.com/r/princeton/comments/iuvses/princeton_we_are_racist_doj_you_agreed_not_to_be/,60,1600417472.0,2020-09-18 03:24:32
snoopdoggadvocate,"For far too long, Princeton University's Class Day has hosted a steady stream of academics, actors, politicians, and other people. We claim to attend an elite university, but no university can be truly inspiring, illuminating, and thought-provoking when it invites a riff-raff of normie Class Day speakers.

The previous years we've had actress Ellie Kemper, senator Cory Booker, director Baz Luhrmann, and novelist Jodi Picoult; however, none of these speakers' accomplishments are comparable to the magnificent Snoop Dogg (aka Snoop Lion).

Snoop Dogg is an iconic rapper who has changed the culture of the hip hop throughout his dynamic career. Being nominated for over 17 Grammy's (should've won 17...), selling over 35 million albums worldwide, and making hits like ""Drop It Like It's Hot"" makes Snoop Dogg more than qualified to deliver a brilliant and evocative speech to the Princeton community. Snoop Dogg's experiences are so unique that he even set the Guinness World Record for the largest paradise cocktail. Now that's a man that Princeton needs to learn from.

Be the change you want to see in the world and sign and support this petition. The voices and opinions of the Princeton undergraduate need to be heard.

TL;DR: Vote Snoop Dogg for Princeton's Class Speaker (sign the petition and like the FB page)

Link: [http://chng.it/ZjwqdFqJ2G](http://chng.it/ZjwqdFqJ2G)

Link: fb.me/snoopdoggspeaker",Snoop Dogg for Princeton University's Class Day Speaker 2020,57,0.88,elldk1,https://www.reddit.com/r/princeton/comments/elldk1/snoop_dogg_for_princeton_universitys_class_day/,3,1578475737.0,2020-01-08 03:28:57
nydronepilot,,Drone Pic of Princeton Stadium,58,0.97,cgx38y,https://i.redd.it/gg0h3cnds3c31.jpg,2,1563938307.0,2019-07-23 22:18:27
StatePlateSigns,,Gift I made for my sister. Cnc cut and filled with black tinted epoxy resin.,57,0.99,hvcnwb,https://www.reddit.com/gallery/hvcnwb,5,1595384316.0,2020-07-21 21:18:36
epictortoise,,War Memorial inside Nassau Hall,55,0.98,f0gqie,https://i.redd.it/78z5ag1pekf41.jpg,0,1581137700.0,2020-02-07 22:55:00
epictortoise,,Your face when you hear you're being replaced by tigers as the school mascot!,50,0.9,hu93yw,https://i.redd.it/tvpw0zvazvb51.jpg,1,1595224877.0,2020-07-20 01:01:17
Blottomatic,,Good luck everybody,50,0.93,epbr41,https://i.redd.it/vx6lliv0j1b41.png,6,1579165626.0,2020-01-16 03:07:06
xman1971,,Princeton University turns down $2.4M federal grant from coronavirus stimulus bill,50,0.97,g6bs7s,https://www.nj.com/coronavirus/2020/04/princeton-university-turns-down-24m-federal-grant-from-coronavirus-stimulus-bill.html,4,1587626482.0,2020-04-23 02:21:22
money,,Princeton named #1 college in the U.S. for the third year in a row,48,0.96,96yw6s,http://time.com/money/longform/2018-best-colleges-in-united-states/,2,1534200401.0,2018-08-13 17:46:41
imitationcheese,,"The Ivy League Hustle (I Went to Princeton, Bitch)",43,0.97,txr6p,http://www.youtube.com/watch?v=YDhf9qwiA34,3,1337649380.0,2012-05-21 20:16:20
lileee,,Reunions cancelled due to COVID-19,43,0.96,fm0c6d,https://www.dailyprincetonian.com/article/2020/03/university-cancels-reunions-due-to-covid-19-pandemic,5,1584758804.0,2020-03-20 21:46:44
Tekki,,After the students leave the dorms...,44,0.88,bxpag4,https://i.redd.it/d7c1c4vrhu231.jpg,4,1559903192.0,2019-06-07 05:26:32
kn0thing,,"See you this afternoon, Princeton! I'm a reddit cofounder and I'll be speaking at 4:30pm in McCosh 10!",40,0.95,1r2vqb,http://www.youtube.com/watch?v=een2wLCzn0s&feature=youtu.be,11,1385004506.0,2013-11-20 21:28:26
EthanTheRedditor37,,I visited Princeton a few months ago. I saw this amazing Egyptian coffin head!,41,0.93,g56x89,https://i.redd.it/y1ma0stb23u41.jpg,4,1587465340.0,2020-04-21 05:35:40
princeton,,The Dinky resumes service,41,0.96,bsbucr,http://www.dailyprincetonian.com/article/2019/05/the-dinky-resumes-service,1,1558695715.0,2019-05-24 06:01:55
Quice09,,Princeton Battlefield State Park,39,0.97,1mrs5c,http://i.imgur.com/J98XWjq.jpg,2,1379704919.0,2013-09-20 14:21:59
,,Michelle Obama describes her experiences at Princeton in the early 80's,41,0.94,9x0g33,https://www.nj.com/education/2018/11/michelle_obama_didnt_have_many_white_friends_she_s.html,0,1542233652.0,2018-11-14 16:14:12
money,,Princeton ranked the #1 College in America,36,0.84,6memir,http://time.com/money/best-colleges/rankings/best-colleges/,1,1499724124.0,2017-07-10 17:02:04
pecamash,,100 years ago today -- my great grandmother's diary about a big dance at Princeton [xpost from r/100yearsago],39,1.0,7bvcqs,https://i.redd.it/mzrz0hsdpzwz.jpg,4,1510281962.0,2017-11-09 20:46:02
princeton,,"""If Princeton broke away from the United States and declared the Orange Bubble a sovereign nation... Princeton would be tied for 15th in the current medal count, even with Brazil and ahead of Mexico and Spain.""",36,0.91,xqg8u,http://blogs.dailyprincetonian.com/prox/2012/08/05/tigers-in-london-making-history/,1,1344236053.0,2012-08-06 01:54:13
creativeplant,**Can you share the most memorable/useful advice that you learned from her during the course?**,"If you were a student at Princeton between 1989-2006 and took Toni Morrison's Creative Writing class, I want to hear from you!",35,0.93,eowoc4,https://www.reddit.com/r/princeton/comments/eowoc4/if_you_were_a_student_at_princeton_between/,0,1579087665.0,2020-01-15 05:27:45
satprepnow124,,Nothing is better than a little winter snow...,37,0.95,etkz8j,https://i.redd.it/h0vvf3xf8uc41.jpg,1,1579949016.0,2020-01-25 04:43:36
SROTDroid,,"Congratulations, /r/princeton! You are Subreddit of the Day!",35,0.97,dzizkm,http://www.reddit.com/r/subredditoftheday/comments/dzizbs/november_21st_2019_rprinceton_dei_sub_numine_viget/,10,1574370082.0,2019-11-21 15:01:22
HolisticMyAss,"When I visited Princeton's campus I was struck by how serene it was. I imagined that if I ever ended up there, I would be extremely happy because of its beauty, and of course its brandname. 

One thing I've noticed as I've read about experiences at Princeton is that while some love it, others... don't. I've seen complaints of social stratification and people who feel very isolated amongst their peers.

I guess the thing that's most important to me is a sense of community and belonging to wherever I end up. I know that most people will definitely feel that while at Princeton, but I'm curious about the experiences of the people who don't.

So, /r/princeton, what's your experience? Are you happy? Could you tell me about people you've known who weren't happy and why? How about times when you've seen/felt exclusion or stratification?

Thanks",Are students at Princeton happy?,32,0.92,de4gj6,https://www.reddit.com/r/princeton/comments/de4gj6/are_students_at_princeton_happy/,11,1570403423.0,2019-10-06 18:10:23
princeton,,John Nash Killed in Taxi Accident,34,0.97,373dn9,http://www.nj.com/middlesex/index.ssf/2015/05/famed_a_beautiful_mind_mathematician_wife_killed_in_taxi_crash_police_say.html,4,1432506398.0,2015-05-24 17:26:38
princeton,,"Princeton is pleased to offer admission to 1,895 students for Class of 2023",31,0.94,bttewl,https://www.princeton.edu/news/2019/03/28/princeton-pleased-offer-admission-1895-students-class-2023,0,1559031716.0,2019-05-28 03:21:56
bigb1tch,"A scavenger hunt! Congratulations Princeton, New Jersey! Between 4:30pm & 5:30pm I'll be hiding a very special surprise on behalf of Reddit Secret Santa! You can read about it [here](https://www.reddit.com/r/blog/comments/2mrwyt/finders_keepers_losers_weepers_the_hunt_starts_now/)

I can tell from other posts that you are all super excited to get started! But be patient! It's gonna be fun!

Edit: I realize this is the university sub, but it will be just outside of campus, in the business district area!

Please be patient, I got stuck at work a little longer so I bumped the time I will be hiding the surprise. I'm so sorry.

CLUES!!! I'd like to make a quick shout out to /u/AmphibiousMeatloaf for helping me with the clues!

This is OFF campus, so it is on public property!

1) Children are often brought here by their mothers,
To explore and learn about the worlds of others.

2) When trying to do research before the age of reddit, this is the place you'd go to get it.

3) But where within these walls will you find your treasure?  Think of the things reddit loves in a picture.

4) 636.809 Myr


FOUND! [Winner](http://www.imgur.com/6ezhRkw.jpeg) /u/benarus",What's fun to do with clues and a prize?,33,0.83,2mshou,https://www.reddit.com/r/princeton/comments/2mshou/whats_fun_to_do_with_clues_and_a_prize/,68,1416449122.0,2014-11-19 20:05:22
farful,"**Saturday, June 6**

A recent Princeton High School graduate is leading a peaceful demonstration in solidarity with the Black Lives Matter movement on Hinds Plaza on Witherspoon Street next to the Princeton Public Library starting at 1 p.m. on Saturday.

&#x200B;

**Sunday, June 7**

Black Mothers Rising will be hosting a gathering for meditation and prayer in front of the Princeton Police Department and municipal building at 9 a.m. on Sunday. The address is 400 Witherspoon Street, Princeton.",Upcoming Princeton demonstrations against racism and police brutality (June 6-7),30,0.84,gx9dku,https://www.reddit.com/r/princeton/comments/gx9dku/upcoming_princeton_demonstrations_against_racism/,2,1591408295.0,2020-06-05 20:51:35
4thFloorStudio,,Been loving lazily walking around campus lately. Empty and overgrown but everything is perfectly in bloom,31,0.98,gtji7o,https://i.redd.it/7o2ha5ky7y151.jpg,5,1590893491.0,2020-05-30 21:51:31
StatePlateSigns,,Princeton “wooden license plate” filled with glow in the dark epoxy resin. About 20”x11”.,32,0.9,f5u3oa,https://i.redd.it/ut6ofsyoiph41.jpg,2,1582071168.0,2020-02-18 18:12:48
princeton,,Venkatesh '19 wins 2019 Rhodes Scholarship,30,0.94,9rvb2n,http://www.dailyprincetonian.com/article/2018/10/venkatesh-19-wins-2019-rhodes-scholarship,0,1540684613.0,2018-10-27 18:56:53
SiON42X,,"Seriously track team?  I think you misspelled ""failed""",32,0.89,lxzyd,http://i.imgur.com/Rwnyz.jpg,3,1320289456.0,2011-11-02 22:04:16
ilovenewjersey2020,,Drumthwacket - one of 2 residences for the governor.,28,0.86,hhrcok,https://i.redd.it/ps70o1zucr751.jpg,0,1593425475.0,2020-06-29 05:11:15
yagulito,,Princeton Reunions/memorable memories,29,0.87,gwwd52,https://i.redd.it/fs92qq6bb0351.jpg,2,1591354671.0,2020-06-05 05:57:51
icecreeper01,"Hello students of Princeton. This post is to invite ya'll to join our anarchy server. The server was started a day or 2 ago by Cornell students, but we are now extending it to some other ivy league schools. The server is complete anarchy, the only rules being that you are not allowed to use speed/fly hacks. If you're interested in joining, the IP is: ~~34.68.157.182~~

**UPDATE:**
The anarchy server is closing, but the world download is being sent by the current owner to the owner of another Cornell run Minecraft server. In the coming days, they will be running the anarchy world, in addition to a regular survival, and creative world. I will make a new post once the anarchy world is up again.
The new IP is:
147.135.68.19:25578
The server is running in 1.15.2

The discord server is:
https://discord.gg/btHTQZH


Additionally, I am not the owner of the server, but he gave me permission to invite other schools.  Enjoy!!",Minecraft Anarchy Server for Ivy League,29,0.97,foasry,https://www.reddit.com/r/princeton/comments/foasry/minecraft_anarchy_server_for_ivy_league/,0,1585105021.0,2020-03-24 21:57:01
JoClimacus,,Shot an impromptu music video at Reunions in June. Hope you enjoy!,29,0.97,cux1t5,https://www.youtube.com/watch?v=khcJdXdFNxs,0,1566699747.0,2019-08-24 21:22:27
cyhsarah,,Vegan food guide for Princeton University (link to guide in comments)!!,29,0.94,bnxzcc,https://i.redd.it/xheskr9u9wx21.jpg,3,1557745568.0,2019-05-13 06:06:08
RarelyTruthful,,PRINCETON BEAT HARVARD!!!!!!,28,0.89,pljue,https://www.reddit.com/r/princeton/comments/pljue/princeton_beat_harvard/,3,1329042751.0,2012-02-12 04:32:31
hotbread1,,somebody parked their nazi bike inside community park elementary,26,0.83,i8i0me,https://i.redd.it/karfpouiwlg51.jpg,51,1597282078.0,2020-08-12 20:27:58
epictortoise,,The Memorial Window in the Old Graduate College,28,0.95,gqufok,https://i.redd.it/wwiy2fwu43151.jpg,1,1590517281.0,2020-05-26 13:21:21
,,Republican U.S. Senate candidate Hugin fought to stop women from joining Princeton eating clubs,29,0.91,90g1zv,http://www.nj.com/politics/index.ssf/2018/07/senate_nominee_hugin_fought_to_keep_princeton_club.html,1,1532122721.0,2018-07-20 16:38:41
did_i_find_your_ring,,Did I find your class ring in New York?,28,0.98,1dl9i3,http://i.imgur.com/dEBFXTI.jpg,9,1367572313.0,2013-05-03 04:11:53
SIGNW,,Dead Week,27,0.92,ub0eq,http://i.qkme.me/3pg5t1.jpg,2,1338356983.0,2012-05-30 00:49:43
ilovenewjersey2020,,"Hamilton Jewelers, Princeton.",30,0.72,frzhx7,https://i.redd.it/8y9whbvrmvp41.jpg,2,1585631967.0,2020-03-31 00:19:27
,,Alabama loses recruiting battle to Princeton as four-star QB sticks with Tigers,27,1.0,7uzkpz,https://www.cbssports.com/college-football/news/alabama-loses-recruiting-battle-to-princeton-as-four-star-qb-sticks-with-tigers/,4,1517696774.0,2018-02-03 16:26:14
ilovenewjersey2020,,Princeton University.,26,0.83,fsmbvv,https://i.redd.it/x1gklxtwy2q41.jpg,0,1585720797.0,2020-04-01 00:59:57
StatePlateSigns,,Princeton “wooden license plate” I made today with my cnc machine. My home town.,27,0.87,fhqgzs,https://i.redd.it/szddx07a0cm41.jpg,0,1584086833.0,2020-03-13 03:07:13
guinness_blaine,,Princeton alum and Cleveland Browns tight end Seth DeValve becomes first white NFL player to kneel for anthem,26,0.92,6v8zyh,http://deadspin.com/seth-devalve-is-the-first-white-player-to-kneel-for-the-1798295618,0,1503409004.0,2017-08-22 08:36:44
WorldTravelBucket,,This is how thick the ice on the lake is.,26,1.0,2vsogw,https://scontent-lga.xx.fbcdn.net/hphotos-xpa1/v/t1.0-9/10968516_10153062399378048_1159503829708786484_n.jpg?oh=91e055ce26e83c4ef6d9f21ac210ce37&oe=5560C14F,0,1423884728.0,2015-02-13 21:32:08
ksoops,,"Princeton's Old Graduate College, mini planet",26,0.87,1t2app,http://imgur.com/A4I5U7k,0,1387281259.0,2013-12-17 05:54:19
Kimba_the_White_Lion,"If you have any questions about Princeton, don't be afraid to ask!",Congratulations new tigers of the class of 2017!,26,0.91,1bb3sf,https://www.reddit.com/r/princeton/comments/1bb3sf/congratulations_new_tigers_of_the_class_of_2017/,27,1364690278.0,2013-03-30 19:37:58
Kimba_the_White_Lion,,See ya on Friday!,25,0.97,12zdg3,http://i.imgur.com/bHuBE.jpg,0,1352615233.0,2012-11-11 00:27:13
xman1971,,WaPo compares Notre Dame and Princeton’s approach to reopening,24,0.97,gpb3ps,https://www.washingtonpost.com/education/2020/05/22/notre-dame-vs-princeton-two-very-different-approaches-when-how-reopen-college-during-covid-19/,2,1590291371.0,2020-05-23 22:36:11
michaelconfoy,,"Princeton University, 1903.",26,0.93,3d3elu,http://i.imgur.com/nVk1Woj.jpg,4,1436793078.0,2015-07-13 08:11:18
BlackRockKitty,,Why Hurricane Sandy hit NJ,25,0.86,131piq,https://sphotos-b.xx.fbcdn.net/hphotos-prn1/560733_10151089243985741_1741950920_n.jpg,3,1352723482.0,2012-11-12 06:31:22
SafeSituation,,God bless the girls on the 4th floor of Edwards,23,0.86,n9gld,http://i.imgur.com/QNk8k.jpg,0,1323705362.0,2011-12-12 09:56:02
guinness_blaine,"He'll be speaking on space exploration, focusing on the differences between where space enthusiasts think we should be and the realities that space exploration has to deal with.


Also he is awesome.",Neil deGrasse Tyson in McCosh 50 tonight at 8pm!,25,0.86,mtnf7,https://www.reddit.com/r/princeton/comments/mtnf7/neil_degrasse_tyson_in_mccosh_50_tonight_at_8pm/,3,1322622976.0,2011-11-29 21:16:16
yagulito,,Hopewell dear,24,0.93,gkwura,https://v.redd.it/aenmnvive5z41,0,1589673063.0,2020-05-16 18:51:03
FederalTeam,,Princeton's Faculty Votes to Ban Professor-Graduate Student Relationships | Inside Higher Ed,24,0.97,b9hqbu,https://www.insidehighered.com/quicktakes/2019/04/03/princetons-faculty-votes-ban-professor-graduate-student-relationships,0,1554437570.0,2019-04-04 23:12:50
ebag7125,,New sign on Princeton U. campus tests students' mastery of English language,23,0.87,1vke85,http://imgur.com/zqCwUdD,2,1390126973.0,2014-01-19 04:22:53
eric_the_shred,,Jeff Nunokawa dramatically interprets Tiger Admirers,24,1.0,16hu67,http://www.youtube.com/watch?v=G3S97SVACJk&feature=youtu.be,0,1358122584.0,2013-01-13 18:16:24
pickle269,,Anyone know where to find this hoodie? Saw someone wearing it on YouTube. I’m class of 2024 btw,24,1.0,ftuvcv,https://i.redd.it/6imfotz32hq41.jpg,10,1585891374.0,2020-04-03 00:22:54
SikhSoldiers,,"NJ Attorney General Gurbir Grewal, first Sikh AG",23,1.0,a284kc,https://i.imgur.com/iqWSrac.jpg,0,1543736198.0,2018-12-02 01:36:38
princeton,,Sixty free lectures from Princeton on bitcoin and cryptocurrencies,23,1.0,7imysv,https://www.reddit.com/r/Bitcoin/comments/7il1sx/sixty_free_lectures_from_princeton_on_bitcoin_and/,0,1512858196.0,2017-12-09 16:23:16
,,Princeton University after Hurricane Sandy,23,1.0,12co98,http://imgur.com/a/Dg6tm,9,1351652109.0,2012-10-30 21:55:09
twelvebars,,Went up Cleveland Tower today!,23,0.96,10cn43,http://imgur.com/Q8pQD,1,1348453634.0,2012-09-23 21:27:14
kentmorewarrior,,Thought that Firestone was hiding something cool...,22,0.88,sqa55,http://i.imgur.com/m6BVE.jpg,1,1335318902.0,2012-04-24 20:55:02
TyServ9,,Found this in the Campbell Bathroom,22,0.94,rvsfv,http://imgur.com/8xXVD,3,1333713436.0,2012-04-06 06:57:16
princeton,,Ted Cruz calls Princeton activists 'pampered teenagers',23,0.93,3xjw9j,http://edition.cnn.com/2015/12/18/politics/ted-cruz-princeton-pampered-teenagers/index.html,4,1450620585.0,2015-12-20 08:09:45
princeton,,U.S. News 2012 rankings - Princeton #1 (with Harvard),22,0.89,kg9ks,http://colleges.usnews.rankingsandreviews.com/best-colleges/rankings/national-universities,2,1316096949.0,2011-09-15 09:29:09
,,Welcome freshmen!,21,0.78,jzwti,http://i.imgur.com/zN5vP.jpg,6,1314798213.0,2011-08-31 08:43:33
imitationcheese,,We need to call out people using their Princeton alumni status for political grift,21,0.76,f7spci,https://twitter.com/lindyli/status/1227304706696994817,6,1582407946.0,2020-02-22 15:45:46
SixteenBeatsAOne,,"Princeton football is undefeated, is guaranteed at least a share of the Ivy League title and is highly ranked in the FCS standings. Is there a chance that the football team plays in the FCS playoff tournament?",21,0.96,9wipgn,https://www.reddit.com/r/princeton/comments/9wipgn/princeton_football_is_undefeated_is_guaranteed_at/,4,1542089161.0,2018-11-13 00:06:01
,,U. confirms Verdu's dismissal following misconduct investigation,20,0.9,9k5mkt,http://www.dailyprincetonian.com/article/2018/09/verdu-dismissed,0,1538335261.0,2018-09-30 14:21:01
renapagli,,Grad Student Says Princeton Prof Who Sexually Harassed Her Was Given Slap On The Wrist,23,0.94,7byv79,https://www.huffingtonpost.com/entry/princeton-professor-sexual-harassment-not-punished_us_5a01d203e4b0368a4e872655?ncid=engmodushpmg00000003,3,1510316793.0,2017-11-10 06:26:33
