author,body,title,score,upvote ratio,id,url,comms_num,created,timestamp
hello1739,The Princeton app is due on January 1. I have not yet sent my December SAT scores (or any scores for that matter). Should I send my scores with regular shipping or rush shipping? Am I screwed either way?,Should I rush my SATs,4,0.83,a9sjn9,https://www.reddit.com/r/princeton/comments/a9sjn9/should_i_rush_my_sats/,4,1545888330.0,2018-12-26 23:25:30
,\^,What's something niche you love about Princeton?,4,1.0,a1esja,https://www.reddit.com/r/princeton/comments/a1esja/whats_something_niche_you_love_about_princeton/,0,1543500917.0,2018-11-29 08:15:17
princeton,,Welcoming 2018–19's newest clubs,4,0.75,9rvcvo,http://www.dailyprincetonian.com/article/2018/09/welcoming-2018-19s-newest-clubs,0,1540684977.0,2018-10-27 19:02:57
anonymousaspirant,"I'm just a high school student applying SCEA to Princeton and (although I know I should be focused on the application process rn) I can't help but start planning what courses I want to take.

&#x200B;

I've never really found myself as speciically a humanities person or STEM person, although I'm thinking about being a comp lit/history major so I can develop solid writing skills and be able to understand culture better ( I definitely want to take the hum sequence). At the same time, I really want to have a deep understanding of science and the ISC course seems to provide that in a really unique way.

&#x200B;

Does anyone have an opinion on whether it's possible/reasonable to be a prospective humanities major who takes both integrated science and the hum sequence while at Princeton and still maintains a social/extracurricular life?

&#x200B;

TLDR: Have future humanities majors ever taken integrated science?",Humanities major taking integrated science?,5,1.0,9r5k8i,https://www.reddit.com/r/princeton/comments/9r5k8i/humanities_major_taking_integrated_science/,9,1540457781.0,2018-10-25 03:56:21
omfgitsadog,"Hello Hello!

I have been searching for good Korean BBQ spots in Princeton, NJ but haven't had any luck. If anyone has any recommendations that would be great!",Korean BBQ in Princeton Recommendations,4,1.0,9frqkp,https://www.reddit.com/r/princeton/comments/9frqkp/korean_bbq_in_princeton_recommendations/,6,1536958378.0,2018-09-14 15:52:58
kekizu,Just wondering if anyone had recommendations since the hotel prices seem to range from $120\~$250 a night around Princeton.  Are there any cheaper lodging options in or near town for when I have guests (around $50 per night)? I know about the Erdman Center.,Cheap Lodging Options Around Campus?,4,0.83,9b2gx7,https://www.reddit.com/r/princeton/comments/9b2gx7/cheap_lodging_options_around_campus/,3,1535516840.0,2018-08-28 23:27:20
jcuriousacc,"I’m losing hope. The valedictorian of the class that just graduated (class of ‘18) will be attending Princeton in the fall. I’m in the top 5% of my class, but I’m getting discouraged.","Attendees, were you a high school valedictorian?",4,0.62,98m72z,https://www.reddit.com/r/princeton/comments/98m72z/attendees_were_you_a_high_school_valedictorian/,8,1534730789.0,2018-08-19 21:06:29
SuaveSycamore,"Are you allowed to take food from the dining halls (say, in small plastic containers) out of the dining halls as leftovers and into your room?

Thanks!",Quick question about dining halls,4,1.0,8z6pau,https://www.reddit.com/r/princeton/comments/8z6pau/quick_question_about_dining_halls/,4,1531732227.0,2018-07-16 04:10:27
princetonian2022,"Hello everyone, I was recently accepted to Princeton but on the common app I put AB Computer Science even though I want the BSE track. Should I email admissions now and switch or does choosing your major come later? Is what you choose on the common app your final choice? What should I do?",Switching from AB to BSE Computer Science,5,1.0,88x2qe,https://www.reddit.com/r/princeton/comments/88x2qe/switching_from_ab_to_bse_computer_science/,9,1522675470.0,2018-04-02 08:24:30
spspreppie,How difficult is Calc 1 at Princeton? What can someone do to prepare for it? ,Math 103 Difficulty?,4,1.0,88vy9y,https://www.reddit.com/r/princeton/comments/88vy9y/math_103_difficulty/,5,1522663254.0,2018-04-02 05:00:54
samwich41,"I’m a grad student and might transfer to Princeton, but I’m very worried the town is too small. I’m coming from LA where there are a lot of gay dudes. I’m worried I’ll never find someone to date if I go to Princeton. Is there a city nearby?",I’m gay and might come to Princeton. How is it?,3,0.72,87mqej,https://www.reddit.com/r/princeton/comments/87mqej/im_gay_and_might_come_to_princeton_how_is_it/,5,1522218042.0,2018-03-28 01:20:42
idontsinkso,"Looking for the game, but outside the US (therefore, can't stream ESPNU)? Head to [this Reddit post](https://www.reddit.com/r/hockeystreams/comments/86lwtn)

It will have a link to a page, which will link you to YouTube live streams. Word of warning, you might need to use the stream for the BU/Cornell (unless you want to watch women's softball - guess the links are mixed up)",NCAA Hockey tournament - Princeton/OSU,3,0.81,86vh95,https://www.reddit.com/r/princeton/comments/86vh95/ncaa_hockey_tournament_princetonosu/,0,1521949724.0,2018-03-24 22:48:44
ChesCheeto,"Hello Princeton! I know I'm not a member of your community, but I need your help for a project I'm working on. I am hoping to find out which dining establishments the most people are eating at while they are drunk. What's your favorite place to go to when you have the drunchies? It's a fun, quick survey.

Survey here: https://www.surveymonkey.com/r/X37N5XJ

Also, the only way to be disqualified from this survey is if you do not pass the qualifying question.

Thank you so much!",I need 20 Tigers for a 2 min survey!,3,0.81,7zfdp6,https://www.reddit.com/r/princeton/comments/7zfdp6/i_need_20_tigers_for_a_2_min_survey/,3,1519339671.0,2018-02-22 16:47:51
whyoy,I'm looking forward to the class but I'm a little bit anxious that there's no text.,DAE take Chemical Biology II this semester?,3,0.81,7vzca7,https://www.reddit.com/r/princeton/comments/7vzca7/dae_take_chemical_biology_ii_this_semester/,1,1518065717.0,2018-02-07 22:55:17
whateverthefuck2,"Never gone to a local bar for sports, but I figure A&B is probably the best bet. Anyone with some experience care to weigh in. ",Where to watch the Superbowl?,4,0.83,7unatt,https://www.reddit.com/r/princeton/comments/7unatt/where_to_watch_the_superbowl/,2,1517558929.0,2018-02-02 02:08:49
,"Hi there,

I have been doing some research about US universities and want too know a bit more specific information about Econ department of Princeton. I know that it is one of the best in the world but what do you guys enjoy the most about this department (some awesome prof, a special course or workshop, special curriculum etc.)? 

Or generally, what do you most enjoy about Princeton?

Thanks beforehand!  ",What is the best aspect of studying Econ at Princeton?,5,1.0,7tquh4,https://www.reddit.com/r/princeton/comments/7tquh4/what_is_the_best_aspect_of_studying_econ_at/,3,1517241631.0,2018-01-29 10:00:31
Truthfulthread,"Just had a PICS interview today, when is the earliest that we hear back from the organization?  Thanks",PICS Response Timeline?,5,1.0,7q7syx,https://www.reddit.com/r/princeton/comments/7q7syx/pics_response_timeline/,2,1515911699.0,2018-01-14 00:34:59
vistastructions,Where can I find information on whether I can graduate during the winter?,Does Princeton allow you to graduate one semester early?,5,1.0,7l6kxa,https://www.reddit.com/r/princeton/comments/7l6kxa/does_princeton_allow_you_to_graduate_one_semester/,6,1513853783.0,2017-12-21 04:56:23
Luke-HW,"I was deferred to regular decision, and wanted to know if I am in good company.",What was this years deferral rate?,3,0.72,7kvw4r,https://www.reddit.com/r/princeton/comments/7kvw4r/what_was_this_years_deferral_rate/,2,1513743148.0,2017-12-19 22:12:28
,"I know the alumni interview doesn't really affect the decision, but I heard from someone that a really fantastic one can be a positive. Is this true? ",Does a really great undergrad admissions interview change anything?,4,0.7,7fol1x,https://www.reddit.com/r/princeton/comments/7fol1x/does_a_really_great_undergrad_admissions/,3,1511748727.0,2017-11-26 20:12:07
kuviocreative1,,Princeton Ranked #3 of U.S. Top Value Colleges,3,0.72,7d4wni,https://www.conseris.io/go/jbjmgr#/1628/Home,0,1510789339.0,2017-11-15 17:42:19
princess_ton,"The closer to Princeton University campus the better!

Thanks.",Nice parks around Princeton with outdoor park grills and tables?,4,1.0,726cpx,https://www.reddit.com/r/princeton/comments/726cpx/nice_parks_around_princeton_with_outdoor_park/,2,1506302374.0,2017-09-24 20:19:34
jesuisunbandit,"Hi there,

I'll be at the university during this semester as a Visiting Student Research Collaborator (VSRC), and I haven't been able to find any information regarding meals. Is it possible for me to subscribe to a meal plan? How do VSRCs or more generally faculty/staff eat on campus? 

Thanks!



",Meals on campus as a VSRC,4,1.0,7056dw,https://www.reddit.com/r/princeton/comments/7056dw/meals_on_campus_as_a_vsrc/,4,1505451841.0,2017-09-15 00:04:01
Vengince,"I'm a freshman currently trying to choose the classes for my fall semester. I'm a BSE major with Calc BC credit (5), so I have the option of skipping Math 103/104 and going straight into multivariable calc. In your opinion, is this worth it? What is the general consensus of using AP credit to satisfy requirements, especially in regards to BSE majors? Thanks a ton in advance!",AP credit and course placement,4,1.0,6tjctk,https://www.reddit.com/r/princeton/comments/6tjctk/ap_credit_and_course_placement/,3,1502704186.0,2017-08-14 04:49:46
loljklol123456,"I am eligible for advanced standing, but I wanted to ask this group for some insight and suggestions before I make a decision.

In your opinion and experience, what are the pros and cons of finishing your degree one year early through Advanced Standing?

Would I be put at a disadvantage when looking for jobs and internships? Will I be less qualified than other applicants for grad school? And most of all, is all of this worth it?

I also hear that many students choose not to use advanced standing. Besides missing out on another year of the Princeton experience, why is that? 

Thanks so much!",Advanced standing,3,0.81,6r2e8b,https://www.reddit.com/r/princeton/comments/6r2e8b/advanced_standing/,7,1501684522.0,2017-08-02 09:35:22
rian923,"Title. Anyone have any experiences? I'm a transgender rising high school senior and I'm highly interested in Princeton, i just need to know if there's anything i should be aware of before applying. Will i have the support in classrooms/housing/healthcare that i need? A recent post regarding the gender options was very encouraging, however, the comments were not... ",Trans @ Princeton?,4,0.62,6r25a5,https://www.reddit.com/r/princeton/comments/6r25a5/trans_princeton/,5,1501681053.0,2017-08-02 08:37:33
,"Hey everyone, I'm a prospective student, senior in high school, who is interested in continuing a high school rowing career at Princeton. I'd like to talk to some current (or recently graduated) rowers about what life is like for Princeton, but the coach cannot put me in contact with anyone according to NCAA regulations. Anyone on here a rower or know a rower that I could talk to?",Any Rowers on Here?,4,0.75,6pgfnb,https://www.reddit.com/r/princeton/comments/6pgfnb/any_rowers_on_here/,3,1501021337.0,2017-07-25 17:22:17
hsgrad17,"I am incoming freshman this fall and I am beginning to look into freshman seminars. I was wondering if there are any reviews for specific seminars.

Are there that are geared towards specific types of people? Are there some that are some that are notoriously hard or easy? Are there any that are engaging or uninteresting?

If anyone could provide some input, it would be greatly appreciated. 

Thanks!",Freshman Seminars,4,0.83,6my52j,https://www.reddit.com/r/princeton/comments/6my52j/freshman_seminars/,3,1499934507.0,2017-07-13 03:28:27
Vengince,"I'm an incoming freshman looking at FRS135 for my fall term. It says in the course description that there is a required trip to France/Spain during the fall break. Would this have to paid completely by me? Is it possible to get it covered through financial aid, or perhaps by some other means? I most likely won't be able to sign-up for the class otherwise, but as of right now it's my number one choice. Any advice would be appreciated. Thanks in advance!",Freshman Seminar Question,3,0.81,6m6cts,https://www.reddit.com/r/princeton/comments/6m6cts/freshman_seminar_question/,3,1499616173.0,2017-07-09 11:02:53
arzifald,"Hi everyone,

I'm an incoming graduate student at Princeton and a avid Gmail user, using it with my old university email. I'd like to be able to send and receive emails from Gmail, instead of OWA. Right now, I'm able to forward my emails, but not send them. Does anyone know a good way to send emails from Gmail?",Gmail for Graduate Students,4,1.0,6i9z2y,https://www.reddit.com/r/princeton/comments/6i9z2y/gmail_for_graduate_students/,6,1497940931.0,2017-06-20 01:42:11
AskMeAboutMyElephant,So i have a date and I promised to take her somewhere nice. She lives close to Trenton.. so I said I will take her to some bar in Princeton. This is my first date with her. Can anyone recommend me bars or some place nice? I will take her there either tomorrow or day after.,Recommendations for a bar.,6,1.0,685gn1,https://www.reddit.com/r/princeton/comments/685gn1/recommendations_for_a_bar/,0,1493442622.0,2017-04-29 00:10:22
ps1845,"Interested in general economics but don't know if I'd want to go in depth into it (not a huge fan of math and don't want to be IB). Like history as well. Have looked at consulting as eventual potential career. Would Woody Wu be an okay major, or is it too broad a major?",How is Woodrow Wilson school?,5,0.86,660cw3,https://www.reddit.com/r/princeton/comments/660cw3/how_is_woodrow_wilson_school/,2,1492513808.0,2017-04-18 06:10:08
seductivetaco11,I just read that Princeton's parking passes for undergraduates is by exemption only.  How strict are they with this policy?  Do other undergrads bring cars and park them somewhere else?  I'm trying to plan everything out for this fall.,Undergraduate Parking,5,1.0,65lljh,https://www.reddit.com/r/princeton/comments/65lljh/undergraduate_parking/,2,1492321114.0,2017-04-16 00:38:34
052yo,"I've been admitted to Princeton and Columbia, planning to major in chem, and this decision is just about tearing me in half. Are there any premed students or med students who would like to give me their thoughts on the impact of their undergraduate education at Princeton on their future career plans? Thanks for any thoughts!",Pre-Med Opportunities?,3,0.72,63h48f,https://www.reddit.com/r/princeton/comments/63h48f/premed_opportunities/,2,1491369596.0,2017-04-05 00:19:56
nought_a_bot,"I was accepted to both, and am not sure which one I should choose. Obviously I can't go wrong, but I want to make the right decision. About me: I definitely want to major in math. Also interested in CS and physics.



In particular, I was wondering about specific qualities of Princeton that you think make it much better / much worse than Caltech. What is life in the residential colleges like, etc.?",Any reason to choose Princeton over Caltech?,6,0.8,62z1sk,https://www.reddit.com/r/princeton/comments/62z1sk/any_reason_to_choose_princeton_over_caltech/,5,1491159130.0,2017-04-02 13:52:10
campaignq,"It seems as though there's been a large uptick in staff who's completely unreachable by e-mail. Even departments like Financial Aid, Transportation, and certain Deans",Has anyone else noticed a lack of responses to emails by Princeton staff this year?,5,0.99,5tcb5n,https://www.reddit.com/r/princeton/comments/5tcb5n/has_anyone_else_noticed_a_lack_of_responses_to/,7,1486818191.0,2017-02-11 07:03:11
loversteel12,"I'm not a Princeton student or whatever, I would be beyond ecstatic if I could even get into anywhere close like Princeton, but I have an issue. There is a football player at my high school who recently committed to Princeton for football that DOES NOT deserve it. He is an average high school student who cheated off a person in my class who is in the top 1% of our class (10/986) on the ACT and got a 32. He went around boasting his score AND told multiple people he cheated off the person on the test. He did not get any offers other than top tier ivy leagues so my presumption is that they only offered him based on his ACT score. Also, his SAT score is a 1200 which converts to a 25 on the ACT, which clearly there is a discrepancy amongst the scores. Everybody at my school is furious and are trying to contact the ACT board to get his full ride scholarship revoked. Is there anything y'all can do to help? Thanks!

Edit: Thanks for the advice guys! I guess it'd be better to let it go. Go tigers! (and dawgs (hopefully)! #UGA2021)",Can anyone help me?,4,0.75,5qacog,https://www.reddit.com/r/princeton/comments/5qacog/can_anyone_help_me/,7,1485468855.0,2017-01-26 16:14:15
,"Hi smart people, I'm looking at getting an Amazon Echo speaker for my sister who will start at Princeton in the fall, and I was wondering if anyone else had experience using a non-Ethernet device with the Princeton dormnet wifi. I found this link: https://www.net.princeton.edu/hostmaster/dormnet-subscribe-wireless-only.html but since there seems to be some ambiguity about the performance of a wireless device, I was wondering if anyone else could attest to how well the Amazon Echo / Tap / something similar works. I'd also appreciate any advice on anything else fun you would have liked to have as a freshman, especially if you're a bit introverted. I just want to help her make it a positive experience.",Do wireless speakers work well with Princeton dormnet?,4,0.76,5pxt91,https://www.reddit.com/r/princeton/comments/5pxt91/do_wireless_speakers_work_well_with_princeton/,8,1485311567.0,2017-01-24 20:32:47
metmaniac15,"2 of my fav bands (mild high club and homeshake) are playing at the Terrace Club tonight .. I wanna go so bad but literally know nobody who goes to or has ever gone to Princeton ...

Can somebody adopt me as a guest for this show?? I can't offer much in return, but I can definitely offer you access to be a guest in the literal mild high club 


Thanks ! 
",Adopt me for access to The Mild High Club,4,0.67,5okere,https://www.reddit.com/r/princeton/comments/5okere/adopt_me_for_access_to_the_mild_high_club/,3,1484712804.0,2017-01-17 22:13:24
partymarty-diaries,"Hi Princeton people, 

I'm coming in from the west coast to this thing: http://envision-conference.com/

Has anyone at Princeton heard of Envision? What do people think of it? 

Looking forward to visiting Princeton! Any advice about what to do on campus is greatly appreciated. 


",Envision Conference,4,0.75,5fagpz,https://www.reddit.com/r/princeton/comments/5fagpz/envision_conference/,2,1480347639.0,2016-11-28 09:40:39
Jaesarynn,Is eduroam and puvisitor not connecting to the internet for anyone else?,Wifi Down?,3,0.72,57dg9h,https://www.reddit.com/r/princeton/comments/57dg9h/wifi_down/,0,1476430985.0,2016-10-14 02:43:05
cynicalprogrammer,"Visiting Princeton for my friends birthday, is there a bar hopping scene?",Bar Hopping Guide?,4,0.84,56cx6h,https://www.reddit.com/r/princeton/comments/56cx6h/bar_hopping_guide/,3,1475894425.0,2016-10-07 21:40:25
christopherwrong,"As the post says, I have a wallet that's become unstitched on one side. Does anyone know of a place near town that repairs leather goods? Thanks. ",Where to get leather repaired?,4,1.0,51fbj9,https://www.reddit.com/r/princeton/comments/51fbj9/where_to_get_leather_repaired/,0,1473199152.0,2016-09-06 16:59:12
christopherwrong,"As my post says, I'm looking to pay for a very thorough interior car cleaning. There's a faint smell I can't seem to eliminate. Does anyone know a good place? Thanks.",Where to get car interior cleaned?,4,0.84,4zftuj,https://www.reddit.com/r/princeton/comments/4zftuj/where_to_get_car_interior_cleaned/,1,1472114477.0,2016-08-25 03:41:17
wafflefuckers,"

Just letting you know if you got your edu address you can get

1. [Amazon prime for free](http://www.amazon.com/gp/student/signup/info?ie=UTF8&refcust=4ABEC2AW3SBZEZQA6T54A35UXI&ref_type=generic)

 2.[ Spotify for $5](https://www.spotify.com/us/student/)

For the Amazon deal, you can set it so that your credit card isn't charged after the six months is over. Just go to My Account > My Prime Membership > Do Not Continue (left hand side)

Also, Apple ($200 off macbooks) and Adobe has some pretty good deals for college students as well!",college edu perks,5,0.64,4xk51g,https://www.reddit.com/r/princeton/comments/4xk51g/college_edu_perks/,0,1471139339.0,2016-08-13 20:48:59
Budske,"Hello everybody, I'm from Charlotte NC and I'm going for the weekend to Princeton, around the are of the Princeton university and i'll be with my wife, can you give me recommendations of activities to do or places to go on Saturday please? 

Thanks!",What to do in princeton,4,0.83,4n0zmm,https://www.reddit.com/r/princeton/comments/4n0zmm/what_to_do_in_princeton/,9,1465358346.0,2016-06-07 22:59:06
uberber_,"Congrats again Princeton on winning [#MarchGladness](https://goodblock.gladly.io/app/events/march-gladness/) on [Tab for a Cause](http://tab.gladly.io/) and our [Goodblock adblocker](http://goodblock.gladly.io/)! As promised, we’ll be hosting a scavenger hunt on campus today at 6:30pm.

One of the prizes is Reddit’s Choice, wherein the team with the most upvoted comment on this post will be awarded $100. For a chance to win, you must comment below with the following:

Team name, Task name, link to image  

For complete rules and details, be sure to read our [blog](https://gladly.io/blog/2016/04/27/marchgladness2016-princeton-university-scavenger-hunt/).

Best of luck!
- Giovanni
",Happening today! Princeton Scavenger Hunt,4,0.62,4i6z53,https://www.reddit.com/r/princeton/comments/4i6z53/happening_today_princeton_scavenger_hunt/,6,1462595644.0,2016-05-06 23:34:04
pakskefritten,"I am visiting for my someone's graduation. The first week we dont have a car so am interested in exploration by bike.
1)Does anyone know a good place where we could rent a bike to do some modest biking (exploring the area)+ what are good destinies on a bike trip?

The second week well have a car;
2)Is there any significant nature that is worth visiting for daytrips?

Thanks!",Bike rental+ destiny /outdoor activities around princeton,5,1.0,4h9hpk,https://www.reddit.com/r/princeton/comments/4h9hpk/bike_rental_destiny_outdoor_activities_around/,6,1462144900.0,2016-05-01 18:21:40
jrucewicz,"Hey all, i'll be starting as a graduate student in the fall. I've been told it's good to live in the grad housing to socialize and find your footing. The cost relative to the housing doesn't seem worth it to me. Is it possible to find better off-campus housing for less? ",Off campus vs grad housing?,4,1.0,4glkez,https://www.reddit.com/r/princeton/comments/4glkez/off_campus_vs_grad_housing/,4,1461741116.0,2016-04-27 02:11:56
SikhSoldiers,,Thoughts on the PHS drama going on?,4,0.75,4dx85o,http://www.northjersey.com/news/princeton-high-school-students-pictured-playing-jews-vs-nazis-drinking-game-1.1541074,5,1460162520.0,2016-04-08 19:42:00
nypr13,"A certain Palmer Square coffee shop that only accepts cash sells blueberry muffins every morning that are much more blueberry than muffin, but are often sold out by 8:45 or 9 am.  Sometimes I get there too late.  I love these muffins.    

Does anyone know where they source these muffins from, as I'd like to be able to maybe get them even if I get to the coffee store too late?  I have no idea why they don't buy more of these muffins, since they sell out so quickly.  ",Where can I buy the muffins directly?,5,1.0,4decfs,https://www.reddit.com/r/princeton/comments/4decfs/where_can_i_buy_the_muffins_directly/,7,1459850090.0,2016-04-05 04:54:50
princeton,,This Week in Princeton History for March 28-April 3,4,1.0,4cgcfs,https://blogs.princeton.edu/mudd/2016/03/this-week-in-princeton-history-for-march-28-april-3/,0,1459299541.0,2016-03-29 19:59:01
princeton,,Woodrow Wilson and the Graduate College,4,1.0,4bqnmf,https://blogs.princeton.edu/mudd/2016/03/woodrow-wilson-and-the-graduate-college/,0,1458833008.0,2016-03-24 10:23:28
princeton,,This Week in Princeton History for February 15-21,4,1.0,4678g1,https://blogs.princeton.edu/mudd/2016/02/this-week-in-princeton-history-for-february-15-21/,0,1455724689.0,2016-02-17 09:58:09
Cptsaber44,"So I applied for regular decision to Princeton and had two main questions. Do Princeton admission decisions come out on the same day as all other Ivy League schools (March 31) or do they come out at a random time before then? Also, is there something every incoming freshman should know about life at Princeton?

Thanks in advance.",Questions from a HS senior,4,0.83,45wko2,https://www.reddit.com/r/princeton/comments/45wko2/questions_from_a_hs_senior/,4,1455573607.0,2016-02-15 16:00:07
princeton,,This Week in Princeton University History for February 1-7,3,0.81,43xyt7,https://blogs.princeton.edu/mudd/2016/02/this-week-in-princeton-university-history-for-february-1-7/,0,1454498870.0,2016-02-03 05:27:50
princeton,,"U. President Eisgruber attends annual global conference in Davos, Switzerland",4,0.84,43leye,http://www.princeton.edu/main/news/archive/S45/37/35Q62/index.xml?section=topstories,0,1454309565.0,2016-02-01 00:52:45
princeton,,This Week in Princeton History for January 25-31,5,1.0,43kj1z,https://blogs.princeton.edu/mudd/2016/01/this-week-in-princeton-history-for-january-25-31/,0,1454298048.0,2016-01-31 21:40:48
