author,body,title,score,upvote ratio,id,url,comms_num,created,timestamp
93CiCii,"Hi everyone! I am 25 years old Italian girl, with a BA in communications from an Italian university and a MSc in Politics from the London School of Economics, and nearly 2 years of work experience in international affairs, including with the UN in post-conflict environments. I came across the MA in Global Affairs at Yale Jackson Institute for Global Affairs. Can anyone share their advice and experience on this program? Also, how much did you score in the GRE to get in? I am very bad at math, honestly. I hate maths and I cannot do anything ebyond 2+2, so the GRE is a big - what do I say, big? Huuuuge - obstacle to me. I would need to score a consistently good mark because I need substantial funding for my studies, almost total, and I'm an international student as well. 

Thanksssss",MA in Global Affairs at Yale Jackson,6,0.72,9zdmg5,https://www.reddit.com/r/yale/comments/9zdmg5/ma_in_global_affairs_at_yale_jackson/,1,1542917716.0,2018-11-22 14:15:16
LiteasanOstrichFethr,,To those who have or are currently attending Yale: what advice or suggestions do you have for someone who is applying for their second undergraduate degree?,5,0.79,9wa00a,https://www.reddit.com/r/yale/comments/9wa00a/to_those_who_have_or_are_currently_attending_yale/,7,1542018841.0,2018-11-12 04:34:01
norge_erkult,,"Interesting mini-doc featuring the research of Yale's Prof. David Watts: ""Most Brutal Chimpanzee Society Ever Discovered | Rise of the Warrior Apes""",7,1.0,9pbqc0,https://www.youtube.com/watch?v=dQn1-mLkIHw,0,1539914963.0,2018-10-18 21:09:23
roobbyy,Do professors children have an inside track to admission - especially if they have good academics. ,Professors,7,0.77,9ideil,https://www.reddit.com/r/yale/comments/9ideil/professors/,6,1537777403.0,2018-09-24 03:23:23
,"I have won second and third place at a few smaller international piano competitions in the US, and have consistently placed first at statewide piano auditions.

1. Is it worth regarding these competitions as major achievements in my application?

2. Should I consider sending a piano supplement, and if so, will it be extremely beneficial?",Arts (Piano) Supplement for Yale SCEA Application,6,1.0,9dbtgg,https://www.reddit.com/r/yale/comments/9dbtgg/arts_piano_supplement_for_yale_scea_application/,5,1536215675.0,2018-09-06 01:34:35
NapMcDonald,"Hi all,

I'm an international from the UK who has just moved into Yale. 

I wanted to ask some questions to the community, so thought I would pool them concisely into one post - I hope that's OK! It's a bit of a leap starting up in a new country so these questions might sound dumb, but I just want to make sure I get things right.


1) Is there a good place to buy a bicycle? Ideally a decent second hand bike would be fine. But I'm not sure where to look, particularly for second hands. 

2) Which provider has best phone signal in Yale? I'll mainly be using data for everything (if not Wifi), and I'll mainly be in New Haven, NYC, or Boston for the next few years. So I'm looking for consistent good phone data, and not too pricey. 

3) What bank could people recommend to set up a simple checking account, just to move money in, use it to pay with a card (debit), take cash out, and occasionally receive money? I've seen Bank of America's everywhere - are they user friendly for a simple checking account?


Thanks for all the advice, and sorry if it's all a bit obvious - everything is strange and new for me and your advice is much appreciated.

Cheers!","Bikes, Phones, and Banking in Yale",6,0.88,99iddj,https://www.reddit.com/r/yale/comments/99iddj/bikes_phones_and_banking_in_yale/,18,1535010148.0,2018-08-23 02:42:28
mc6054,maybe just a few extra inches?,Can we loft the bed (maybe just a little)?,6,1.0,98hb4f,https://www.reddit.com/r/yale/comments/98hb4f/can_we_loft_the_bed_maybe_just_a_little/,4,1534677154.0,2018-08-19 06:12:34
alprasnowlam,"Hi guys! I'm an incoming freshman hoping to place out of intro Bio as I've heard the intro class is massive and the material annoying. I've also heard that the placement test is extremely difficult. I reread the Barron's AP Bio book, but apparently much of the placement test material goes beyond the scope of the AP curriculum. How should I go about studying? Thanks!

EDIT Post-Exam: This may have been the most ridiculous exam I've ever taken. The test questions are completely unrelated to the topics the module ostensibly covers. Which isn't to say the questions, if you can even call them that, are difficult conceptually. The content is standard, but the questions just cryptic and meaningless. Often they just make a vague assertion and the impetus is on you justify it. But there's a 2 sentence limit (yes, that's a thing--as if longer, ie. 3 or more sentence, answers are wrong), so you better hope that you read the grader's mind and those 2 sentences were *exactly* what they were looking for because you only get one shot. This whole test is basically an exercise in just Googling random specific things (not necessarily even related to the course material) quickly such that you have enough time to summarize the answer stated explicitly on some random Wikipedia article from 12 sentences into 2 to adhere to the sentence limit and sufficiently obfuscate the content to avoid plagiarism. 30 minutes to do 11 unrelated, arbitrary Google Search summaries, no biology expertise evaluated whatsoever. Protip, you fail, there's objectively not enough time. Shits retarded lol",Biology 101-104 Placement,7,1.0,96cuw5,https://www.reddit.com/r/yale/comments/96cuw5/biology_101104_placement/,13,1533980294.0,2018-08-11 04:38:14
kylamm32,"How is Yale's music program, and is dual-majoring in music and a science doable? ",The Yale School of Music,7,0.89,91dsau,https://www.reddit.com/r/yale/comments/91dsau/the_yale_school_of_music/,8,1532430987.0,2018-07-24 06:16:27
,"I took the math placement exam as a incoming first-year student this summer and was advised to take math 115. I am interested in majoring in statistics and I know that math 120 is a prerequisite for the major--is it advisable to take math 115 and 120 in the fall and spring semesters, respectively? I took up to Calculus AB in high school and received a 5 on the AP exam--is this sufficient preparation to start off in math 115? Lastly, would it be manageable to take S&DS 220b (introductory statistics, intensive) in the spring semester along with math 120, or would this be overloading myself? I want to be on track course-wise but I also don't want to overwhelm myself! Thank you for your advice!",Advice: First Year Math & Statistics Courses,5,0.78,8z6nnx,https://www.reddit.com/r/yale/comments/8z6nnx/advice_first_year_math_statistics_courses/,2,1531731821.0,2018-07-16 04:03:41
william77korea,"I'm staying here for the summer program, but I've been looking for a place to practice soccer for the upcoming season. I understand that there is a Reese stadium about 10 minutes away, but I'm not exactly sure if the soccer field there is public use or not.

Please let me know! Thank you",Does Yale University have a soccer field nearby and can I use it?,7,0.9,8yxlit,https://www.reddit.com/r/yale/comments/8yxlit/does_yale_university_have_a_soccer_field_nearby/,8,1531641267.0,2018-07-15 02:54:27
RyanBrownComedy,"Hey, guys. I'm a comedian from NYC and I'm coming to West Haven with the [Escape From New York Comedy Tour](http://www.ryanbrowncomedy.com/efny) this Saturday. We're a group of NY comics that love hitting the road to perform in smaller cities where the people are nicer and the beer is cheaper. This is our first time coming to Connecticut and we wanna party with all of you! 

It's BYOB, so be ready for that.

**Saturday June 30** come to **RVP Studios: The Cave** and enjoy sets from a few rising stars of the NY stand up scene. [Get tickets here.](https://www.eventbrite.com/e/escape-from-new-york-comedy-tour-in-west-haven-ct-tickets-46544291228)

https://preview.redd.it/kcxq4v41q7611.jpg?width=1080&format=pjpg&auto=webp&s=40b113582c08142f92464b6569257ccd098b953d",Comedy Show in West Haven this weekend,6,0.65,8tu79p,https://www.reddit.com/r/yale/comments/8tu79p/comedy_show_in_west_haven_this_weekend/,2,1529989830.0,2018-06-26 00:10:30
ARandomAlbanian,"I'm an international student and my family can't really afford coming to the US this summer to visit prospective schools. Yale is so far my favorite school academic-wise. I've taken some online Yale courses and I really liked the professors. However, the student environment is pretty important too. I have a few questions and if you could take just a little bit of your time to answer a few of them I would be really grateful.

1. How competitive is the environment? To the level students won't help each other at all or just a rivalry sort of competitiveness?

2. How would you describe your relationships with the professors? (I'm particularly interested in chemistry students here since that's what I'll most likely be majoring in. Anyone is appreciated though.)

3. Are the students open-minded? Do they easily accept different cultures/ideas? 

Thank you so much for even taking your time to read this.",Hello. I am was wondering whether you guys could tell me a little more about the environment.,6,0.88,8re9rk,https://www.reddit.com/r/yale/comments/8re9rk/hello_i_am_was_wondering_whether_you_guys_could/,2,1529124675.0,2018-06-15 23:51:15
yalethrowaway1,"Thanks. Looking forward to checking it out.

Also if ya'll can recommend some solid humanities classes I'd be appreciative. ",Does anybody know when the 2018 blue book drops? I forgot when it came out last year.,6,1.0,8qomxu,https://www.reddit.com/r/yale/comments/8qomxu/does_anybody_know_when_the_2018_blue_book_drops_i/,2,1528883427.0,2018-06-13 04:50:27
Durendal_et_Joyeuse,"I'm moving to New Haven from California to do my PhD at Yale. Other than getting a CT driver's license and voting in state and local elections, what are the advantages of establishing Connecticut as my permanent residence?",For grad students who came to Yale from another state: did you establish Connecticut as your permanent residence after you moved?,6,1.0,8lc6tj,https://www.reddit.com/r/yale/comments/8lc6tj/for_grad_students_who_came_to_yale_from_another/,13,1527041512.0,2018-05-22 21:11:52
dolphinsonsaturn,"Hi there, I'm currently a senior who applied to Yale and am (anxiously) waiting for my decision. So I guess it's a little early for me to start worrying about this but: will I fit in with the social scene even with my introversion and social anxiety?

A bit of background: I used to have really bad social anxiety (diagnosed) in 10th grade, but I've worked really hard to get myself to open up. It's worked to a certain extent, but I still feel it coming back sometimes and preventing me from connecting with other people without getting anxious or tired. All the people who attend Yale (I know a couple) seem so accomplished and outgoing. Even those that are introverts seem so socially confident. I feel like there won't be a place for someone like me, and I'd appreciate if you could confirm/deny this. Thanks so much.",Social Anxiety at Yale,6,1.0,851lq0,https://www.reddit.com/r/yale/comments/851lq0/social_anxiety_at_yale/,5,1521290723.0,2018-03-17 07:45:23
MTG_RelevantCard,"I know we can't participate in the post-season (which sucks, 'cause we could have made a bowl game) but do we not play a Spring Game either?",First year grad student and I can't find any information about the Spring Game? Does Yale not play one?,5,0.7,82ifph,https://www.reddit.com/r/yale/comments/82ifph/first_year_grad_student_and_i_cant_find_any/,3,1520398095.0,2018-03-06 22:48:15
EgoSumAbbas,,"Is Yale skateboard-friendly? If not, what's the best way to get around?",7,1.0,7plc0i,https://www.reddit.com/r/yale/comments/7plc0i/is_yale_skateboardfriendly_if_not_whats_the_best/,6,1515670788.0,2018-01-11 05:39:48
DAVE437,,When do YHacks acceptance come out,6,1.0,7ec8c2,https://www.reddit.com/r/yale/comments/7ec8c2/when_do_yhacks_acceptance_come_out/,5,1511241210.0,2017-11-20 23:13:30
deepfeature,I'm an incoming freshman at Yale and am interested in Debate. I didn't participate in high school debate and was looking at advice and information for trying out and how the experience is in general. Thanks!,Joining Yale Debate Association,6,0.88,6iwfgq,https://www.reddit.com/r/yale/comments/6iwfgq/joining_yale_debate_association/,9,1498193720.0,2017-06-22 23:55:20
luigi2yoshi,"Hello, I am an incoming freshman and I was preselected for the Directed Studies program, meaning that I don't have to apply, and now I'm debating whether or not to accept. I'm generally a biology kid with a pretty strong love for literature and philosophy, so I'm wondering whether participating in the program will burden me from obtaining a science major or help me in the end. Additionally, do the directed studies classes fulfill any distributional requirements? Are they hard classes? What is the reputation for DS on campus? I'm worried DS might be onerous for someone trying to adjust to the college environment the first year. Thanks!",Directed studies?,6,1.0,6d3tdx,https://www.reddit.com/r/yale/comments/6d3tdx/directed_studies/,4,1495677456.0,2017-05-24 20:57:36
,"Hey guys.  I'm planning on possibly applying EA to yale and I was wondering how much AP scores mattered for admissions.  I received a 36 on ACT, 1550 on SAT, have a 3.96 uw gpa, but did not take my AP exams seriously and received scores ranging from 2-4 for ~13 AP tests.  However, I received A's in nearly all of them.  I understand that self reporting them on the common app is optional but will my poor AP scores lower my chances?",AP Scores,6,1.0,6aml27,https://www.reddit.com/r/yale/comments/6aml27/ap_scores/,7,1494561521.0,2017-05-11 22:58:41
magnanimus1994,"I'm graduating soon and moving to Europe, where I won't know too many people. Is there a way to introduce yourself to other Yale alumni based on where you are in the world?",Finding Yalies Abroad,6,1.0,69elge,https://www.reddit.com/r/yale/comments/69elge/finding_yalies_abroad/,0,1494018881.0,2017-05-05 16:14:41
stinkbeast666,Gimme those sweet sweet deets plz!,So what's the deal with the grad student hunger strike?,7,0.82,687djp,https://www.reddit.com/r/yale/comments/687djp/so_whats_the_deal_with_the_grad_student_hunger/,12,1493466101.0,2017-04-29 06:41:41
cobyzeif,"[New Haven Bike Party](https://www.facebook.com/newhavenbikeparty/) is a group ride for riders of all abilities. It is not a race. We ride a SLOW 8-10 miles with breaks along the way. We ride a different route each time, we ride with a huge stereo, each ride has a different theme (this ride's theme is Flower Ride) and usually have an afterparty at a local business. We ride to all neighborhoods in New Haven. So come for the social, come for the exercise, bring your family, just remember to Bike Party!

Join us this Saturday for [Flower Power Ride](https://www.facebook.com/events/1674013569280981/)

* Sat April 15. 

* Meet Wooster Sq.
",New Haven Bike Party- This Saturday!,6,1.0,64ywu7,https://www.reddit.com/r/yale/comments/64ywu7/new_haven_bike_party_this_saturday/,0,1492040319.0,2017-04-12 18:38:39
hitherescotty,"I'm an alum visiting. YaleStation used to be a thing - seems to have been replaced with a generic YCC site. Is there a place online where I can see events happening this week? Not looking for anything in particular just the typical a cappella, theatre, arts, music type stuff. ",How to find out about on campus activities,6,1.0,61wmbs,https://www.reddit.com/r/yale/comments/61wmbs/how_to_find_out_about_on_campus_activities/,3,1490695813.0,2017-03-28 05:10:13
kshelley,"I thought this was important enough to post here:
================================

To the members of the Yale community: 

An executive order signed by President Trump on Friday restricting the entry of individuals from seven countries into the United States may affect members of our community. We share in your concern regarding this situation and assure the community that we are working closely with students and scholars who are directly affected.

We are also in touch with our colleagues at other universities and the Association of American Universities (AAU), of which Yale is a member. The AAU has issued a statement urging a quick end to the administrative order barring returning students and faculty from certain countries, available here. We will continue to monitor the situation and to explore the best options available in response.

More information is on the website of the Office of International Students and Scholars and will be updated regularly.

Sincerely,

Peter Salovey, President and Chris Argyris Professor of Psychology

Benjamin Polak, Provost and William C. Brainard Professor of Economics

Kimberly Goff-Crews, Secretary and Vice President for Student Life ",Message regarding international students and scholars,6,0.8,5qu9r4,https://www.reddit.com/r/yale/comments/5qu9r4/message_regarding_international_students_and/,0,1485732759.0,2017-01-29 17:32:39
TMWNN,,David Gelernter may become Trump's science advisor. Would be first comp sci person in role.,5,0.78,5ov0t2,https://www.washingtonpost.com/news/speaking-of-science/wp/2017/01/18/david-gelernter-fiercely-anti-intellectual-computer-scientist-is-being-eyed-for-trumps-science-adviser/,1,1484835569.0,2017-01-19 08:19:29
kekmemes2017,"I understand that teachers are not allowed to have a sexual or amorous relationship with undergrads, but what about graduate students? Are they allowed to date and/or be in a relationship with undergrads? If I am not mistaken it is only prohibited when the grad student in question is a TA and the undergrad is one of the students that they are lecturing and/or grading. Anyone have any experience with this?",Whats the deal with grad students dating undergrads?,8,0.9,5osqtv,https://www.reddit.com/r/yale/comments/5osqtv/whats_the_deal_with_grad_students_dating/,2,1484808519.0,2017-01-19 00:48:39
eliprospect,"I was extremely excited to be admitted early yesterday, but based on the financial aid package I got (more than 3x what the net price calculator predicted) it doesn't seem like I'll be able to attend Yale. I was really surprised since I had read so much about Yale's generosity.


I know the most specific guidance will come from the financial aid office but I'm wondering if anyone has any suggestions/tips/etc. when it comes to talking to the financial aid office about adjusting the package and making attendance more feasible. As I understand it, they're often amenable to matching offers from similar colleges? Are there any other considerations? It's not that my financial situation has changed since applying, but the expectation is that we'd be paying literally half of my family's gross income every year.

Thanks for any comments or suggestions.",Negotiating financial aid?,6,1.0,5irei0,https://www.reddit.com/r/yale/comments/5irei0/negotiating_financial_aid/,6,1481958953.0,2016-12-17 01:15:53
MitchandIsabella,"My Yale interview is this Wednesday! I have some general questions 

1. Do they have my entire application? I'm definitely going to bring my resume, but I was wondering they've read my essays.

2. Considering that I applied EA, when do the admissions office even make decisions? They'll probably get my report from my interviewer at the end of November, so do they start decision making in the beginning of December??

3. Should I be prepared to talk about anything specifically? I know I'm prepared to talk about my experiences, what Yale offers that makes them my #1 choice, and what I hope to do when I go their. Am I missing anything?

Thank you!!",Interview Questions- help!,5,0.86,5f0uei,https://www.reddit.com/r/yale/comments/5f0uei/interview_questions_help/,5,1480214391.0,2016-11-26 20:39:51
ScottHalpin,"I'm a Yale graduate who has been producing a comedy show at Anna Liffey's once a month. We are on our fifth show, and they all have been super fun. I normally charge a cover of $10, but if you show your Yale ID and say I'm from Reddit, I'll let you come in for free. I'm doing this because I really want to have the best and most fun show possible. I've booked 3 really funny professional comics from NYC who are coming down with me. And if you're a Yale student with any interest in trying out stand-up, let me know and we can see if we can get you on this lineup or a future one potentially.
TLDR: Stand-up comedy Show 8PM Friday October 21 at Anna Liffey's

Eventbrite: https://www.eventbrite.com/e/elm-city-comedy-night-anna-liffeys-v-tickets-26825485750",Stand-Up Comedy Show 8PM Friday at Anna Liffey's,6,0.88,58b51p,https://www.reddit.com/r/yale/comments/58b51p/standup_comedy_show_8pm_friday_at_anna_liffeys/,1,1476922672.0,2016-10-19 19:17:52
gramsey26,,What you would have experienced had you gone to Harvard,5,0.7,5532rw,https://www.youtube.com/watch?v=ot4wyTeB6Q8,1,1475196014.0,2016-09-29 19:40:14
CapitalistMagpie2,"Probably not relevant to most of you here, but I don't know of many other places to ask this anonymously haha. Let me know if you know of any resources.",Does Yale have any sort of Kink/BDSM club or local munch?,7,0.82,53n2sd,https://www.reddit.com/r/yale/comments/53n2sd/does_yale_have_any_sort_of_kinkbdsm_club_or_local/,6,1474402929.0,2016-09-20 15:22:09
calvin_alvin,,Yale freshmen show off their suites/dorms to the rest of their FOOT group and leaders,5,0.78,510avp,https://www.youtube.com/watch?v=g-K_-VIdEpQ,3,1472958922.0,2016-09-03 22:15:22
pitbird47,"tl,dr: I'm looking to buy the reader for  [this online Yale course](http://oyc.yale.edu/religious-studies/rlst-145) if that's even possible. Any help or advice is much appreciated. :)

I've been looking to start [this online Yale course](http://oyc.yale.edu/religious-studies/rlst-145), just to broaden my own horizon a bit. However, I wonder if someone is able to help me get the reading package?

 As I understand, the course draws upon two books (which I can buy) for the primary texts to read and a host of other books and articles as secondary course material.

At the time this course was taught (fall 2006) students at Yale campus could buy a reader containing all secondary texts. Because of copyright issues, this reader is not available online. Therefore I'm looking to buy a hard copy version, if that's at all possible.

I've tried compiling my own reader, but that didn't work out. Besides there being a lot of different sources, I simply can't access/acquire most of them - even though I have access to a modest university library. So yeah, any help or advice is greatly appreciated! :) ",Reader for online 'Open Yale Course'?,5,0.86,50c7lc,https://www.reddit.com/r/yale/comments/50c7lc/reader_for_online_open_yale_course/,2,1472605774.0,2016-08-30 20:09:34
ryotamaki,"Incoming freshman here.
Any ideas about what happened to yalewiki?

http://www.yalewiki.org/wiki/",Yale Wiki (everythinguseful)?,6,1.0,4d6bc4,https://www.reddit.com/r/yale/comments/4d6bc4/yale_wiki_everythinguseful/,7,1459722339.0,2016-04-03 17:25:39
racc813,,Yale submits amicus brief to National Labor Relations Board about Grad Student Unions,7,1.0,48i293,http://news.yale.edu/2016/02/29/yale-other-universities-submit-amicus-brief-national-labor-relations-board,3,1456888177.0,2016-03-01 21:09:37
chocotacoo,"I want to do some photography, roofs are cool.",How to get on to roofs at Yale?,5,0.86,43mefc,https://www.reddit.com/r/yale/comments/43mefc/how_to_get_on_to_roofs_at_yale/,5,1454323189.0,2016-02-01 04:39:49
LaserBeamLol,"Hi everyone! I just found out I've been accepted into Yale for a unit over summer in 2016 and I'm super keen. I'm coming across from Australia so don't really know what to expect! I'm keen to experience as much of the American life as possible, so any recommendations of things to do and see or advice would be appreciated! Also, what is dorm life like over the summer? I know that over summer at my home university there is no one around!

Also, how hard is it to get from New York from Yale (on public transport)? And I heard 6 Flags is nearby (and I LOVE rollercoasters), is it good and easy to get to?

If anyone wants to message me, I would totally love to make some friends at Yale (and potentially meet when I arrive)!",What to expect at Yale over the summer?,6,1.0,3vqr8q,https://www.reddit.com/r/yale/comments/3vqr8q/what_to_expect_at_yale_over_the_summer/,3,1449486755.0,2015-12-07 05:12:35
michaelconfoy,,"The Gymnasium, Yale College, 1901.",5,0.74,3oxsa6,http://i.imgur.com/29BR8G1.jpg,2,1444990264.0,2015-10-16 05:11:04
redditkilledmygpa,"I'm a recent college grad (Kansas State University) and I'm in town for business this week.  I decided to take a campus tour yesterday and it was very cool!   Lot's of very interesting history and beautiful buildings on your campus!  I was pleasantly surprised to find such nice people as well as the Midwest prides itself on hospitality and general friendliness.  I've heard from friends who have moved to the east and west coasts that they often miss having friendly interactions in public.  I didn't find that to be the case at all though!  Anyway, I'm here two more nights and I'm staying in Wallingford.  Any suggestions for things to do or places to eat?  Thanks Yale!",Great Visit! Awesome Campus!,6,0.8,3ewlu7,https://www.reddit.com/r/yale/comments/3ewlu7/great_visit_awesome_campus/,4,1438124525.0,2015-07-28 18:02:05
