author,body,title,score,upvote ratio,id,url,comms_num,created,timestamp
Impune,,"The New Intolerance of Student Activism: ""Who taught them that it is righteous to pillory faculty for failing to validate their feelings, as if disagreement is tantamount disrespect?""",205,0.96,3s67vn,http://www.theatlantic.com/politics/archive/2015/11/the-new-intolerance-of-student-activism-at-yale/414810/,99,1447126781.0,2015-11-09 21:39:41
DownvoteDaemon,,My dads skull and bones fraternity pic. He is the black guy on the far left.,128,0.99,9f0k9y,https://i.redd.it/mi0fa0znunl11.jpg,31,1536722848.0,2018-09-11 22:27:28
doublebach22,,the intersections of new haven,114,1.0,fxwgil,https://i.redd.it/c6cczgjystr41.png,4,1586481559.0,2020-04-09 20:19:19
JohnKimble111,,Justice Department Finds Yale Illegally Discriminates Against Asians and Whites in Undergraduate Admissions in Violation of Federal Civil-Rights Laws,116,0.96,i99wmq,https://www.justice.gov/opa/pr/justice-department-finds-yale-illegally-discriminates-against-asians-and-whites-undergraduate,95,1597386849.0,2020-08-14 01:34:09
Ailot,,“I tried to kiss my interviewer! Are my chances ruined?”,110,1.0,erfkv5,https://i.redd.it/k3sr0bgeoyb41.jpg,13,1579566962.0,2020-01-20 18:36:02
zookmann,,"Does the Yale student body support the statement ""This is not about creating an intellectual space, this is about creating a home?""",107,0.92,3ruz5s,https://www.reddit.com/r/yale/comments/3ruz5s/does_the_yale_student_body_support_the_statement/,174,1446904176.0,2015-11-07 07:49:36
TheApiary,"Obviously you all should do whatever you want. But my unsolicited advice for you: unless you have some urgent personal reason you must start college this fall (outside scholarship that expires and can't be extended or something), take a gap year, and come in fall 2021.

There is a good chance that there won't be in-person classes in the fall. Nobody knows for sure, but it's pretty likely at this point and departments are preparing for it. Don't waste your tuition money on really overpriced webinars from Yale. Wait a year to come, and then get four full years of Yale. In addition, then you have a better chance of graduating into an economy that is one additional year away from this mess, which will probably better for your job prospects when you graduate.

I know you're excited about Yale, so the idea of sitting around at home even longer sounds shitty, but if you're gonna sit around at home next fall, you might as well not have it count against your four years at Yale.",Recommendation for all incoming students: take a gap year,101,0.93,gbkswa,https://www.reddit.com/r/yale/comments/gbkswa/recommendation_for_all_incoming_students_take_a/,18,1588377712.0,2020-05-01 19:01:52
Yob-25,,Went there for a tour this is what I found in the bathroom.,103,0.99,fan9ty,https://i.redd.it/kb19hnrxokj41.jpg,8,1582884431.0,2020-02-28 04:07:11
OpiatedDickfuzz,,Anybody wanna sign my petition to make this our new mascot?,99,0.83,3s9lrh,http://i.imgur.com/nHFk16c.gifv,6,1447188212.0,2015-11-10 14:43:32
greenwave314,"...to claim the Ivy League Title! That was one hell of a game, from the climate change protesters to the crazy 2OT comeback. Just look at the ESPN win probability chart...

https://preview.redd.it/nz2w7gouci041.png?width=1648&format=png&auto=webp&s=6241e5264ef034e33cbd3aeb5143386552899780",FOOTBALL: YALE BEATS HARVARD 50-43,93,0.98,e0ot4u,https://www.reddit.com/r/yale/comments/e0ot4u/football_yale_beats_harvard_5043/,4,1574574913.0,2019-11-23 23:55:13
lexvieboheme,"f in the chat for the first years and sophomores, the only two classes with guaranteed housing that somehow are not guaranteed housing",pain ❤️,90,0.98,hjd4ul,https://www.reddit.com/r/yale/comments/hjd4ul/pain/,6,1593648252.0,2020-07-01 19:04:12
chubbybunny226,Doctoral candidate in Chemistry! What’s something that you wish you knew before coming to New Haven? Any tips for us newcomers?,I accepted my offer today! Officially a Yallie!!,92,0.98,ftcsv8,https://www.reddit.com/r/yale/comments/ftcsv8/i_accepted_my_offer_today_officially_a_yallie/,6,1585818372.0,2020-04-02 04:06:12
overenthused,"I’m a prefrosh who just finished Bulldog Days, and just have to say thank you to all of the wonderful people I met on campus!

I never ate alone, even in dining halls where I didn’t know anyone. Some Yalies would always take pity on me and invite me to sit with them. 

My hosts were amazing, but I found plenty of wonderful Yalies while sitting in common rooms or in classrooms or on park benches as well. Students would recognize the BDD bracelet on my wrist and introduce themselves to me and offer to talk to me about my major or show me around. 

Even more than being kind, every Yalie I met was thoughtful and non-judgmental, even when I was nervous and stuttering through the day. Not every conversation was about quantum physics or objective morality, but I walked away from every conversation having learned something new. Even better, I felt like the Yalies I talked to wanted to listen and learn from me too. 

I don’t know how many of you guys I saw out there, but I’m sure that all of you contribute to the warm atmosphere I felt on campus that cut through the New Haven rain. So thank you to all of you reading, and I can’t wait to see you as a student.",Thank you Yalies,90,0.96,betrzx,https://www.reddit.com/r/yale/comments/betrzx/thank_you_yalies/,5,1555667785.0,2019-04-19 04:56:25
fascismatyale,,Fascism at Yale | The Harvard Law Record,83,0.88,3salav,http://hlrecord.org/2015/11/fascism-at-yale/,43,1447204227.0,2015-11-10 19:10:27
Emanuel_H,,UP/F Baby!,82,0.93,fwlwz3,https://i.redd.it/cfw8a46qter41.png,15,1586300211.0,2020-04-07 17:56:51
jaxsson98,"Hey everyone. I've noticed a recent spike in external posts and comments here that could best be described as concern trolling, attempting to inflame opinions among the student body. I would just like to make everyone aware of this: [https://imgur.com/a/iaZfagV](https://imgur.com/a/iaZfagV). I am not implying that all new or external posters or commenters here are part of this, but I think it is best that people be aware that r/Yale and other Yale specific forms of social media might be subject to heavy trolling or brigading.",Concern Trolling on r/Yale,76,0.94,h15zaw,https://www.reddit.com/r/yale/comments/h15zaw/concern_trolling_on_ryale/,21,1591931997.0,2020-06-11 22:19:57
,,"Brand new Gothic Entrance to Yale University’s Pauli Murray College, completed in 2017 in New Haven, CT, USA. Traditionalism is not dead.",76,0.96,g1r1be,https://i.redd.it/ef0men1l3us41.jpg,1,1586982750.0,2020-04-15 15:32:30
Yejus,,Saw a love-letter on a pole near the Becton Center,71,0.95,fkkqqu,https://i.redd.it/hsgpcrggfdn41.jpg,5,1584539942.0,2020-03-18 08:59:02
Neess9999999,"I am so exhausted. Not from my workload, that isn't even too bad. It's just the environment and people.

I don't even know how to describe it. It's not that the people here are mean - they aren't. It's just I wish people here weren't ALWAYS on. I'm tired of it. You can always tell people are comparing themselves to you in every conversation. No one has time to hangout because they're always busy. ""What are you doing next summer"" has come up like 50 times already this year. Some people just ""befriend"" you to expand their future network.

I just visited my friend at a less intense (but still great) school and the people there just seemed so much more relaxed and happy. Two years ago I couldn't wait to be surrounded by super motivated people, but now I realize how emotionally draining it is.",Is anyone else exhausted from the environment here?,67,0.92,9qu2l0,https://www.reddit.com/r/yale/comments/9qu2l0/is_anyone_else_exhausted_from_the_environment_here/,18,1540364157.0,2018-10-24 01:55:57
bigleaguechyut,,Yale Men's Basketball defeats Harvard to win Ivy League Tournament and advance to NCAA tournament!,71,0.99,b2c6g2,https://www.ncaa.com/video/basketball-men/2019-03-17/mbk-mens-basketball-ivy-final-harvard-yale-highlights,2,1552898053.0,2019-03-18 03:34:13
wiseprogressivethink,,Yale just went full retard,71,0.74,3rupo5,http://acecomments.mu.nu/?post=359966,4,1446898447.0,2015-11-07 06:14:07
orangeazn,"Final score: 21-14

2016: anything can happen",Yale wins The Game for the first time since 2006,66,0.98,5duv3q,https://www.reddit.com/r/yale/comments/5duv3q/yale_wins_the_game_for_the_first_time_since_2006/,3,1479622349.0,2016-11-20 00:12:29
bigleaguechyut,,"Yale football defeats Harvard in the 134th playing of The Game, winning the Ivy League championship outright for the first time since 1980!",66,0.99,7dwbb7,https://yaledailynews.com/blog/2017/11/18/team-145-wins-the-game-outright-ivy-title/,1,1511073306.0,2017-11-19 00:35:06
jaxsson98,"President Salovey has just announced Yale's updated policy in response to COVID-19. 

Major changes (copy/pasted from President Salovey's email)

\-  When spring recess ends and through April 5 at the earliest, classes will be held using Zoom, Canvas, or other online tools. I know classes take many forms across the university, so this shift to online teaching and learning raises many questions. Deans will be communicating with their faculty and students to provide further details in the days ahead. 

\-  We are asking Yale College students to remain at home after spring recess. For undergraduates who are on campus now, please make every effort to return home as soon as possible, and no later than Sunday, March 15. Yale College Dean Marvin Chun will be providing additional details in the coming days. Undergraduates will have the support of the university in meeting their academic requirements remotely while at home. I understand that some undergraduates consider New Haven to be their home or cannot leave the university at this time. The Yale College Dean’s Office will provide separate instructions for these students, who also will take their classes online.

Graduate and professional students are encouraged to remain off-campus and participate in online instruction, unless required to be on campus due to the nature of their research or academic programs. More information is forthcoming from the deans of each school.

The university will remain open and continue to provide custodial and limited dining services. 

\-  University-sponsored travel is now prohibited (Travel is considered university-sponsored if it draws on a university-administered funding source.)",COVID-19 Policy Update,68,0.92,fgnwnq,https://www.reddit.com/r/yale/comments/fgnwnq/covid19_policy_update/,9,1583913948.0,2020-03-11 03:05:48
Sentinal76,,Calhoun College to be Renamed For Grace Hopper,65,0.96,5tgsf0,http://yaledailynews.com/blog/2017/02/11/calhoun-college-renamed/,22,1486868728.0,2017-02-11 21:05:28
bigleaguechyut,,"HIGHLIGHTS: Harvard 43 @ Yale 50 [2OT] - Yale football, down 17 in the 4th quarter, wins the 136th edition of The Game to win a share of the Ivy League title",61,0.98,e129ar,https://www.youtube.com/watch?v=-sWIexSy3M4&fbclid=IwAR3LLqVg946ElvH8r0Kqt2XGeL7PtU8Z8JVisGDsVTKGVUeytEtdpjUwsOw,0,1574648639.0,2019-11-24 20:23:59
Kedrico,,Yale Library Security Lipsync Challenge,61,0.97,9xqrbk,https://www.youtube.com/watch?v=JVVhQA0A5W8&app=desktop,2,1542434935.0,2018-11-17 00:08:55
Patari2600,I’m drunk and I want to say the fact your downvotes are Harvard is glorious fuck Harvard,Do not attend Yale but...,58,0.83,9i6d0c,https://www.reddit.com/r/yale/comments/9i6d0c/do_not_attend_yale_but/,2,1537711826.0,2018-09-23 09:10:26
elkresurgence,"Applicants: Post all your admissions-related questions and comments here. This includes questions about undergrad and grad school admissions alike. Individual submissions on admissions outside of this megathread are subject to removal.

Students and alumni: We've all been there and know how stressful the college application process can be! Let's try our best to give constructive, specific feedback to all prospective Yalies and refrain from comments that would discourage them from reaching out to us.",Admissions megathread,59,0.88,d48a3h,https://www.reddit.com/r/yale/comments/d48a3h/admissions_megathread/,189,1568511271.0,2019-09-14 20:34:31
BioRender,,"Epidemiological Comparison of Respiratory Viral Infections (Created by Dr. Akiko Iwasaki, Professor at Yale University School of Medicine.)",56,0.94,fi4stn,https://i.redd.it/zvwh6q85mhm41.jpg,1,1584154800.0,2020-03-13 22:00:00
elkresurgence,,"A new study in The Lancet by a team of Yale epidemiologists finds that Medicare for All would save more than 68,000 lives annually as well as $450 billion in cost",53,0.86,f4chkq,https://www.sciencedirect.com/science/article/pii/S0140673619330193,0,1581816275.0,2020-02-15 19:24:35
CornellBigRed,,Yale holds off Duke to win first NCAA lacrosse title!!,56,0.98,8mtixf,https://www.usatoday.com/story/sports/college/lacrosse/2018/05/28/yale-wins-first-ncaa-lacrosse-title-defeat-duke/649780002/,0,1527571557.0,2018-05-29 00:25:57
cogitoergognome,"You were awesome and a great friend. I know that you were a Redditor, were great at trivia and engineering, and were a surprisingly good cook, but I wish I'd gotten to know so much more. It won't be the same without your big hair, easy smile, and that trademark nod-and-eyebrow-raise as you'd walk past. RIP.","RIP, Zach.",56,0.97,sgzrz,https://www.reddit.com/r/yale/comments/sgzrz/rip_zach/,3,1334825019.0,2012-04-19 03:43:39
empacanator,,We're All Special Snowflakes!,52,0.79,3smbg2,https://www.youtube.com/watch?v=sXQkXXBqj_U,7,1447413667.0,2015-11-13 05:21:07
ayal47,,I don’t have an interesting title,56,0.92,eamew2,https://i.redd.it/ihyh2o8uum441.jpg,4,1576372909.0,2019-12-14 19:21:49
,,Former Navy SEAL enters Yale as a 52-year-old freshman,52,0.97,cz50n8,https://wtop.com/national/2019/09/former-navy-seal-enters-yale-as-a-52-year-old-freshman/,3,1567546821.0,2019-09-03 16:40:21
elkresurgence,"This megathread is for all Yale applicants, undergraduate and graduate alike, to discuss various admissions-related topics and ask current students and alumni for **informal** advice. We strongly encourage you to contact the Yale Admissions office and relevant faculty advising offices to confirm any unofficial answers you receive online.

Going forward, all standalone admissions posts will be removed and OPs directed to this megathread. 

Best of luck on your applications!",Admissions Megathread (Fall 2019 intake),51,0.87,aat7mz,https://www.reddit.com/r/yale/comments/aat7mz/admissions_megathread_fall_2019_intake/,54,1546177066.0,2018-12-30 07:37:46
colorfulartlines,,Is anyone else outraged by The Simpsons Stooping this low?,52,0.5,661fcb,https://www.youtube.com/watch?v=p8M2tg2RkIQ,85,1492529722.0,2017-04-18 10:35:22
Pandaemonium,,"The Opposite of Loneliness, by Marina Keegan",55,0.96,u8ueo,http://www.yaledailynews.com/news/2012/may/27/keegan-opposite-loneliness/,2,1338250258.0,2012-05-28 19:10:58
Answerthee,,"Terence Renaud on Twitter: ""rumors are trickling down at both Yale & Harvard that they might delay the start of next semester, basically offsetting AY2020-21 so that the fall semester would take place in SP21 and the spring semester in SU21. I've heard that this is a 50/50 possibility...""",54,0.94,fzqc0o,https://twitter.com/terry_renaud/status/1248737465499877383,11,1586695812.0,2020-04-12 07:50:12
,,"A Navy Seal's Semester at Yale, at Age 52",48,0.97,ef1b83,https://medium.com/@james.hatch/my-semester-with-the-snowflakes-888285f0e662,0,1577222660.0,2019-12-24 15:24:20
SportsInfoFinder27,,"I found the protest really interesting. I didn’t know about the university’s endowments until after the sit-in, so I guess it worked.",46,0.88,e0nuwk,https://www.getmoresports.com/college-football-news-protesters-stage-sit-in-at-harvard-yale-game-over-climate-change/,0,1574570844.0,2019-11-23 22:47:24
DieGo2SHAE,,Foolproof method for spotting a freshman here,48,0.92,ljhby,http://i.imgur.com/wHlUy.png,8,1319194031.0,2011-10-21 05:47:11
LingeringDildo,,Yale economist William Nordhaus awarded Nobel Prize for Economic Science,45,0.91,9mh79n,https://yaledailynews.com/blog/2018/10/08/yale-economist-william-nordhaus-awarded-nobel-prize-for-economic-science/,0,1539050103.0,2018-10-08 20:55:03
bigleaguechyut,,"Yale football defeats #18 Princeton 51-14, will play for Ivy League title next week in The Game",46,0.96,dxkd8f,https://yalebulldogs.com/news/2019/11/16/football-rawlings-six-touchdowns-fuel-yale-over-princeton-51-14.aspx,0,1574010204.0,2019-11-17 11:03:24
NuclearZombiePancake,,Yale Crew Completes Perfect Season With Win Over Harvard,44,0.99,6hnh3x,http://www.courant.com/sports/hc-yale-harvard-regatta-0611-20170610-story.html,0,1497658077.0,2017-06-16 19:07:57
doublebach22,,‘30 Bulldog Days of April’,46,0.9,fqmc4d,https://i.redd.it/237m2k46nfp41.jpg,6,1585438415.0,2020-03-28 18:33:35
Laserman6700,"Truly happy to say I got in. I'm excited to meet my classmates at Bulldog Days and the rest of you next school year!

I intend to be a classics major, if anyone would like to chat about that.",Can't wait to be a Bulldog this fall!,42,0.95,a6abea,https://www.reddit.com/r/yale/comments/a6abea/cant_wait_to_be_a_bulldog_this_fall/,11,1544860634.0,2018-12-15 01:57:14
Kobobzane,,A Black Yale Student Was Reported To Campus Police For Napping In Her Dorm,44,0.9,8ibljj,https://www.refinery29.com/2018/05/198721/lolade-siyonbola-yale-racism,100,1525947988.0,2018-05-10 05:26:28
Membank,"I'm not sure what peoples feelings are here, but I feel like if a person only comes here to try and be a troll and not actually engage in discussion at all then they are pretty openly breaking rule 4 ""Exercise civility and good faith when entering a conversation."" 

It takes about 30 seconds to see that these people on the sub aren't at all a part of Yale and are just there to be a troll and try and stir up shit. 


So far the mods have said ""there is often a fine line between troll activities and people wanting to speak their minds, even if some of the opinions may be uncomfortable to others. It takes us time to make sure we don't carelessly censor the latter kind"" which is an easy cop out that just means ""I don't want to actually do anything about this since it means I need to put in any effort.""

There is no fine line, when people come in and say ""Yes, Cancel Yale.

Elihu Yale Enslaved my people. I will not be marginalised anymore.

If the left is against racism then CancelYALE."" and then you look in their profile and they are a white guy from Australia then please explain how that isn't trolling and is just ""speaking their mind""",Moderation on the sub,44,0.89,hfeob9,https://www.reddit.com/r/yale/comments/hfeob9/moderation_on_the_sub/,48,1593082172.0,2020-06-25 05:49:32
boredomisbliss,1st ever NCAA championship go Bulldogs,NCAA 2013 National Champions fuck yea,41,0.95,1caxz6,https://www.reddit.com/r/yale/comments/1caxz6/ncaa_2013_national_champions_fuck_yea/,7,1365933722.0,2013-04-14 05:02:02
elkresurgence,"Applicants: Post all your admissions-related questions and comments here. This includes questions about undergrad and grad school admissions alike. Individual submissions on admissions outside of this megathread are subject to removal.

Students and alumni: We've all been there and know how stressful the college application process can be! Let's try our best to give constructive, specific feedback to all prospective Yalies and refrain from comments that would discourage them from reaching out to us.",Admissions Megathread,41,0.86,gqb1oj,https://www.reddit.com/r/yale/comments/gqb1oj/admissions_megathread/,87,1590442451.0,2020-05-25 16:34:11
icecreeper01,"Hello students of Yale. This post is to invite ya'll to join our anarchy server. The server was started a day or 2 ago by Cornell students, but we are now extending it to some other ivy league schools. The server is complete anarchy, the only rules being that you are not allowed to use speed/fly hacks. If you're interested in joining, the IP is: ~~34.68.157.182~~

**UPDATE:**
The anarchy server is closing, but the world download is being sent by the current owner to the owner of another Cornell run Minecraft server. In the coming days, they will be running the anarchy world, in addition to a regular survival, and creative world. I will make a new post once the anarchy world is up again.
The new IP is:
147.135.68.19:25578
The server is running in 1.15.2

The discord server is:
https://discord.gg/btHTQZH


Additionally, I am not the owner of the server, but he gave me permission to invite other schools.  Enjoy!!",Minecraft Anarchy Server for Ivy League,44,0.94,foavcz,https://www.reddit.com/r/yale/comments/foavcz/minecraft_anarchy_server_for_ivy_league/,3,1585105225.0,2020-03-24 22:00:25
mark_n_cheese,"Any indoor space is good with us. 3-4 individuals. Here is what we are willing to trade for a place to sleep:

* A free haircut
* Jefe's taco
* A couple half-eaten pastries
* John Harvard's left foot
* Some really cool marbles (but not my favorite ones sorry)

Any interest?

&#x200B;

https://preview.redd.it/4s5f72urbdz31.png?width=720&format=png&auto=webp&s=fdbb2cb3da4b3b623b523d2f7fb5c64d11cf5d75",Harvard students looking for room to sleep in for The Game,41,0.99,dxxwmj,https://www.reddit.com/r/yale/comments/dxxwmj/harvard_students_looking_for_room_to_sleep_in_for/,3,1574078329.0,2019-11-18 05:58:49
grandma_ester,,Yale Reaffirms Support for Admitted Students’ Right to Protest,45,0.98,7zylz5,https://i.imgur.com/TubFAL5.jpg,3,1519527048.0,2018-02-24 20:50:48
XtwoX,,Hillhouse Avenue [2017],42,1.0,7yce57,https://i.redd.it/8sgh1nwkqwg01.jpg,0,1518960662.0,2018-02-18 07:31:02
farful,"Yale Alert message- THIS IS NOT A TEST

**Update message to the Yale Community, November 25- 3:30 pm**

The Shelter-in-place/lock-down has been lifted for Calhoun College but continues for Old Campus. 

**Update message to the Yale Community, November 25- 3:10 pm**

Shelter-in-place/lock-down lifted, with the exception of Old Campus and Calhoun College. More info to follow by email.

**Update message to the Yale Community, November 25, 1:45 p.m.**

Out of an abundance of caution, Police will be doing a room to room search starting with the residential college areas. When they knock on your door, a Yale Police Officer will slip their Yale ID under the door. Please cooperate. In some cases, Police may use keys, but they will identify themselves. Shelter in Place continues.

**Update message to the Yale Community, November 25 - 12:54 p.m.**

There is no change in the campus status. We do not have additional information at this time. Those on campus should continue to shelter in place.

**Update message to the Yale Community, November 25 - 11:57 a.m.**

There are confirmed reports of a person with a gun on campus on the Old Campus. The shelter-in-place/lockdown continues.

Teams from Yale Police, New Haven and the State Police are on the scene and are actively searching for any gunman. 

THIS IS NOT A TEST. Call 911 with any information.

**Update message to Yale Community, November 25 - 11:37 a.m.**

SHELTER IN PLACE/LOCKDOWN REMAINS ON CAMPUS. IF OFF CAMPUS, STAY AWAY.

**Text message to the Yale Community, November 25 - 11:02 a.m.**

Confirmed report of person with a gun on/near Old Campus. SHELTER IN PLACE. This is NOT a test.

**Text message to the Yale Community, November 25 - 10:50 a.m.**

Reports of person with gun on Central Campus. SHELTER IN PLACE until further notice.

**Message sent to Yale Community November 25- 10:17 a.m**

New Haven Police have received an anonymous call from a phone booth in the 300 block of Columbus Avenue (between Howard Avenue and Hallock Street) reporting a person on the Yale Campus with a gun. There have been NO confirmations or sightings of this person.  Yale and New Haven Police are in the area.  If you have information, please call 911 immediately.  The Yale Police Department advises those on campus to remain in their current location until there is additional information.

[More information will be provided when available.](http://emergency.yale.edu/)

Due to a Yale Alert issued from Emergency Management, shuttle service has been discontinued for the Purple Line leaving the Medical School. Please stay tuned for updates.","""Unconfirmed report of person with gun on campus. Stay in place.""",40,0.93,1rf63x,https://www.reddit.com/r/yale/comments/1rf63x/unconfirmed_report_of_person_with_gun_on_campus/,7,1385422038.0,2013-11-25 17:27:18
BioRender,,"Principles of Herd Immunity & Social Distancing (created by Dr. Akiko Iwasaki, Professor at Yale University School of Medicine. and the BioRender scientific content team)",37,0.89,fkv6qj,https://i.redd.it/xdd4vgdwchn41.png,0,1584587455.0,2020-03-18 22:10:55
