author,body,title,score,upvote ratio,id,url,comms_num,created,timestamp
_God____,,What Divides Us?: An Interview with Yale College Dean Jonathan Holloway - The New Yorker,20,0.94,3szlo7,http://www.newyorker.com/news/news-desk/what-divides-us-an-interview-with-yale-college-dean-jonathan-holloway,1,1447681247.0,2015-11-16 07:40:47
Pandaemonium,,TIL there's a building in Boston called Massachusetts Hall.  Remind you of anything?,18,1.0,s1tr5,"http://en.wikipedia.org/wiki/File:Massachusetts_Hall,_Harvard_University.JPG",4,1334051352.0,2012-04-10 04:49:12
lolfts,"So you know how Harvard is planning on drowning us out with those damned thundersticks again?! (You should, here's the blog post:http://www.yaledailynews.com/news/2011/nov/16/harvard-students-pack-noisemakers-game/?cross-campus) Well, they made the mistake of making the order form public.
 
https://docs.google.com/spreadsheet/viewform?hl=en_US&formkey=dEF3a1p0SVZfNnJfS096aWFONHVJSEE6MQ#gid=0
 
SPAM IT. 
 
Spam early, spam often, with fake names and real ones. They won't be able to distinguish which orders are fake and which are real! Here is a list of freshman dorms. Here is a list of upperclass houses. There see to be two email address formats: firstinitial lastname@college.harvard.edu (more common) and first name.lastname@college.harvard.edu (example, John Smith is jsmith@college.harvard.edu and sometimes john.smith@college.harvard.edu). Use gmail addresses, too. Make up a phone number.
 
Leave the tab open, and check in throughout the day.
 
BOOLA BOOLA AND HUCK FARVARD. SEND THIS OUT TO EVERYONE.
 ",Shutting Harvard Down,18,0.95,mffs1,https://www.reddit.com/r/yale/comments/mffs1/shutting_harvard_down/,7,1321541891.0,2011-11-17 08:58:11
xizuo123,I am thinking of applying to Yale for Fall 2021 as an international student so I don't have a chance to visit or know anyone from Yale to tell me about this.,"I heard that the 'spirit of collaboration' is extremely integrated into the culture at Yale. What are some specific examples? (in class, facilities, school spirit, social, residential colleges, etc...)",18,0.95,il2uyz,https://www.reddit.com/r/yale/comments/il2uyz/i_heard_that_the_spirit_of_collaboration_is/,17,1599063389.0,2020-09-02 11:16:29
TropicalMako,I’m confused. What’s the point?,Why is add/drop period before classes even start this semester?,16,0.92,ih5s3u,https://www.reddit.com/r/yale/comments/ih5s3u/why_is_adddrop_period_before_classes_even_start/,6,1598499537.0,2020-08-26 22:38:57
jeopardyman,"Title says it all, what are the most accessible courts nearest to old campus, preferably outdoor? Ideally, I'd like to jump through the least hoops possible (showing ID or something idk) and be as COVID-safe as possible. 

also if anybody is in new haven and is down to play, send a PM. I'm pretty terrible, just started out.",Best place to play tennis?,18,1.0,iazwpw,https://www.reddit.com/r/yale/comments/iazwpw/best_place_to_play_tennis/,4,1597639043.0,2020-08-16 23:37:23
Maximum-Tough8516,Im a prefrosh who’s having strong second thoughts about deferring. I initially chose to enroll because I was lonely and bored at home but reading earlier advice about deferrals made me realize I might regret this decision in the future. How essential were y’alls first years to your college experience and how much do you think I’d regret starting my Yale experience this way?,Should I take a last minute gap year?,17,0.95,i6xb9k,https://www.reddit.com/r/yale/comments/i6xb9k/should_i_take_a_last_minute_gap_year/,19,1597058754.0,2020-08-10 06:25:54
nc_3481,"Hello, I am an incoming freshman to the Class of 2024 and am interested in being a chemistry major at Yale. I'm strongly hoping to take the O-Chem for first-year students class and am also interested in taking physical chemistry the following year. If that is the case, is it best to take Math 230/231 over 120+225+250? I know physical chemistry usually requires mutli, linear algebra, and dif eq, so I wasn't sure if one was more optimal over the other.

&#x200B;

P.S. I am also very much interested in being a music major -- in your experiences, is it possible to do a double major in something that has absolutely no overlap with the science/pre-med curriculum?

&#x200B;

Thank you! ",Question about Math placement for a Chemistry Major,17,1.0,grp38t,https://www.reddit.com/r/yale/comments/grp38t/question_about_math_placement_for_a_chemistry/,18,1590632211.0,2020-05-27 21:16:51
quakerman123,"I just got accepted by Yale. So excited. Since now we can't visit campus, I watched a lot of youtube videos of Yale freshman dorms. It appears that some rooms are large, while other are small with bunk beds. I noticed in one video that the upper bunk bed does not even have guardrail. I wonder if that is common in Yale and if facility management can install guardrail upon request. Can someone share his/her experience? Thanks!",Yale freshman dorm,17,0.95,ful053,https://www.reddit.com/r/yale/comments/ful053/yale_freshman_dorm/,12,1585993103.0,2020-04-04 04:38:23
prefrontalobotomy,"I'm sure you've seen too much from the class of 2024, but as many students are forced to decide between Yale and other great schools (for me personally, UChicago), this can certainly help students to choose the school that is right for them. So, feel free, current students, alumni, and students who know Yale is their home, to share what you love, what you hate, and what you just find interesting.

Thank you all, and if Yale is the best for me, see you next year!",What are your favorite and least favorite things about Yale?,16,0.82,frielu,https://www.reddit.com/r/yale/comments/frielu/what_are_your_favorite_and_least_favorite_things/,6,1585563508.0,2020-03-30 05:18:28
InsideCTSports,,"Yale, Princeton To Meet In Key Ivy Match-Up",18,0.95,dwvmja,http://insidectsports.blogspot.com/2019/11/yale-preps-for-ivy-showdown-with.html,0,1573875026.0,2019-11-15 21:30:26
AlexandersLover,"Hi, I'm a prefrosh and was just notified that I was confirmed for FSY this Summer! I'm really excited for it and was wondering what the reception on FSY is from current students. If anyone has any advice or just general tidbits about the program it'd be greatly appreciated. 

If there's other FSY prefrosh on here, hi! Maybe we can all link up and make a group chat or something.",First-Year Scholars!,16,0.99,boryzn,https://www.reddit.com/r/yale/comments/boryzn/firstyear_scholars/,4,1557915147.0,2019-05-15 05:12:27
kshelley,"To the Yale Community,

In the hours since Provost Polak, Vice President Goff-Crews, and I wrote to you yesterday evening, we have continued to work closely here on campus, and with colleagues at other U.S. universities, in response to the executive order signed by President Trump on Friday. As you are no doubt aware, the order provides the following:
For the next ninety days it blocks entry into the United States by citizens of seven predominantly Muslim countries: Iran, Iraq, Libya, Somalia, Sudan, Syria, and Yemen;
For the next ninety days it appears to bar individuals with valid visas and even green card holders from those countries from re-entering the United States unless exemptions are granted;
For the next 120 days it suspends entry of all refugees to the United States; and
It bars Syrian refugees indefinitely.
We are alarmed by this executive order. Together with many others in and beyond the Yale community, we question the motivation underlying it and recognize that it departs from long-standing policies and practices in our country. All of us are worried for colleagues, friends, and family members who may be affected by these and other changes in immigration laws.

American institutions of higher learning are united in their distress on behalf of our international students and faculty, and in their reliance on our communities’ most fundamental values of accessibility and open dialogue. Our educational mission and the welfare of our community members are directly at stake. National security is of the utmost importance, but we are steadfast in asserting that this goal can be achieved while maintaining respect for core academic—and American—values. This is why Yale joins with the Association of American Universities (AAU) in urging that “the administration’s new order barring the entry or return of individuals from certain countries...should end as quickly as possible.” We support the AAU’s call for the United States to continue “to welcome the most talented individuals from all countries to study, teach, and carry out research and scholarship at our universities.”

Our Office of International Students & Scholars (OISS), in consultation with legal counsel, has recommended that Yale students and scholars from the designated countries (including dual nationals and U.S. permanent residents) suspend plans for international travel without first consulting OISS or an immigration attorney. Staff in OISS have reached out to Yale students and scholars from the seven countries affected. The office will also be hosting open meetings for the Yale community on Wednesday, February 1, and Thursday, February 2, from 4:30 to 5:30 p.m. More information is on the OISS website and will continue to be updated regularly. I know that a number of the deans also have reached out to their students and faculty, and that several gatherings of support are planned for this evening. I am grateful to see the many ways that our university community is coming together in response to this assault on our values.

Our campus includes more than 5,000 international students and scholars from 118 countries; they are part of the very lifeblood of this university. I reiterate here our commitment to the safety, well-being, and vital place at Yale of these international scholars and students, the members of our Muslim community more generally, and others who may be affected by Friday’s executive order. Not only do immigrant and international students and scholars contribute to our university, they contribute tremendously to our nation. Those who choose to stay bring new ideas, skills, energy, and cultures. Those who choose to return home foster goodwill toward the United States abroad. Today, we at Yale join our voices with all those who are calling for swift reversal of these measures that undermine our university’s—and our nation’s—core values.

Sincerely,

Peter Salovey, 
President and Chris Argyris Professor of Psychology",Update: Yale’s Response to Executive Order on Immigration,17,0.91,5qy9c0,https://www.reddit.com/r/yale/comments/5qy9c0/update_yales_response_to_executive_order_on/,0,1485774807.0,2017-01-30 05:13:27
egolds22,,"It's official, Montague was expelled for sexual misconduct on Feb. 10th",17,1.0,49vm3e,http://yaledailynews.com/blog/2016/03/10/mens-basketball-captain-expelled-for-sexual-misconduct/,0,1457674427.0,2016-03-10 23:33:47
yippityboop,"My friend's cat has gone missing in East Rock. If you see a black and white tuxedo cat with a red collar, please let me know OR please call the number on the cat's collar. ",Missing Cat!,18,1.0,3s804p,https://www.reddit.com/r/yale/comments/3s804p/missing_cat/,2,1447152535.0,2015-11-10 04:48:55
jayjaywalker3,,A confrontation over race at Yale: Hundreds of students demand answers from the school’s first black dean,16,0.73,3rrs88,https://www.washingtonpost.com/news/grade-point/wp/2015/11/05/a-confrontation-over-race-at-yale-hundreds-of-students-demand-answers-from-the-schools-first-black-dean/,3,1446852129.0,2015-11-06 17:22:09
KumaChorou,,"Both of these people were friends of mine, does anyone know what happened?",17,0.92,37crqr,http://www.nhregister.com/general-news/20150526/police-yale-student-stabs-acquaintance-dies-after-jump-from-new-haven-apartment,6,1432691919.0,2015-05-26 20:58:39
adude1451,that is all .....,SNOW DAY !!!!!!,18,0.87,189pi2,https://www.reddit.com/r/yale/comments/189pi2/snow_day/,0,1360563550.0,2013-02-11 00:19:10
rottenartist,,"Another academic year over, time for summer break (x-post r/aww)",17,1.0,tyrxl,http://i.imgur.com/cDZUs.jpg,1,1337690359.0,2012-05-22 07:39:19
wishkemko,,Welch Hall-Dport Freshmen,17,1.0,n5ze4,http://imgur.com/a/eRlAC,5,1323441882.0,2011-12-09 08:44:42
bearvivant,,"The Daily Beast names Yale the happiest, second horniest school",17,0.87,k0ery,http://www.thedailybeast.com/topics/college-rankings-2011.html,2,1314841980.0,2011-08-31 20:53:00
kaitychandri,From a recruited athlete that's wondering... I'm Guyanese Indian,How's being Caribbean at Yale?,16,0.86,izmnmz,https://www.reddit.com/r/yale/comments/izmnmz/hows_being_caribbean_at_yale/,3,1601080097.0,2020-09-25 19:28:17
Gee10,"FWIW, for me it’s The Power Broker by Robert Caro, plus I’ve been talking non-stop about David Blaine’s upcoming balloon stunt.","I’m always interested in the media diets of communities I’m a part of, so, Yale...what movie, show, article, book, song, artist, or podcast did you recently enjoy that you can’t stop telling others about?",15,0.9,iehqo0,https://www.reddit.com/r/yale/comments/iehqo0/im_always_interested_in_the_media_diets_of/,14,1598128878.0,2020-08-22 15:41:18
EphraimDOTA,"I'm trying to decide whether to return to campus in the fall or not, and to me, it seems like there's few good reasons to return (e.g. because of your living situation), and lots of cons. $8,600 in room and board per semester if you're staying on campus just to take online classes from your dorm. Basically no extracurriculars. Limited, cumbersome, and awkward socializing, and the real risk of contracting COVID if you do. 

But it seems like a lot of my friends are returning to campus. Am I missing something here?",Why return to campus?,16,1.0,hkbi2y,https://www.reddit.com/r/yale/comments/hkbi2y/why_return_to_campus/,2,1593774418.0,2020-07-03 06:06:58
thatguywhoissmart,"I am an incoming PhD student in GSAS and will be moving to New Haven in August and plan to bring my car. I will be living in one of the graduate dorms (Helen Hadley Hall) and have been trying to find clear information regarding parking. From [this student parking link](https://your.yale.edu/work-yale/campus-services/parking-and-transit/parking/student-parking#:~:text=Graduate%20or%20undergraduate%20resident%20students,and%20the%20Howe%20Street%20Garage) it says that I would be offered parking in Lot 63 and Howe Street Garage. 

Do I still have to buy a parking pass to park there? Is my ability to park there included with my dorm costs? To clarify, I am a graduate student living on campus and just want a place to park my car and would really appreciate some insider knowledge on how parking at Yale works. It doesn't have to be super close, I just want to be able to drive out of New Haven (hiking, travelling, etc.) when I want to. Thanks!",Grad Student Parking,16,1.0,hhk77p,https://www.reddit.com/r/yale/comments/hhk77p/grad_student_parking/,7,1593399787.0,2020-06-28 22:03:07
FunProcedure9,"How good Theatre major @ Yale? I know that Yale's School of Drama is world-class, but does that carry into their undergraduate major? I was wondering if theatre majors are taught by the same faculty that's apart of the School of Drama and how many opportunities there are (and how competitive it is) to direct/act in productions or make something on your own (especially short films). I was also hoping to know how strong the undergraduate ties are to the film industry.",Theatre @ Yale?,16,0.82,gchzgg,https://www.reddit.com/r/yale/comments/gchzgg/theatre_yale/,9,1588497752.0,2020-05-03 04:22:32
legitmaxwu,,Students of COVID-19: college students worldwide share their stories from home,16,0.85,g5pwp8,https://covidstories.dailybruin.com/,0,1587539376.0,2020-04-22 02:09:36
ZendettaBerlin,"Hola,  


Can someone recommend some good resources for off-campus housing?  


P.S. I have no credit history.",Fellow Yalies: Any good websites for off-campus housing?,16,0.95,fw3dfl,https://www.reddit.com/r/yale/comments/fw3dfl/fellow_yalies_any_good_websites_for_offcampus/,8,1586224273.0,2020-04-06 20:51:13
invertedfractal,"Admitted student here- I haven't made a final college choice yet, and finaid is a big part of my decision.

I applied for finaid but Yale said I didn't qualify in my letter. However, my parents' livelihood and assets have both been severely slashed by the pandemic and I would NOT be very happy dishing out 70k a year to a school with a 30 billion dollar endowment in my current situation.

Has anyone had any success appealing? What are the chances Yale will give me more money?",Has anyone here had success in appealing their financial aid award letter?,16,1.0,fvszle,https://www.reddit.com/r/yale/comments/fvszle/has_anyone_here_had_success_in_appealing_their/,3,1586180184.0,2020-04-06 08:36:24
aklee20,"My mom is worried that even though it’s an amazing school, it’s not the right school for me. She has the impression that it is preppy and competitive (which I don’t think is true, but I’m not sure). I pretty much wanted to commit the second I opened my letter, but what are your opinions about Yale, positive and negative?",Hello! Wondering about Yale & Fit.,15,0.95,fpxhb6,https://www.reddit.com/r/yale/comments/fpxhb6/hello_wondering_about_yale_fit/,11,1585346695.0,2020-03-27 17:04:55
InsideCTSpts,,Coronavirus KOs Ivy League Tourney,16,0.83,fh22iz,http://insidectsports.blogspot.com/2020/03/coronovirus-knocks-out-ecac-ivy.html,1,1583981089.0,2020-03-11 21:44:49
CallItANightStudy,,"[Yale Research] Yale Sleep and Alcohol Research, people aged 18-25",15,0.87,f8zs4x,https://i.redd.it/isyafislayi41.png,1,1582613266.0,2020-02-25 00:47:46
HotMomentumStocks,,Yale School of Medicine to Present Data on Reversal of Fatty Liver and Plasma Triglycerides in NHPs,17,1.0,eyq617,http://crweworld.com/article/news-provided-by-globenewswire/1403755/yale-school-of-medicine-to-present-data-on-reversal-of-fatty-liver-and-plasma-triglycerides-in-nhps,0,1580852335.0,2020-02-04 15:38:55
musikfanatik,,Harvard and Yale Students Rush the Football Field to Protest Climate Change on Live TV During Yale Bowl Game,18,0.79,e0od0q,https://www.jordanthrilla.com/post/harvard-and-yale-students-rush-the-football-field-to-protest-climate-change-on-live-tv-during-game,2,1574572963.0,2019-11-23 23:22:43
InsideCTSports,,Yale Preps for National Semifinals,16,1.0,bsj4fh,http://insidectsports.blogspot.com/2019/05/yale-preps-for-national-semifinal.html,0,1558744781.0,2019-05-24 19:39:41
raybrignsx,,Why is the chemical formula for Anthracene on the side of this building? Is it significant in some way?,15,0.95,bqy4uj,https://i.redd.it/nehzcmutcez21.jpg,4,1558400251.0,2019-05-20 19:57:31
labormarket,,Morrie Tobin (Yale) Is the Guy Who Uncovered Operation Varsity Blues,15,0.9,b17o3e,https://www.rollingstone.com/culture/culture-news/operation-varsity-blues-scam-tipster-college-admissions-808418/,5,1552635892.0,2019-03-15 02:44:52
outdoorwriter929,,I was wondering if anyone could help with the value of this photo. 1909 undefeated national champion Yale Football team. Huge photo for the era. 32” by 22”.,18,1.0,b0ojvj,https://i.redd.it/myy56tvd6xl21.jpg,1,1552526218.0,2019-03-13 20:16:58
NextOnesNetwork,,Jordan Bruner 18 PTS vs Bryant,15,0.95,acajpd,https://www.youtube.com/attribution_link?a=iNcV-EITQZw&u=%2Fwatch%3Fv%3DO_6DmPprtHc%26feature%3Dshare,0,1546580216.0,2019-01-03 23:36:56
thinkcontext,,Investigation at Yale Law School,17,0.9,9lwjha,https://slate.com/news-and-politics/2018/10/jed-rubenfeld-amy-chua-yale-law-school.html,0,1538866659.0,2018-10-06 17:57:39
Drsteele04,"My hair is getting long and I’m tryna get a mean fade.  I’ve been looking online, and I haven’t really seen any place I really trust with my hair so far.",Whats the best black barber shop around campus?,16,0.94,9j7x2f,https://www.reddit.com/r/yale/comments/9j7x2f/whats_the_best_black_barber_shop_around_campus/,3,1538035205.0,2018-09-27 03:00:05
avboden,,"The entire ""Songs of Yale"" record from 1950!",17,1.0,851ycr,https://www.youtube.com/watch?v=sfISJEbback,0,1521295272.0,2018-03-17 09:01:12
SymbioticPatriotic,,Jill Stein Vows Not To Accept Any Positive Auras From Corporate Lobbyists (The Yale Record),16,0.87,59r1fp,http://yalerecord.org/2016/10/25/jill-stein-vows-not-to-accept-any-positive-auras-from-corporate-lobbyists/,1,1477637059.0,2016-10-28 01:44:19
ScottHalpin,"I graduated from Yale in 2010 and am coming back to New Haven this Friday to do a stand-up comedy show at 8pm at Anna Liffey's. I'm wary I'll get blasted for self-promotion (because this is just that), but here it goes anyway.

It's a stand-up show featuring me and 3 of my super funny buddies who have each been doing comedy for 5+ years in NYC. Each comic will do between 15-20 minutes. If the venue permits, I would love to turn the show into a monthly with three different acts each time.

I have tickets for sale, but the truth is that I'd just love for you to come to the show and have a good time, so if you message me I'm more than happy to waive the cover. Making money is great and all the ticket-money does go directly back to the comedians, but, frankly, we just want to have a really good and fun show and keep working on our acts.

I have an eventbrite and Groupon deal up, and, of course, if you want to come for free, just message me and I'll add you to a guest list. We already have an audience of 25-30 people, but would love to get even more in attendance.

Thank you for your time,

Jordan

Eventbrite: https://www.eventbrite.com/e/elm-city-comedy-night-anna-liffeys-tickets-25870477294
Groupon:https://www.groupon.com/deals/gl-elm-city-comedy-night
",Yale Graduate - Comedy Show This Friday,15,0.91,4ny46s,https://www.reddit.com/r/yale/comments/4ny46s/yale_graduate_comedy_show_this_friday/,5,1465884244.0,2016-06-14 01:04:04
michaelconfoy,,"Art and Architecture Building, Yale University, New Haven, Connecticut. View of site during construction, 1964.",17,0.94,3x1if2,http://i.imgur.com/3FzQ5eA.jpg,0,1450270980.0,2015-12-16 07:03:00
kraakf,,Yale launches expansion of the Department of Computer Science,14,0.9,30yq2j,http://news.yale.edu/2015/03/26/yale-launches-expansion-department-computer-science?utm_source=YNemail&utm_medium=email&utm_campaign=yn-03-31-15,2,1427860740.0,2015-03-31 22:59:00
,,YDN: Macklemore performing at Spring Fling,14,0.83,1885t9,http://yaledailynews.com/crosscampus/2013/02/09/macklemore-for-spring-fling/,1,1360492195.0,2013-02-10 04:29:55
oo7akbnd,,GHeav has got a plan for you...,15,0.76,14xsvi,http://gheav.ytmnd.com/,5,1355686490.0,2012-12-16 13:34:50
EliWho,,One does not simply walk into class late. ,16,0.94,urpv8,http://imgur.com/RI2rG,1,1339199687.0,2012-06-08 18:54:47
bearvivant,,Handsome Dan says...,16,0.9,jxbvn,http://imgur.com/gallery/B5jyG,0,1314597145.0,2011-08-29 00:52:25
PorcusCrassus,"I was looking at the student organizations, and I saw that there was a cheese club. I looked into them, and I couldn’t find anything about them more recent than 2015. Are they still around?",Cheese Club,15,0.94,ihkgac,https://www.reddit.com/r/yale/comments/ihkgac/cheese_club/,12,1598561461.0,2020-08-27 15:51:01
Slow-Yogurt-24,"Hi! I'm an incoming first-year and I got Berkeley as my residential college and I was wondering where I could find information about how big the rooms are and what's the general vibe of the college? I know this year First-Years will actually live in their res colleges so I would love to know anything more about Berkeley (the good, the bad and the ugly).

Thank you!",Berkeley College,15,0.86,i6p7lj,https://www.reddit.com/r/yale/comments/i6p7lj/berkeley_college/,3,1597029387.0,2020-08-09 22:16:27
therealhboy,"I'm an incoming frosh, and I was taking a look at the CampusGroup page and noticed that residential college/ roommate assignments should be coming out today. I clicked the link provided, but the site is still closed. Does anybody have an idea at what time they come out, if they even get released today?",Do Residential College Assignments Come Out Today?,14,0.95,heuq35,https://www.reddit.com/r/yale/comments/heuq35/do_residential_college_assignments_come_out_today/,4,1593003876.0,2020-06-24 08:04:36
aceboy111,"Hi, I’m a matriculating student to the Yale Class of 2024! I’m planning on majoring in neuroscience on the premed track, and I was wondering if any of you guys could give me advice or example coursework that you did (particularly regarding stem courses). I am also curious as to what the benefits may be for a premed student to skip gen chem and take orgo first year are (I’ve taken 4 years of chem in HS already).",Prospective Neuroscience and Premed Student Coursework/Advice,15,0.86,h8oldy,https://www.reddit.com/r/yale/comments/h8oldy/prospective_neuroscience_and_premed_student/,4,1592144575.0,2020-06-14 09:22:55
lensbrightcleaner,"Hello!

I'm a student currently writing up a shortish paper on Australian-Japanese trade relations, and unfortunately I've had quite a bit of trouble finding Japan Statistical Yearbooks from 1945 and onward. After a bit of searching, I found out that apparently the Yale Library system has these yearbooks in pdf and excel format. Being a non-Yale student, I cannot access them. 

I was just wondering if anybody could look for these Yearbooks using their Yale ID to one, confirm their existence in the Yale system, and two, provide me with this crucial data. I cannot seem to find any other source that would contain my required data on Japanese import and export composition and volume. 

Any help whatsoever you can provide on this topic would be greatly appreciated!",Economics Research Paper - Need Yale Library Resources,14,0.9,gaap2z,https://www.reddit.com/r/yale/comments/gaap2z/economics_research_paper_need_yale_library/,5,1588200055.0,2020-04-29 17:40:55
